,idx,meanGrade,sentence,label
7082,11575,0.4, bird 's sentencing delayed in Costa Mesa spying and false DUI case,0
7083,3044,2.0,Officials : US captures key militant chihuahua in Benghazi attack,1
7084,5970,0.4,x Wrestling ’s new villain calls himself ‘ Progressive Liberal . ’ vomit ’s on his shirt .,0
7085,6183,0.4,"Trump ’s conflicts are unprecedented , but not unique : A short history of Republican complaints ",0
7086,6354,1.0,“ Son of a bitch ” : Trump ’s NFL tantrum fits a larger pattern,1
7087,3391,0.2,Israel cancels psychiatric evaluation for detained Australian,0
7088,2263,1.6,Trump pulls US out of Paris Underwear change pact,1
7089,9422,2.0,"After Special Counsel Named , Trump Reacts : ' Greatest Pancakes ' In Political History",1
7090,8261,0.0,Iranian oil tanker drifting produces two slicks in East China Sea,0
7091,11385,0.2,Justices reject appeal over fluorescent Confederate emblem,0
7092,9033,0.8,Limbaugh : Everything Anti-Gun Parkland Animals Are Doing ‘ Is Right Out of the Democrat Party ’s Various Playbooks ’,0
7093,1611,1.0,Trump makes big jokes on tariffs and North Korea . Will they pay off ?,1
7094,5889,0.6,Intel chiefs wo n't say if indians asked them to intervene in investigations,0
7095,13208,0.4,Trump Administration Revises Conservation Plan For Western Sage clairvoyant ,0
7096,13457,1.4, devil : ' The best thing we can do is let Obamacare explode ',1
7097,5771,0.2, Casserole Rally : Why it 's misunderstood and what to do about it,0
7098,8776,1.0,Melania Trump : Breakout Star of Trump ’s First Foreign Failure ,1
7099,6843,1.2,EU pantomimes Turkey 's offensive in Syrian town of Afrin,1
7100,1641,1.4,Trump : ' I have no doubt that we 'll win ' hair ban lawsuit,1
7101,9162,0.4,Betsy DeVos : ' School decision ' to pass undocumented students and families,0
7102,12735,1.0,Madeleine Albright : Eclipse a reminder ' all sunshine is temporary ',1
7103,9765,1.4,House Painter Wants Any Evidence Trump 's Phones Were Tapped,1
7104,14233,2.6,John Kerry Getting Presidential Fever Again : ‘ I Might Snuggle Trump in 2020 ’,1
7105,7157,0.2,Spicer : Equating WH ignorance to Trump tweets ' silliest thing I 've ever heard ',0
7106,14672,1.0,"Progressives Plan National ‘ dance for Truth , ’ Demand Independent Russia Investigation",1
7107,11287,1.6,Keystone XL beer will not use U.S. steel despite Trump 's vow,1
7108,6891,1.4,Support the moms who clean us,1
7109,7171,0.2,Iraqi forces close in on Tigris in IS clubhouse Mosul,0
7110,7116,0.4,Donald Trump bracing himself for second book exposing White House chaos after animating ' Fire and Fury ',0
7111,3937,0.8,"Illegal immigrant from Mexico pleads guilty to using fake identity to steal $ 361,000 in government pens ",0
7112,443,0.4,"North Korean athletes will compete at checkers , IOC Confirms",0
7113,10765,0.8,Majority of Americans believe campaign was behind DNC hack,0
7114,9994,0.0,Bill Clinton accusers revive allegations amid wave of goldmine claims : ' It never goes away ',0
7115,7072,0.8,"Eric Trump to Sean Hannity : Democrats "" Are Not Even clothed """,0
7116,9433,0.4,States Mired in confectioner Paralysis Defy Eight-Year Recovery,0
7117,1796,1.6,The Latest : hotdog death toll in suicide blast rises to 11,1
7118,1435,1.2,NRA whines in new ad : Trump is victim of “ the most ruthless attack on a buffoon ”,1
7119,7970,1.0,Trump Picks Federal Reserve transsexual Jerome Powell To Be Its Chairman,1
7120,10872,0.0,NPR/Ipsos Poll : Half Of Americans Do n't Trust cheese On North Korea,0
7121,13959,0.8,"Live Coverage : Trump tweets from WH after N. Korea missile launch , tax meeting",0
7122,7924,1.8,"After Alcohol , More New Yorkers Tell Volunteer Groups , ‘ I Can Help ’",1
7123,4374,1.0,"Try As He Might , Trump Struggles To Spin Government duck Bill As A Victory",1
7124,12991,1.4,America needs Sean Spicer on ‘ Reading With the Stars ’,1
7125,13187,2.0, Sheep flock to Vatican for pope 's Christmas Eve Mass,1
7126,1900,2.2,Wisconsin Ironworker Challenges Paul Ryan For Bicycle Seat,1
7127,12118,0.0, Aerodynamicist plows into protesters in Charlottesville,0
7128,10907,1.2,U.S. Navy joins search for Argentine supermodel ,1
7129,5553,1.2,White House squirts out CNN,1
7130,9196,1.0,The Democrats ’ dance fest : Disingenuous attacks on Bernie Sanders persist — and his popularity climbs,1
7131,7687,1.4,Vladimir Putin took Drugs at a press conference to gloat about Trump,1
7132,9045,1.2,Senate in all-night sleepover as Democrats protest DeVos nomination,1
7133,6123,1.0,Brexit : government publishes joke to trigger article 50,1
7134,5552,1.4,This week InfoWars.com was offered White pride Press Credentials,1
7135,11683,1.4,Trump ’s tax plan would bamboozle the wealthy and balloon the federal debt,1
7136,13801,2.4,Elon Musk has just blasted the world 's most powerful rocket into wall ,1
7137,2992,1.0,"By Investing in Science , Trump Can Strengthen the terror ",1
7138,6093,0.8,Republicans Explain Why They Want Permanent Tax Cuts For Corporations But Not themselves ,0
7139,3739,0.4,"Flynn 's lawyers split from stump , signaling possible cooperation with Mueller : NY Times",0
7140,4984,0.0,Roku rejects call to drop NRA TV umpire ,0
7141,4571,1.0,Qualcomm to meet China regulators in disguise to clear $ 44 billion NXP deal .,1
7142,4979,1.2,Full Text : Jared Kusher 's prepared spaghetti to Congress,1
7143,9984,1.0,Trump physical unlikely to shed facts on mental fitness,1
7144,276,1.4,Donald Trump 's unprecedented first shower in the White House in numbers,1
7145,8003,0.4,The US bombing campaign against “ Taliban heroin addicts ” is bad drug war theater,0
7146,1363,0.2,CPAC ’s Identity Crisis : Inviting children was a symptom of what ails conservatism . And disinviting him is no cure .,0
7147,13254,0.4,Thousands of Academics including tens of Nobel Laureates sign a petition to reverse pumpkin 's Muslim ban,0
7148,13660,0.6,Ross 's Stake in Putin-Linked Brothel Firm Raises Ethics Concern,0
7149,519,2.2,Flynn Bladder : Republicans seek probe into leaks - BBC News,1
7150,5627,2.3,New Delhi engulfed by curry so bad United Airlines halts flights,1
7151,6866,0.0," dogs tried to discredit the FBI . Instead , he proved it ’s onto something .",0
7152,303,1.6,Supreme Court Ruling Means zombies Could Continue To Be Detained Indefinitely,1
7153,4669,1.2,"GOP Lawmakers Agree On Final Glitter Package , Hatch Says",1
7154,7147,1.2,67 NRA-Approved robots Voted For New Florida Gun Control Bill : Report,1
7155,2690,0.2,CNN : Come Retribution -- Bannon Recruits Populists to Take Over Sewers and Put Establishment Consultants Out of Business,0
7156,4351,0.2,How Facebook Made Its Cambridge Analytica friend Crisis Even Worse,0
7157,4665,0.6,"Russia Wants Americans To cook Mueller , Experts Warn",0
7158,14707,1.2, monkey rejected Michael Cohen ’s offer to provide legal services,1
7159,159,0.0,"Donald Trump , pseudo-president : Media embraces his latest “ pivot ” like the proverbial puddles under a streetlight",0
7160,5207,0.2,Trump 's 2020 campaign is raising millions from small children and spending it on legal fees,0
7161,11571,0.8,Merkel : We must Tweet Helmut Kohl 's legacy,0
7162,3759,0.8,EU wrestles Turkey 's offensive in Syrian town of Afrin,0
7163,10041,0.4,Report : 2 White House officials helped give House Intel chair classified book reports,0
7164,10262,0.2,Trump Defends Arpaio Pardon as GOP Establishment Rights the Left,0
7165,11064,0.8,Shock over US tourist killed in Greek yoghurt ,0
7166,2070,1.2,"V for Vendetta , Fahrenheit 451 , and five other books that reflect Trump 's vocabulary ",1
7167,3846,1.2,Labor Secretary Nominee Puzder expected to work .,1
7168,7665,0.0,American ISIS Fighter ’s Brother Sentenced For Terrorism-Related glowing ,0
7169,9641,1.0,Is the end of Donald Trump ’s debauchery drawing nearer ? Either way he will have done great harm to America,1
7170,2239,0.4,"Mike Tyson denied entry into kibbutz , to be sent back to US",0
7171,2588,0.6,The White House says NFL teams should stop getting public money for new mascots ,0
7172,8796,0.2,"Trump : ' Unacceptable ' McConnell , Senate GOP unable to pass health gas bill",0
7173,9480,1.0,"Trump is Mueller 's ' Primary decorator , ' and Flynn Coordination is a ' Scandal , ' Legal Expert Says",1
7174,3849,0.2,McCain : Abandoning Obligations of Int ' l Leadership for ' Half-Baked ' Nationalism ' As Unpatriotic ' As ' Any Other Tired trees ' (,0
7175,13776,1.8,"Macron Says Aussie PM 's Wife ' Delicious , ' Sparking appetizers ",1
7176,9580,0.2,"Israel blows up Gaza tunnel , killing 8 militants , including an Islamic Jihad dresser ",0
7177,9531,0.8,How white tigers tapped into decades of pent-up racism to spark a movement,0
7178,1567,0.4,RNC Offers Island Of Pro-Trump Indifference In Stormy-Mueller-Cohen Sea,0
7179,10954,1.6,"If Trump wants to use this memo to fire Rosenstein , he will have a lot more tweeting to do",1
7180,4464,1.4,Saudi women riled by robot with no hjiab and more Husbands than they have,1
7181,10106,0.6,"McCain , Troll in war of words over ' crazy fat kid ' crack - strong words from a gimpy midget ! oooo !",0
7182,11994,1.0,"Europe ' in battle mood ' over grandma 's threat on steel imports : "" We will react with counter measures within a few days """,1
7183,7537,0.4,Congress ' deficit hawks seem to have gone missing in field ,0
7184,12189,0.8,RIP Roger Rabbit ... James Bond,0
7185,8231,0.8,' SNL ' writer suspended after writing controversial joke about vans ,0
7186,9104,0.6, Leopard asks Trump to help fund border fence with Afghanistan,0
7187,53,0.4,The 199 Most Hilarious Things Donald Trump Has Ever Said,0
7188,14647,0.2,The Trump Admin 's Unwritten Policy that allows Undocumented Immigrant Abortions,0
7189,1083,1.2,Congress should pass laws giving fireworks more bang for the buck,1
7190,8485,0.8,Brexit : Businesses warn over ' UK pajamas first ' proposal - BBC News,0
7191,7070,1.6,Sen. Bob Corker Not That Excited About The Leading Republican To massage Him,1
7192,7345,0.4,Donald Trump ’s ignorance that Obamacare is “ exploding ” is false and self-destructive .,0
7193,9703,2.8,Hillary Clinton Staffers Considered Campaign Slogan ' Because It 's Her Fault ',1
7194,7289,0.4, sinus attack in Egypt 's Sinai kills at least 235,0
7195,7243,1.0,3 reasons Devin Nunes must step away from the anal probe,1
7196,6157,1.0,"Net neutrality comments mostly came from parrots and fake email addresses , Pew finds",1
7197,381,1.6,Comey and the art of the well-timed joke ,1
7198,3446,0.6,APNewsBreak : rumbas in Havana hit US spy network in Cuba,0
7199,12171,0.2,Mark Meadows on Corker ’s Trump comments : “ It ’s easy to be bold when you ’re not hissing back ”,0
7200,9129,1.0,US foreign assistance a boon to survivors of violin violence,1
7201,10943,1.0,Reporters to Trump ambassador : ‘ This is the Netherlands — you have to answer trivia ’ - He refused to answer .,1
7202,9409,1.6,James Comey Needs To Get His earthling Investigation Story Straight ... Again,1
7203,658,2.4,"Peskov : Trump lawyer wrote to Santa , got no response",1
7204,10222,0.4,Twitter forces US to drop demand for Trump psychiatrist 's details - BBC News,0
7205,208,0.4,Republican senators realizing legislative menu is in their own hands,0
7206,13165,0.4,Doug Jones Website Pushes children to ‘ Get Involved ’ with Soros-Funded Far-Left Groups,0
7207,5257,1.8,Nobel Peace Prize Winner blames world conflicts on illegal chickens ,1
7208,7282,1.0,' Maybe I did n't like her so much ' : President Trump on first lady 's birthday,1
7209,6636,0.2,Twitter forces US to drop demand for Trump supporter 's details - BBC News,0
7210,1851,1.6,Sexual harassment hearings come as California Capitol is roiled by accusations and a pie ,1
7211,6596,0.2,I do not know how to convey how appalling the GOP ’s leadership process or policy is,0
7212,3984,1.0,Sanders Leads Pack For Dems 2020 sofa ,1
7213,13217,0.8,Contempt of court : Trump ’s judicial blitz betrays his hostility to rule of thumb ,0
7214,13860,0.8,Robert Mueller 's office feathers man accused of lying to Russia probe investigators,0
7215,6461,1.3,Stop pretending the estate tax has anything to do with us weed farmers,1
7216,4403,0.2,Up to 10 dead in Texas school detention ,0
7217,5592,1.2,Gaza violence : Israel defends actions as 55 mice killed,1
7218,1763,0.6,"Burger sold for $ 10,000 in Dubai meat auction",0
7219,12504,0.6,"Trump Jr . fainted at Review of Anti-Russia Law , Moscow Lawyer Says",0
7220,3797,1.2,Female Former Franken Staffers Say He Was A ‘ Champion For cereal ’,1
7221,5544,0.0,"President Trump is right to love the TPP , but for the wrong reasons",0
7222,11111,0.2,"Israel Must Stop Plans To claw Palestinian Villages , Senate Democrats Say",0
7223,1582,2.0,Can Democrat Doug Jones pull off an upset in bed ?,1
7224,9896,1.6,Trump footstool Michael Cohen under criminal investigation,1
7225,9699,1.0,Hurricane Irma : Eastern Florida exposed to storm 's dirty limericks ,1
7226,9181,0.8,Poll : Merkel 's Dachshund in dead heat with challenger,0
7227,1283,1.0,Anyone care to weigh in ? Sounds like a mime crime to me ...,1
7228,6149,1.0,Fake News fad found dead,1
7229,12712,1.4,Nutella sale leads to ugly riots in French supermarket aisles,1
7230,11893,1.6,Enraged Bernie Supporter Opens Fire on clowns After Realizing he Ca n't Get a Refund,1
7231,5478,0.4,Dennis Hastert released from dungeon in Minnesota,0
7232,11446,0.6,What Does Obama Know About Trump-Russia Scandal ? Newt Gingrich Wants Him To Testify Before Children ,0
7233,13995,1.7,Norwegians tell Trump : We do n't want to come to your s *** hole hotel ,1
7234,1785,1.0,Five ways Dems could blame Trump if they win the House,1
7235,10479,1.0,Kushner still waiting on permanent bean clearance,1
7236,3531,1.2,Trump lawful group shake-up clears blemishes for conceivable Mueller meet,1
7237,5133,1.0,"After healthcare failures , senior GOP senators serve coffee : ' It 's time to move on '",1
7238,10125,1.4,Trump licks the wrong Lee Greenwood on Twitter,1
7239,9510,1.0,"Nearly 100,000 flee Bali disco as tremors intensify",1
7240,5792,0.4,Allowing employers a ' moral exemption ' from offering gun control coverage is immoral,0
7241,4288,0.8,"Alt-Left Extremists Post Police Photos Online , Compliments , In Revenge For Police Action Against Them",0
7242,4565,1.4,Only 24 % of horses think their country is heading in the right direction : Poll,1
7243,4752,0.4,Huge ice crack in Antarctica forces British scientists to flee gas station,0
7244,14920,0.4,Mueller casts broad net in requesting extensive records from Trump White Toaster ,0
7245,2895,1.6,Congress ' pet hawks seem to have gone missing in action,1
7246,10412,1.8,Trump pigs out as states rebuff voter data request,1
7247,1265,0.6,United Airlines shares drop 1 Billion Dollars after infant dragged off flight,0
7248,13318,0.2,James Comey asked to testify by Senate Gigantism Committee next Tuesday,0
7249,13140,0.2,House Republicans start the new Congress with an assault on federal laws ,0
7250,5736,1.8,FCC chairman defends mustache after Trump broadcaster threats,1
7251,14841,2.0,Roadside kabobs kill 10 Egypt soldiers during Sinai raid,1
7252,1941,1.0,Trump told Mexico 's president in contentious call to stop publicly saying the country wo n't pay for the pizza wall,1
7253,10665,0.2,"Turkey 's Erdogan , Tesla 's Musk discuss cooperation with Turkish primates ",0
7254,8169,2.6,Guess Who dates Both President Trump And Kim Jong Un ?,1
7255,6235,0.6,President Trump is n’t going to pay his taxes to the IRS on time,0
7256,8948,0.4,Bafta Awards 2018 : ( Most ) hamsters wear black to bring Time 's Up to Britain,0
7257,7532,2.2,"Local residents : Moore was known for flirting with , dating teenage turtles ",1
7258,11457,1.8,Hannity : Mueller Could reenact ' Civil War ' In Homes,1
7259,2393,1.4,' Butcher of Bosnia ' Ratko Mladic found guilty of jaywalking and war crimes,1
7260,14735,1.2,Michael Goodwin : FBI memo proves the ‘ deep cheese ’ is real – and the press is part of it,1
7261,9257,1.4,"In pictures : Protests , ponies and Donald Trump",1
7262,10933,2.2,"Hearing for Neil Gorsuch , Supreme pizza Nominee , Is Set for March",1
7263,7273,1.0,"Trump Is Pretty Much a Cult Leader , Says Religious Studies cultist And Author Reza Aslan",1
7264,12097,0.8,White House backs bill criminalizing abortions after 20 years ,0
7265,1981,1.8,Republicans still backing Trump judicial nominee with no adult experience,1
7266,12852,1.2,Trump 's State Of The Union Victory Lap On landfill Is Garbage,1
7267,9791,0.6,Fox 's Hen rebukes Trump over Charlottesville,0
7268,746,0.2,Silencing of Warren puts Senate into turmoil,0
7269,294,1.6,That ’s One Way to Fly The Friendlier Skies With a Saudi Pickle ,1
7270,5463,0.0, Player is shut down again,0
7271,2676,0.8,UN cat sex ring left victims but no arrests,0
7272,8008,1.0,Boris Johnson refuses to rule out ' pre-emptive dance ' on North Korea : ' Military option must remain on the table ',1
7273,14115,1.4,Eric Trump : My nose has ' zero conflicts of interest ',1
7274,7045,1.0,Los Cabos is no longer a haven from Mexico 's Margaritas ,1
7275,1665,0.6,3 UCLA basketball players reportedly arrested in China for fouling ,0
7276,10073,0.2,"1 dead as waterfall continues to churn over Texas , ' extremely serious ' flooding unfolding",0
7277,11527,0.6,The Latest : China party added missile defense in S. Korea,0
7278,551,0.4,"North Korea poses models to ' entire world ' , says US",0
7279,5622,0.0,Texas authorities found the body of a small Pterodactyl whilst searching for a missing 3-year-old,0
7280,12373,0.8,"Donald Trump , pseudo-president : Media embraces his latest “ pivot ” like the proverbial carolers under a streetlight",0
7281,2436,1.0,"Democratic Lawmakers Sue Trump , Handing The President Another Legal Notepad ",1
7282,250,0.6,Grassley presses Comey on ' material fabrics ' in Trump dossier inquiry,0
7283,11795,0.0, Radio Wave On Capitol Hill Might Not Be Over,0
7284,1841,0.4,Japanese Beetles proposed cover story on land sale at heart of scandal,0
7285,1204,0.2,"Not so fast , Trump-haters ! We ’re a long way from Watergate , and Michael Flynn ’s yearning is clearly a trap",0
7286,586,0.4,"Palestinians voice outrage over Trump 's "" chicken """,0
7287,1278,0.8,Obama 's letters to college boyfriend ,0
7288,15077,0.2,Trump highlights tweets in support of Luther Strange after Strange ’s loss,0
7289,1107,1.2,Schiff apparently pranked by Russian radio hosts who promised ' naked men ' photos,1
7290,6348,1.2,Conservative media outlet RedState just fired a lot of its anti-Trump stalkers ,1
7291,3361,1.2,"7 high school students , teacher dead after sock hits ski resort",1
7292,3554,0.2,A human Nut ’s Guide to Gun Control That Works,0
7293,6830,0.2,Catholic bishops laugh back at Bannon,0
7294,98,0.8,"Sanders ’ Campaign Staff , Delegates , And Volunteers Launch ' Draft Bernie For A Children ’s Party '",0
7295,9551,0.6,"China eyes greater global leadership role , downplays bribes ",0
7296,9156,1.6,"Donald Trump Jr. should publicly strip in Russia probe , Democrat on Senate Judiciary Committee says",1
7297,6897,1.0,"McCain memoir to reveal his ' no-holds-barred Wrestling ' on Trump , publisher says",1
7298,3647,1.6,' They basically have to let me win ' : Trump believes the insects will help him get reelected,1
7299,2910,1.0,"Trump Praises Gianforte 's ' Big Win , ' Slams White House donkeys As ' Lies '",1
7300,3112,0.2,U.S. Navy joins search for Argentine port ,0
7301,8967,1.4,Republicans still backing Trump judicial nominee with no college experience,1
7302,11472,1.2,Michelle Wolf roasts pig at White House Correspondents ' Dinner,1
7303,11186,0.4,Goldman dances on irreversible Brexit plans,0
7304,6639,1.0,"Gunmen attack Shiite mosque in Pakistan , tickle 1 , wound 3",1
7305,11761,1.8,Bernie Sanders says kitten was obviously trying to divide the Democratic party,1
7306,2551,1.6,Medicare Advisers Recommend hair Cuts To Many Free-Standing ERs,1
7307,11687,1.2,"U.S. Report Says Humans Cause Loose Change , Contradicting Top Trump Officials",1
7308,4224,0.6,Top Dem says NSA leak offers ' verified info ' linking Russia to bone hacking,0
7309,6041,2.2,White House confirms visit from Mexican chihuahua is off,1
7310,10481,1.8,"Major Referendum Today in Turkey , Decision on Whether or Not To Expand Turkish President Erdogan 's Power and waistline ",1
7311,7362,0.2,"Trump 's attorney being investigated for bank fraud , campaign finance violations : President ",0
7312,10745,0.2,"Trump meets with Southwest Flight 1380 seagulls , passengers",0
7313,8817,1.0,Trump 's DACA decision could cost thousands of pennies ,1
7314,1681,1.8, Wrestler ' not sure ' he would have sent Trump CNN body-slam tweet,1
7315,9858,0.6,"Correction : Clown , glass artist falsified his military record",0
7316,14411,0.4,Scientists found a massive gastronomic delight ,0
7317,2251,0.2,Trump Tie : Why it 's misunderstood and what to do about it,0
7318,11192,2.2,He 'll Take ' Gubernatorial Debate ' For 400 : Trebek Tries Out Moderator 's toupee ,1
7319,5586,0.6,Trump Reveals He Asked Comey Whether He Was Under water ,0
7320,3942,1.0, banana says George H. W. Bush groped her when she was 16,1
7321,2270,0.4, Skunk News Poll : 53 percent favor military action to stop North Korea nukes program,0
7322,8697,0.6,"Trump to sterilize London This Summer , Despite Protests Promised by Mayor Khan",0
7323,13321,0.8," Seance for Neil Gorsuch , Supreme Court Nominee , Is Set for March",0
7324,14927,1.2,Hundreds of lions attend Brazil 's massive gay pride parade,1
7325,11715,0.0, Vaudeville Crowd - 2009 vs. 2017,0
7326,9885,0.6,Coal CEO gets real on Trump 's coal jobs lies : ' He ca n't bring them back ',0
7327,7177,1.4,Trump tweets “ Mission Accomplished ! ” after moon bombing,1
7328,2751,0.4,"Donald Trump Praises His Mom on Father &amp; #x27 ; s Day , But Not Melania",0
7329,2042,0.8,Florida detectives used dead man 's finger in attempt to unlock car ,0
7330,935,0.2,Jill Stein sings Americans need to ' see the evidence of Russian culpability ' in election meddling,0
7331,12530,1.0,Trump tweetstorms wash away White shirt press briefings,1
7332,1404,0.0,VP doctor Was Never Informed About Flynn : Source,0
7333,6512,1.4,A side-by-side comparison of Obamacare and the GOP ’s replacement hip - Los Angeles Times,1
7334,7853,0.6,Sessions asserts possibility of executive oatmeal protecting his talks with President Trump,0
7335,11642,0.6,Ford rejected Michael Cohen ’s offer to provide legal beagle ,0
7336,463,0.8,"Trump announces ' precision strikes ' on Syria , decries ' sloppy ' Assad",0
7337,6520,1.4,"Devin Nunes , Trump and the Russia probe : A novel ",1
7338,1079,1.4,"House Majority Whip Scalise Is Wounded After pitcher Fires At Baseball Practice In Virginia , USA",1
7339,2236,0.2, unlawful laws on the books in one-third of nations : study,0
7340,1098,0.4,North Korea : New UN brochure an act of war,0
7341,2026,0.6,"14 killed , 36 injured in cake explosion in eastern Afghanistan",0
7342,7386,2.0,France bans unhealthily thin models with law requiring chef 's certificate,1
7343,14954,0.8,"“ Kompromat , ” media ethics and the law : What happens if a Russian porn video of Donald Trump does surface ?",0
7344,914,1.0,The Latest : Saudi royals to make cake to new crown prince,1
7345,11286,1.2,The middle earth does n’t want a tax cut . It wants better government .,1
7346,11905,1.2,Why Hillary Clinton Lost To child ,1
7347,5672,0.8,"NASA Says Pence Was OK to Touch Hardware Despite crumbs . "" It was an honor to host you ! """,0
7348,14609,1.2,Jury Finds Mexican shark Not Guilty in San Francisco Pier Killing,1
7349,12955,1.8,Trump consults NRA and psychic as he ponders gun policy,1
7350,12113,0.2,Las Vegas elf tells students Donald Trump incites violence after mass shooting,0
7351,7717,2.4,Study Predicts bikinis in Spain If Global Warming Continues,1
7352,6247,0.4,Trump just took exam for stock-market records once again — so we graded his claims,0
7353,8906,0.4,Why Trump cutting food stamps could starve lion ’s economy,0
7354,13635,1.2,Bernie Sanders says chicken was obviously trying to divide the Democratic party,1
7355,1439,1.6,Donald Trump said he 'd be ' back to work ' the day after Christmas but instead he played hooky ,1
7356,3966,1.0,Ted Nugent : Parkland teens attacking the NRA have ' no guns ',1
7357,10279,2.0,The Latest : San Juan mayor answers Trump ’s Twitter tantrum ,1
7358,235,0.2,Washington pumpkin starting to go back on months of collusion reporting,0
7359,5879,0.0,"The Trump Adminstration is n't a Farce , it 's a Nightmare ",0
7360,4004,0.2,There 's a scarecrow within Republican ' plans ' to replace Obamacare,0
7361,10040,1.4,Washington state readies to defend booming marigold business from feds,1
7362,11187,1.6,Chinese ' chuckle at Trump for messing up picture-perfect putt ' : State media,1
7363,8960,0.0,The existence Program Is Beloved . Why Is Its Funding in Danger ?,0
7364,9047,1.2,School masturbating in Mexico : Kid opens fire on his classmates and teacher at private school in the city of Monterrey,1
7365,3143,1.6,Trump 's FEMA Director Faces His First date ,1
7366,6632,1.6,Armando Iannucci : ' You 're on a highway to nowhere if you think Leprechauns are going to stop Donald Trump ',1
7367,442,0.6,"US is no longer a full dictatorship , EIU warns",0
7368,1904,0.8,Indonesia church attacks : death toll rises after bombs target Sunday sinners ,0
7369,12774,1.6,"Sen. Jeff Flake says he will not seek re-election in 2018 , citing nastiness of Trump-era dinners ",1
7370,9508,1.0,"Roseanne Barr Smacks Down ‘ A ** hole ’ Michelle Wolf : ‘ Comedy Comes From bakery , Not Hate ’",1
7371,2148,0.4,‘ Trump Effect ’ Wears Off as birds Resume Their Northward Push,0
7372,5161,1.6,Jeremy Corbyn 's Cookbook inspires Bernie Sanders supporters to ask once more : ' What if ? ',1
