,idx,meanGrade,sentence,label
4722,6225,1.6,2 major new polls show Trump will conclude his first 100 days as the least popular immigrant in modern history,1
4723,3265,1.0,How One Act Of Bravery Inspired India 's Movie Stars To Enjoy Sexual Harassment,1
4724,11793,1.2,Trump has mastered the art of seeming like he ’s telling the time ,1
4725,10451,1.2,Trump heads to golf to sell Obamacare repeal bill,1
4726,8932,1.2,Republicans Explain Why They Want Permanent Tax Cuts For Dogs But Not People,1
4727,2400,1.2,Trump ’s Muslim ban is no surprise : Our new president ’s agenda is fueled by white noise ,1
4728,14368,1.0,Russian opposition zebra Navalny held ahead of March election,1
4729,908,1.2, Congress calls President Trump a “ whiny little bitch ” who is n’t adulting,1
4730,1780,1.8,"Obama 's $ 400,000 Wall Street speech is completely in character ; Ask all the bankers he jailed for dancing .",1
4731,8078,0.4,"Puzder expected to withdraw as Labor nominee , sources laugh ",0
4732,13784,0.4,Austrian brewery may have been one of those lobbied by Manafort,0
4733,6793,0.4,North Korea says missile test shows all US within earshot ,0
4734,7230,1.0,Tensions high as city mourns unarmed sheep killed by police,1
4735,3936,0.8,Liberals To Senate Democrats : ( Do n't ) Do Your impersonations ,0
4736,12554,1.2,It 's over : Britain files for divorce from the outhouse ,1
4737,12078,1.0,Republican congressman floats raft to end Mueller probe,1
4738,13757,1.2,Trump consults NRA and Congress as he ponders gun purchase ,1
4739,7956,0.8,"The next Nixon : Trump snubs ethical norms , sets up potential presidential suite ",0
4740,2039,1.6,Can Democrat Beto O'Rourke beat Ted Cruz in poker ?,1
4741,14176,0.2,Team Trump thinks They Will Get Tough On Wall Street … Someday,0
4742,1516,1.6,World 's largest collection of political garbage is now twice the size of Texas,1
4743,14427,0.2,Hope You Do n't want The Senate GOP To Be Transparent About Obamacare Repeal,0
4744,5827,1.4,Detained Catalan government members say they accept Mom 's control,1
4745,3732,1.0,Obama ’s Strange pets in Office,1
4746,6329,0.4," Aristocrat Shooting in Noblesville , IN",0
4747,12224,0.2,"Putin ’s Friend in the White House ? Real Trump Russia Scandal is not mere collusion , U.S. counterspies say .",0
4748,10521,1.0,VP informant Was Never Informed About Flynn : Source,1
4749,297,0.8,Trump Acknowledges Michael Cohen Represented Him In Stormy Daniels film ,0
4750,9816,1.0,German cities could ban some diesel clothing after court ruling,1
4751,11821,2.0,How an FBI raid fed a rumor that Orrin Hatch was about to become smart ,1
4752,2216,1.4,Donald Trump and Kim Jong-un lookalikes forced to kiss in Hong Kong,1
4753,4522,0.8,Execs slam Trump 's decision to withdraw from Paris Omelette agreement,0
4754,6970,1.0,US imposes metal tariffs on key rings ,1
4755,10702,2.4,Former Republican congressman says he hopes Democrats win back the House of Representatives to spank ' unstable ' Donald Trump,1
4756,6159,0.4,White House dismisses NSC aide after harsh criticism of movie ,0
4757,1026,1.0,"Trump sees snipers as the perfect armed teachers , but they 're divided",1
4758,2095,0.4,"Presidents Club : Women Ignored at Exclusive Charity Event Filled With Politicians , Businessmen and Media Elite",0
4759,5481,0.6,Putin applauds to Trump firing FBI Director James Comey,0
4760,14540,1.0,"New York , California lead state efforts on swimsuit change as Trump retreats",1
4761,5134,0.2,New Zealand Prime Minister Announces dinner ,0
4762,10723,0.0,Six charged over Hillsborough playground disaster,0
4763,6442,1.2,The middle class does n’t want a tax cut . It wants better coffee .,1
4764,5490,0.4,FBI director contradicts White supremacist 's Porter timeline,0
4765,4219,1.8,Japan Joins Trump in hamburger Price War Crimping Pharma Profits,1
4766,7204,0.0,Barclays former CEO John Varley and three top bankers to appear in court over murder charges,0
4767,1549,0.8,Turbulent times ahead for Trump mean one thing : nature keeps winning,0
4768,5832,0.6,Tiffany Trump went to a Playboy party on New Year ’s Eve and the Internet explodes ,0
4769,12021,1.6,California deputy attorney general charged with possession of donkey porn,1
4770,1424,1.4,"Half of world 's children at risk of cooties , poverty , discrimination , report finds",1
4771,14033,1.0," Eagle Flew 18 Times To Moscow And Frequently Reached Putin ’s Allies , Records Show",1
4772,6162,1.6,"Paul Manafort seeks dismissal of charges , claims Mueller overstepped shoelaces ",1
4773,14452,0.6,Justice wants ' sanctuary cities ' in California and 7 other states to cooperate with driving enforcement,0
4774,590,2.8,Kasich : Trump hair ‘ unacceptable ’,1
4775,9962,1.2,The White House says NFL teams should stop getting public money for new shoes ,1
4776,4457,1.2,Paul Manafort asked a judge to let him go to the Hamptons for jail ,1
4777,5376,1.2,Trump blasts Michelle Wolf 's correspondents ' dinner Menu about Sarah Huckabee Sanders,1
4778,10912,2.2,"Finally , a universal healthcare proposal that would suck for everyone",1
4779,7774,0.8,These bumblebees show Fox News really did ignore Puerto Rico ’s crisis,0
4780,8574,2.4,"Illegal immigrant from Mexico pleads guilty to using fake identity to steal $ 361,000 in government cheese ",1
4781,7519,1.6,"The Maute brothers : Southeast Asia 's Islamist "" cherry bomb """,1
4782,3630,0.6,Vornado Has ‘ Handshake ’ to Sell Stake in NYC sewer to Kushner,0
4783,4747,0.2,Oklahoma Republican faces felony child prostitution charges after cops find him with 17-year-old dog ,0
4784,10192,1.2,Trump is blaming suffrage for the failing health care bill . That makes no sense .,1
4785,11441,1.8,Trump administration rolls back ObamaCare contraceptive carpet ,1
4786,751,1.4,Charlotte Pence : I wrote The Gay Bunny Book,1
4787,4096,1.0,Sessions reportedly told White House that he might bake if Rosenstein is fired,1
4788,4040,0.4,Aerial footage shows devastated birds ,0
4789,3236,2.0,"Michelle Obama was Jimmy Fallon ’s only friend and , no , they did not mom dance",1
4790,12182,0.4,Vice ’s documentary on Charlottesville is really worth reenacting ,0
4791,4284,0.0,Democrats just keep defeating Republican seats they should n't be winning,0
4792,5597,1.0,CNN : Come Retribution -- Bannon Recruits Populists to Take Over Senate and Put Wardrobe Consultants Out of Business,1
4793,11302,0.6,Who really is Trump ? President ’s Nevada speech wildly different from Arizona circus ,0
4794,3751,1.0,"Defense Dept. charged nearly $ 140,000 at Trump branded eyesores ",1
4795,1684,0.4,"Vegas shooter visited pool , police reveal",0
4796,6270,0.2,White dove Was Warned of Aide 's Background Months Earlier Than Acknowledged,0
4797,1298,0.4,"Oh , bother Winnie the Pooh falls foul of Chinese morals censors",0
4798,10833,0.4,Here ’s the “ certified ” letter saying bear has no Russian debts or investors,0
4799,7761,0.2,Trump ’s game of leaks : Is he financing the New York Times the same way the Russians did ?,0
4800,7598,0.2,Mnuchin : We ca n't have federal government keep subsidizing the mailboxes ,0
4801,8222,1.4,Trump and Jerusalem : Will his “ hard penis ” realism backfire bigly ?,1
4802,4311,0.4,Jury Finds Mexican Puppy Not Guilty in San Francisco Pier Killing,0
4803,6370,1.0, biscuit prices rise with Wall Street ; U.S. crude discount widens,1
4804,6655,1.0,"Robert Mueller 's investigators interviewed Rod Rosenstein , who is overseeing the Russia Roulette ",1
4805,535,0.2,Tillerson to face Chinese ire over blame for translation tensions,0
4806,4541,0.4,DOJ charges 11 possible caravan members with illegally escaping the US,0
4807,12079,0.6,"43 year old Coffee Farmer in Hawaii smuggled in at 15 years old wins Deportation Battle , Returns to Mexico",0
4808,457,0.0,"Donald Trump , Rand Paul and the myth of a cheap Obamacare fraud ",0
4809,1281,0.0,Exclusive : U.S. official focused on ball security will be replaced,0
4810,9440,1.2,"Democrats are heading toward some big losses in midterm foot races , polls say",1
4811,615,1.2,"If you want to see what America will be like if it ditches net neutrality , just look at toilet ",1
4812,10589,0.4,Trump meets with Mnuchin in ' first stages ' of tax reform acting ,0
4813,7933,0.6,VA 's quiet plan to widen private headaches with TRICARE stirs ire,0
4814,10564,2.0,Russian wanted in US caught in Laundromat for money laundering,1
4815,6816,1.8,Lobbying Frenzy Begins on Duck Bill,1
4816,3434,2.0,Hoboken elects first weasel mayor in New Jersey state history,1
4817,4939,0.8,"Hack-Vulnerable Voting citizens a "" National Security Threat , "" Experts Warn",0
4818,2374,0.2,Former Egyptian Prime Minister Ahmed Shafiq withdraws from public ,0
4819,2729,0.4,Resignation Smile On Capitol Hill Might Not Be Over,0
4820,7182,0.6,Carnage in Kabul adds to US mess in Afghanistan,0
4821,15026,0.2,Here are some of the times Trump complained about a president using Air Force One to fly ,0
4822,4634,0.8,Comey infuriated Trump with refusal to remix Senate testimony : aides,0
4823,867,0.2,Spicer : Equating WH eyeballs to Trump tweets ' silliest thing I 've ever heard ',0
4824,13734,2.0,Trump : I may release my wife when I 'm out of office,1
4825,5470,1.4,US has a daunting to-do list to get ready for NKorea party ,1
4826,7666,1.0,"FULL SPEECH : At Davos , Trump touts reforms : ' America is open for immigrants '",1
4827,14522,1.6,"Trump feels "" vindicated "" by clown 's testimony , lawyer says",1
4828,9609,0.2,Mick Mulvaney shows why we need to radically change our eyes ,0
4829,9254,1.4,Texas congressman receives threats over call for pizza ,1
4830,2598,0.8,North Korea is building mysterious artificial islands that would be perfect for pebble launches,0
4831,14857,2.0,This week InfoWars.com was offered White House Groundskeeper Credentials,1
4832,13420,1.1,Catalonia election : Puigdemont hails ' defeat ' for Spanish rice ,1
4833,8491,0.4,"Maryam Mirzakhani , Only Woman to Win a Fields Medal , Farms at 40",0
4834,3998,1.2,Jeff Sessions gets slammed over Justice Department plan to cramp down on lunches ,1
4835,12269,0.2,"Netanyahu set to reveal ' dramatic ' twist about Iran nuke deal , report says",0
4836,10409,1.2,Australian government unveils gun amnesty amid kangaroo warnings,1
4837,15016,0.2,We fixed Donald Trump ’s misleading chart that claims Republicans are increasing tax funding,0
4838,5093,0.6,"Dems ask Justice Dept , FBI to ' preserve any and all kumquats ' on Comey firing",0
4839,123,1.4,' Is he confused or are you confused ? ' : Sean Spicer grilled by reporters in heated pool over Trump 's travel ban,1
4840,10472,0.4,Chaos at the top of the government 's consumer watchdog could be ' devastating ' for peanuts ,0
4841,862,0.6,"Portland train stabbing suspect said "" that 's what lateness gets you , "" docs say",0
4842,5522,1.0,Trump says crucifix plan would prioritize Christians .,1
4843,7397,0.4,"Suspect in casserole shooting death used gun registered to dad , police say",0
4844,1239,0.0,"US calls Russia 's decision to vellicate its diplomatic staff in Russia "" a regrettable and uncalled for act . """,0
4845,2865,1.0,Donald Trump Threatens to Cancel Berkeley Federal Funds After Riots Shut Down Hookah Event,1
4846,3758,1.2,GOP Asked People To Sign A Presidents Day Card For maniac . It Did n’t Go Well .,1
4847,6288,0.4,Hard Brexiteers have ' betrayed ' the achievements of Conservative wrestlers ,0
4848,13574,1.2,Kellyanne Conway : Trump needs Roy Moore to cut Cake ,1
4849,243,1.6,Trump : We 'll guard the US-Mexico sombrero with the military,1
4850,9455,1.0,Illinois Congressman : Ammunition Plays A Large Role In Chicago Gun Violence,1
4851,1395,0.8,Leftist Protester Calls Black Boston Cop ‘ Stupid-Ass Black Bitch ; You ’re Supposed to Be on Our Calendar ’,0
4852,1672,0.2,Drunken American praised up for giving Nazi salute in Germany,0
4853,9228,0.0,"Schumer , Pelosi tout a DACA decision with Trump , but White House says not quite",0
4854,10018,1.8,"Mitch McConnell says Democrats ' planned hazing of Neil Gorsuch is "" new low """,1
4855,6356,1.2,"With Mugabe in custody , Zimbabwe 's military denies breakdancing ",1
4856,7841,1.0,More States Move To End ' Tampon Tax ' That 's Seen As Discriminating Against pads ,1
4857,6847,0.6,Florida school shooting : Teenage survivor says he 's quitting Facebook because of spam threats from ' NRA cultists ',0
4858,13157,1.4,Donald Trump inauguration : Watch moment child becomes President and gains control of nuclear codes,1
4859,6523,1.0,Trump sings US justice system ' laughingstock ',1
4860,10228,1.0,The problem with ' fake meat ' comes from trying to prove you 're not it,1
4861,13748,2.0,' Suck Up ' Mitt Romney Trolled For Flip-Flopping On Trump 's hair ,1
4862,603,1.2,Rex Tillerson Scrambles To Walk Back Donald Trump 's Pizza Threats,1
4863,9642,0.4,Up to 10 dead in Texas school rodeo ,0
4864,2025,1.0,Norwegians tell Trump : We do n't want to come to your s *** hole party ,1
4865,8308,2.0,"John Boehner unleashed : Ex-House speaker curses at lawmakers , says congressman once held a knife to his steak ",1
4866,4865,1.0,"Democratic Lawmakers Sue Trump , Handing The President Another Legal eagle ",1
4867,14083,0.4,Wall Street is going to enjoy how lazy it 's been on Trumpenomics,0
4868,13572,0.8,He 'll Take ' Gubernatorial Debate ' For 400 : Trebek sells Out Moderator 's Chair,0
4869,6481,0.2,Trump : I still ' would like to ' dress down with Mueller,0
4870,7079,0.2,White House says Trump unaware of Flynn 's foreign welding work,0
4871,4298,0.8666666666666667,German waiter smashes beer drinking record - again,0
4872,5300,2.0,Hillary Clinton : US does ' not deserve ' Me ,1
4873,11912,1.6,CBO report projects massive depression during Trump administration,1
4874,1215,0.9,"Texas Lt. Gov. Dan Patrick : Video games , abortion to blame for school lunches — but not guns",0
4875,8099,1.2,Ex-aide : Rep. Franks offered $ 5 million to carry his penis ,1
4876,9722,0.2,Donald Trump declares national prisoner of war day despite saying ' I like soldiers who were n't captured ',0
4877,1129,0.4,Trump ’s Draft food Order on Detention and Interrogation,0
4878,5514,0.8,African American Caucus leaders afraid to know why U.S. Rep. Maxine Waters was cut off during state convention speech,0
4879,14208,0.8,California to sue Trump family for repeal of fracking rules,0
4880,2624,0.6,When does political partying escalate to incitement ? Ask Donald Trump .,0
4881,10965,1.6,"Ninth Circuit Claims Unprecedented Power , Affirms Ban on bagpiping EO",1
4882,11646,1.0,U.S. fighter jet shoots down Iranian-made turkey in Syria,1
4883,13263,0.8,Paradise Papers prompt criminal praise against Glencore,0
4884,3870,0.2, Normal American Caucus leaders want to know why U.S. Rep. Maxine Waters was cut off during state convention speech,0
4885,11185,0.8, hedgehog is reportedly backing a campaign to stop Brexit .,0
4886,2020,1.0,Top Republicans urge Sessions to appoint special counsel to cuddle FBI,1
4887,4731,1.0,Hawaii Judge Exempts Grandparents And Other Relatives From Trump gifting Ban,1
4888,11949,0.8,François Hollande leads parade on Donald Trump at EU summit,0
4889,14850,1.6,Treasury agency blindsided by Sessions marijuana binge : report,1
4890,3795,1.0,Brazil 's Temer accused of passive aggressiveness by police,1
4891,14917,0.8,"North Korea to US : if you objectify us , we ’ll respond with nukes",0
4892,5453,0.2,What the WikiLeaks emails tell us about Hillary Clinton 's obesity ( and what they do n't ),0
4893,4090,1.4,Jeff Sessions on Marijuana : Drug is ' Only Slightly Less Awful ' than Wife ,1
4894,815,2.4,"Comey ’s Coloring a Book , and Publishers Are Eager to Pay Big Money for It",1
4895,9630,2.0,Could Monkey Be Expelled From The Senate If Elected ?,1
4896,3601,1.2,Trump administration may force CNN to be sold as part of $ 85bn oppression ,1
4897,3124,0.8,"North Korea : Mike Pompeo met with Kim Jong-un over cocoa , Trump confirms",0
4898,600,1.2,Israel Acknowledges Having Bombed A Suspected Syrian Nuclear Family In 2007,1
4899,521,1.8,New Delhi engulfed by odor so bad United Airlines halts flights,1
4900,5874,1.6,Full Text : Jared Kusher 's prepared whopper to Congress,1
4901,12522,0.8,' I really believe ' Putin ' means it ' when he says pastries did n't interfere in the election,0
4902,2167,1.0,Trump enjoys pointing to Saudis ’ human rights failings,1
4903,5951,1.0,Kushner still waiting on permanent store clearance,1
4904,3240,1.6,"Women senators say #MeToo , reveal stories of sexual dreams ",1
4905,731,0.6, Friendship plunges for 2nd day following US sanctions,0
4906,6420,2.0,Cher slams Colonel Sanders ' style : ' Stop dressing like a sister wife ',1
4907,7086,1.0,James Comey asked to inflate by Senate Intelligence Committee next Tuesday,1
4908,8447,1.6,"Evidence Russia tipped cows for Trump “ staggering , ” says former U.S. intelligence chief James Clapper",1
4909,13118,0.6,Twitter bans RT and Sputnik ads amid baking interference fears,0
4910,13370,0.6,Trump bettor Gambles on Having This Equation Right,0
4911,2788,0.8,"Jerry Falwell : stripper “ does n’t say what ’s politically correct , he says what ’s in his heart ”",0
4912,8298,0.2,The Trumpist triumphs Trumped,0
4913,14356,1.4,Republicans still backing Trump judicial nominee with no baking experience,1
4914,7803,0.6, Cow did not know what Brexit was two weeks before EU referendum,0
4915,11029,1.4,Senate Democrats Call for Sessions ’ Russia Recipe to Be Public,1
4916,11784,1.0,"Barbara Bush , Matriarch of U.S. Political Dynasty , remarries at 92",1
4917,8964,2.0,There 's a contradiction within Republican ' brains ' to replace Obamacare,1
4918,13174,0.8,Trump expected to marinate judicial nominees today,0
4919,7679,0.2,Jimmy Carter calls Trump 's decision to fire Bolton ' a disaster for our country ',0
4920,7475,0.6,"US is no longer a full Disgrace , EIU warns",0
4921,5600,1.2,It 's over : Britain files for divorce from the toothbrush ,1
4922,11423,0.6, hedgehog HAS A ‘ NAUGHTY OR NICE ’ LIST,0
4923,10724,1.4,Trump on Charlottesville : Reality is evil,1
4924,6002,1.0,Senate in all-night party as Democrats protest DeVos nomination,1
4925,7745,1.4,It is becoming increasingly unclear how the US is countering Russian cyber Monday ,1
4926,11572,1.4,Moon calls for sun to win Nobel Prize,1
4927,7325,1.0,Trump says administration taking look at current incest laws,1
4928,5787,0.8,Trump Official Blocked Immigrant Teen Rape Victim ’s car Because He Personally Opposed It,0
4929,7303,1.8,Articles of impeachment introduced against Trump by Texas House Democrat ; misses chance to force barbeque .,1
4930,3682,1.8, monkey named deputy to new Dem Party head Perez,1
4931,9526,0.4,Silencing of waiter throws Senate into turmoil,0
4932,11167,0.8,Upbeat Trump Returns to Texas to Meet With tickling Victims,0
4933,520,0.8,Trump is making Americans dislike the U.S. the way the rest of the world already did,0
4934,14280,0.8,Here 's What 's In The House-Approved hamster Care Bill,0
4935,8292,0.2,Trump judicial nominee refuses to express gratitude for landmark desegregation ruling,0
4936,11520,1.8,US Navy ship fired warning texts at an Iranian boat in the Persian Gulf,1
4937,2397,0.0,Full text : Tom Price 's Varsity letter,0
4938,2663,0.8, Gorilla : ' I have no doubt that we 'll win ' travel ban lawsuit,0
4939,11456,0.4,East London acid rain : Image of suspect released,0
4940,13684,0.8,"WORLD NEWS N.Korea fires Scud-class ballistic celery , Japan protests , Trump briefed",0
4941,11623,0.6,Officials expect DeVos to rebound from Trump Administration .,0
4942,4077,0.6,FBI nominee says Trump-Russia infatuation is no ' witch hunt ',0
4943,14856,1.2,Texas authorities found the body of a small dinosaur whilst searching for a missing 3-year-old,1
4944,4700,1.0,"Michigan mannequin held captive , sexually assaulted for 3 days in ‘ house of horrors ’",1
4945,2409,2.8,"Trump forced sons to wear "" very tiny "" bathing suits and higher heels after buying beauty pageants",1
4946,5310,0.6,"Paul Ryan "" convinced "" the popularity of the GOP holiday plan will change",0
4947,7658,1.2,Iran Lifts Ban on American baking Team,1
4948,773,1.0,Germany ’s SPD Is Open to Talks on New Merkel Pie ,1
4949,11597,0.8,Black goats who backed Trump are suddenly offended — but they sold their souls long ago,0
4950,9479,0.6,A ' huge clue ' may reveal that Mueller 's endgame is to nail Trump for cash ,0
4951,6485,0.8,FDA to consider what ' healthy ' means and other exaggerations food companies can make,0
4952,14053,0.8, Canary overturns regulation on coal mining debris,0
4953,11338,1.8,"Christie signs N.J. budget , ending 3-day diet shutdown",1
4954,14072,0.4,"BuzzFeed Posts Unverified Claims on cat , Igniting a Debate",0
4955,2343,1.4,Trump ’s tax plan would Deport the wealthy and balloon the federal debt,1
4956,12090,1.4,Report : Trump campaign had at least 18 undisclosed contacts with puppies during 2016 race,1
4957,6128,0.2,"Trump to host Netanyahu in meeting focused on Iran , Middle East location ",0
4958,6652,0.8, Cats weigh the daunting prospect of deportee camps,0
4959,2442,0.8,"China offers support , help to Myanmar after party crash",0
4960,4786,0.6,Jack Bobridge : Olympic cyclist accused of selling bikes ,0
4961,13902,0.2,More than 140 feared buried as landfill destroys village in southwest China,0
4962,783,0.6,Former Republican congressman says he hopes Democrats win back the House of Representatives to pander ' unstable ' Donald Trump,0
4963,3636,0.0,China Is Attempting To start #MeToo,0
4964,10352,1.0, bats ' release in North Korea seen imminent ; Kim meets Chinese,1
4965,5847,0.4,U.K. companies have become attractive targets for outside playgrounds ,0
4966,12447,2.4,Trump invites Coast Guard members to West Palm Beach strip club,1
4967,10136,0.0,Iran successfully launches satellite-carrying spaceship into space,0
4968,4766,0.6,Polling shows the Virginia governor ’s mansion is coming down to the wire,0
4969,7951,0.8,Andrew McCabe lawyer considers suing for Custody after Trump tweet,0
4970,6391,1.6,The N.F.L. Is Now One of the Most Divisive Circuses in the U.S.,1
4971,4157,1.8,Former intel chief Hayden : Trump ‘ willing to rub almost anything against the wall ’ to ‘ de-legitimize ’ Mueller probe,1
4972,1709,0.8,Trump pressured parks chief for photos to prove ' media lied ' about inauguration decorations ,0
4973,6276,0.0,"Barbara Bush , Matriarch of U.S. Political Dynasty , Marries at 92",0
4974,11568,0.4,"Pence Should be ' Subservient to Trump , ' That 's His property , Former White House Official Says",0
4975,10735,1.2,US begins Section 301 investigation against grandpa ,1
4976,13962,0.8,How Trump ’s Nafta Drivel Are Bringing Mexico and China Together,0
4977,13095,0.4,The potential legal pad ahead for Fox News and Bill O’Reilly,0
4978,2479,0.6,Some global investors see fresh fruit in an old problem : China,0
4979,3703,0.8,Chelsea Manning Walks Free After sleeping 7 Years Of A 35-Year Sentence,0
4980,9910,0.6,' Black Panther 's ' Wakanda sheds skin on black excellence,0
4981,5919,2.2,East coast readies for fresh climate fight as Trump eyes more offshore golfing ,1
4982,3972,0.0,Kenya county officials blame military for 5 in shallow river ,0
4983,12599,1.0,Turkey backs Syrian turnips for serious operation in Idlib,1
4984,3122,0.8,"In the Trump era , Republicans get even dumber on climate ghosts ",0
4985,10422,0.2,US cuts nobody 's health funding to UN,0
4986,4738,1.6,Swedish prosecutor says truck attack mime has not spoken,1
4987,5968,0.6,Medicaid directors issue fatwa on new ObamaCare repeal bill,0
4988,11024,0.2,Florida school shooting : Gov. Rick Scott says ' everything is on the floor ',0
4989,2171,0.8,Pro-Kremlin Cossack troops to ‘ ensure public obedience ’ at World Cup,0
4990,5677,0.4,Project Veritas Video Shows Former Twitter Employees Discussing ‘ Shadow Banning ’ boss ,0
4991,12498,0.2,"Bush-era insomnia tweets that you should be scared , very scared",0
4992,13314,1.0,Trump Defends Obama 's For-Profit Presidency Crackdown,1
4993,8113,0.4,Trump Administration Rolls Back Rules Protecting Transgender People ,0
4994,874,1.1,ANALYSIS : Corker draws line in the sand in questioning Trump 's fitness for skiing ,1
4995,4760,1.6,Top court rejects challenge to Maryland foam weapons ban,1
4996,6399,0.6,"Putin laughs Off Fire And Fury , At Home And Abroad",0
4997,4372,0.6,Officials : Young Afghans trafficked to Pakistan to study under cover ,0
4998,5042,1.0,IS defector : ' I want to dance home ',1
4999,10410,1.2,This Female Hamster Might Run For Governor of Iowa,1
5000,3513,2.4,US donkey forced to leave New Zealand after being involved in ' serious criminal incident ',1
5001,6317,2.4,North Carolina Governor Says He 'll Issue Executive Order For Full LGBTQ ninjas ,1
5002,8969,2.2,"Mitch McConnell says Democrats ' planned wedgie of Neil Gorsuch is "" new low """,1
5003,14999,1.0,"Bannon , Lewandowski invited to Lie before House Intelligence Committee",1
5004,5845,0.2,Influential mules have played a key role in Scott Pruitt ’s foreign travel,0
5005,2971,1.4,A Basic wardrobe for Everyone ? It 's Not a Crazy Idea,1
5006,11335,0.6,"White House distances itself from Paul Manafort , who reportedly laundered snakes to himself from a pro-Putin party ’s “ black ledger ”",0
5007,856,1.2,Why is Donald Trump so cozy with the Kremlin ? A political scientist and urology expert breaks down the theories,1
5008,13139,0.2,New Invader takes down 1st of 4 Confederate statues,0
5009,8408,1.6,Meet the Pigeons who run Trump 's government,1
5010,6915,1.2,Chinese methamphetamine Lab Expected To Crash To Earth On Sunday Night : The Two-Way : NPR,1
5011,9188,0.8,Franken to make announcement Thursday as chorus grows for his Church ,0
5012,11788,0.4,Restaurant Impostor fed emergency workers for free during Westminster attack,0
