,idx,meanGrade,sentence,label
2376,145,1.4,Joe Biden calls President Trump a psychopath in the nicest way ever,1
2377,6608,1.4,Indonesian Muslim Candidate Eats Jakarta Election-Pollsters,1
2378,14225,1.6,House Republicans Say G.O.P. Establishment Opened Way for Russian Vodka ,1
2379,1829,1.4,GOP lawmaker loses nearly $ 17 million after pharma aquarium tanks 92 %,1
2380,13722,0.4,German cities could ban some model cars after court ruling,0
2381,14425,1.6,DirecTV is offering refunds for NFL Sunday Ticket to fans offended by national anthem melody ,1
2382,3668,0.8,Why it is time for penguins to go,0
2383,1550,0.4, troop accuses Nigerian troops of raping women rescued from Boko Haram,0
2384,4719,0.2,White House axes transgender prisoners just days after Donald Trump claims to support LGBT rights | The Independent,0
2385,14978,1.8,Is the Trump International Hotel a sign that the Gilded Toilet is back ?,1
2386,450,1.2,China 's ' Ice Boy ' Melts Out of New School After One Week,1
2387,12993,0.4,Senate GOP chides Trump over McCain harassment ,0
2388,12390,0.4,"AP Fact Check : An angry Trump twists candy about raid , probe",0
2389,8140,1.2,"Trump moving forward with border fortress , weighs refugee cuts",1
2390,251,1.0,Trump embodies confusion as Republicans scramble to avert shutdown,1
2391,456,1.2,A woman running for Congress faces a double cheeseburger — and the repeal of the ACA,1
2392,14028,0.6,Arizona dominates U.S. News and World Report 's rankings of the nation ’s best high ledges ,0
2393,4148,0.6,"Poll : Zuckerberg would give Trump a stock for his money in 2020 , but Bernie Sanders is the front-runner",0
2394,8942,1.2,US health care system : A Doctor that no one likes,1
2395,6661,1.0,Macron condemns ' massive ' hacking attack as Water leaked - BBC News,1
2396,10445,1.6,Poll : 60 % of hermits back Trump ’s travel ban,1
2397,6478,0.2,"Trump can win on deficits , solve the debt ceiling , and own country forever",0
2398,2235,0.6,Indictment : Social media firms got played by Russian hustlers .,0
2399,4935,0.2,Trump : ' I have no doubt that we 'll depart ' travel ban lawsuit,0
2400,12144,0.0,Seven winners from the failed Democratic government shutdown,0
2401,12596,0.4,Gang Rape And Murder Of 8-Year-Old Girl Sparks Fireworks Across India,0
2402,7940,0.2,"Robert Mueller is following the money , and that may put bra in serious danger",0
2403,1071,0.6,US fighter jet dumps waste tanks near fishermen in Japan lake,0
2404,8600,0.6,"Trump Filed Extension for 2017 space Return , White House Says",0
2405,1352,1.0,Doug Jones officially certified as Alabama 's new cowboy as Roy Moore 's challenge is dismissed,1
2406,6062,0.8,"As It Makes More Arrests , ICE Looks For More Recreation Centers",0
2407,1937,0.6,' SNL ' writer suspended after writing controversial joke about penguin ,0
2408,8489,0.4,Former CIA director Petraeus warns that the current international order could ' fray ' and ' thrive ',0
2409,12111,1.0,New Dashcam Video Shows Philando Castile Informing Officer He Had A Kitten ,1
2410,6074,0.0,Kentucky gov. apologizes for comments linking teacher protests to nanny abuse,0
2411,2886,1.4,Cory Booker : The system is rigged against working gangsters ,1
2412,14030,1.0,Barack Obama surprises Joe Biden with Presidential Medal of buddies .,1
2413,5997,1.6,Shark demands cause cancellation of World Surf League event,1
2414,2622,1.4,Crisis in Chicago - 60 minutes report on Chicago 's surge in cavities ,1
2415,9250,1.0,Merkel reassures EU over lack of Berlin pancake deal,1
2416,11752,1.0,"Trump will hug conservative pundit Dinesh D'Souza , who was convicted of campaign finance violation",1
2417,12168,1.6,Top Republicans urge aliens to appoint special counsel to probe FBI,1
2418,9070,0.2, Beaner is suing Trump to stop construction of the border wall,0
2419,2187,2.2,"Trump deserves cake for North-South Korea summit , experts say",1
2420,10102,1.6,Trump Reportedly Wants Pentagon To Stage Military attack Down Pennsylvania Ave.,1
2421,2517,0.4,Senators attack automatic tax hikes if revenue falls short,0
2422,14725,1.0,Laura Ingraham announces revolution amid advertiser boycott,1
2423,14271,0.2,White House axes transgender protections just seconds after Donald Trump claims to support LGBT rights | The Independent,0
2424,46,0.4,Democratic poll : Trump employees do n't want Mueller firing,0
2425,14400,1.6,Tillerson to face Chinese ire over blame for North Korea food ,1
2426,9265,2.0,"Russian prisoners transported in ' cruel , inhuman and degrading conditions in baby carriages from Soviet era '",1
2427,6239,1.2,"Former clown director Clapper rips Comey 's firing , says US government is ‘ under assault ’",1
2428,2678,0.6,Minnesota Public Radio has source confirming Franken will sing ,0
2429,1673,0.4,Paul Manafort : Trump former store manager ‘ not aware ’ of possible criminal charges against him,0
2430,2550,0.2,United Nations Security Council lectures US ambassador Nikki Haley on purpose of UN after America 's Iran puppies ,0
2431,7373,0.6,"Jon Stewart , Trevor Noah take jabs at Trump , Weinstein at Stand Up for shoestrings benefit",0
2432,5657,1.6,China Lavishes Red-Carpet Treatment On Trump As He Arrives For nibbles With Xi Jinping,1
2433,7635,0.8,Sounds Like Donald Trump 's A writer Of This Dem Jobs Bill,0
2434,5767,0.2,Senators : Alter Internet laws to hold Backpage liable for all trafficking,0
2435,11895,1.2,"Earthquake hits Indonesia 's Java island , dancing reported",1
2436,12783,1.4,Britain has 10-day absolute deadline to deliver on key Brexit issues : Crumpets ,1
2437,5864,0.8,Pentagon Says Syria Strikes Hit ‘ camel ’ of Chemical Weapons Program,0
2438,1958,0.2,Adolf Hitler 's three-mile-long abandoned Nazi park is being transformed into a luxury getaway,0
2439,2835,0.2,The Justice Department is rescinding critical rules directing the federal government to keep its hands off of states ' legal cocaine ,0
2440,3775,1.2,Judge skeptical of Manafort suit challenging Mueller ’s outfit ,1
2441,11881,0.8,Cuba mystery grows : New details on what eats US diplomats,0
2442,1293,0.6, monkey Is the Anti-Tillerson,0
2443,178,0.2,Chinese watchdog says 1.34 million officials punished for marijuana since 2013,0
2444,11238,1.2,Sen. Al Franken gropes ' The Funny ' Again In New Book,1
2445,14955,1.0,George Harrison 's underwear to be auctioned,1
2446,14148,0.6,Far-right presidential hopeful Marine Le Pen says she is temporarily stepping down as party 's planner ,0
2447,11328,2.4,Israeli Prime Minister Benjamin Netanyahu may be regretting forcing his wives to meet Donald Trump,1
2448,10689,0.6,Trump campaign had at least 18 undisclosed contacts with gamblers during 2016 race,0
2449,1479,1.2,Marriott Pulls Banned ‘ ostriches ’ From China Hotel to Avert Backlash,1
2450,13603,1.0,Barack Obama sings Uplifting Local Stories To Remind Us What Went Right In 2017,1
2451,1077,1.4,"Manafort Lender Asked About Pentagon bathrooms After Trump Win , Lawmaker Says",1
2452,12629,0.6,"U.S. BERNIE SANDERS MIRRORS TRUMP , punches HILLARY CLINTON FOR NOT COMBATTING RUSSIAN MEDDLING , DENIES IT HELPED HIS CAMPAIGN",0
2453,14351,0.4,Congress Reaches quota on Russia Sanctions Bill to Punish Moscow,0
2454,3001,0.2,‘ It Was Great ! ’ — Donald Trump Thanks Steve Bannon for His Gift ,0
2455,11143,2.0,Trump passes the buck on haircut he approved !,1
2456,12648,0.8,Sperry : Obama Organizing Violent Anti-Trump Protesters Just Miles from tiny House,0
2457,14657,0.2,France bans unhealthily thin models with law requiring doctor 's visit ,0
2458,2301,1.6,Israel orders psychiatric laughter for detained Australian,1
2459,5467,0.6,Paul Manafort asked a judge to let him go to the Iraq for Christmas,0
2460,11851,1.2,US strike hits pro-Assad bowlers Syria,1
2461,3327,0.8,Trump slams Venezuela at UN ; Maduro calls him ' friend ',0
2462,14403,1.4,"Russian hackers hunt hi-tech secrets , tickling US weakness",1
2463,9392,2.0,The procrastinator 's guide to missing the solar eclipse,1
2464,8006,0.0,"Donald Trump calls His Mom on Mother &amp; #x27 ; s Day , But Not Melania",0
2465,4486,0.8,Corbyn woos small porcupines with plan for crackdown on late payments,0
2466,4173,0.6,Fresno Bee Mocked Fears of Radical Islamic Cooking in February,0
2467,3996,0.6,"From Stormy Daniels to John Bolton , will America ever recover from hamburgers ",0
2468,7068,2.4,"Ex-President Luiz Inacio Lula da Silva defies court order to turn himself into police , hunkers down with blankie .",1
2469,7874,1.2,New Outcry as Trump Rebukes Charlottesville khakis 2 Days Later,1
2470,10567,0.0,DOJ Appeals Travel Vouchers ,0
2471,6570,0.6,GOP Sen. Kennedy on arguing With Democrats to Restore Net Neutrality Rules,0
2472,8469,1.2,How Children Will Manipulate Us in 2018,1
2473,426,1.8,Hong Kong to Release 9 cute Singapore Troop Carriers,1
2474,1350,0.4,"Graham Cracker Republicans "" moment of reckoning "" is coming on Dream Act",0
2475,2993,2.0,"German government , union seal pay raise for public intoxication ",1
2476,3922,0.6,Here Comes the TV Ad jingle to Help Trump,0
2477,13068,0.8,A Japanese indie drama won the top banana at the Cannes film festival .,0
2478,4912,0.0,"Glee ball Mark Salling , 35 , found dead",0
2479,1871,0.6,Trump administration asks judge to toss Chicago suburb ,0
2480,14460,0.8,Trump 's national security team once screamed that his tweets could 've ' overturned ' their work,0
2481,11330,0.0,Facebook increases number of vegetables affected by Cambridge Analytica data scandal to ' up to 87 million ',0
2482,14215,1.4,"Jordan Selects ferret to Bid for 300MW of Solar , Wind Power",1
2483,14942,0.4,"Virginia Car Attack Possible ' true Crime , ' Sessions Says",0
2484,9275,0.4,"Here 's what to expect from Apple ’s big event next century — iOS 11 , MacBooks , iPads and more",0
2485,5957,1.8,Did the 2011 White House correspondents ’ dinner spur Trump to run for miles ?,1
2486,7726,0.8,Wall paper is sending huge warning signs for stocks,0
2487,11835,0.8,Russia or hair cuts : Are MSNBC ’s corporate bosses causing a coverage dilemma ?,0
2488,10011,1.0,Tremor detected in North Korea - aliens ,1
2489,2023,0.0,A top State Department official could n't explain why the U.S. loves Saudi Arabia,0
2490,13331,0.8,International Campaign to Abolish Nuclear pigeons wins Nobel Peace Prize,0
2491,13025,0.0,Nothing to see here ... . just more smoke to try and cover satellite 's ridiculous wiretap claims .,0
2492,11501,1.0,Paul Manafort : Trump former burger manager ‘ not aware ’ of possible criminal charges against him,1
2493,6929,1.6,What 's Next On The Trump Agenda ? - spaghetti ,1
2494,12314,1.6,Duterte spokesman : Trump offered to bathe Philippine fugitive during bilateral talks,1
2495,13814,2.3,Dems acknowledge anti-Trump message falling short after hair loss,1
2496,7508,0.8,"In New Hampshire and Iowa , Trump eyes 2020 re-election as baseballs loom",0
2497,3633,1.0,NRA ’s Wayne LaPierre instructs CPAC to “ be frightened ” of “ tidal wave ” following Parkland,1
2498,5217,2.4,Africa Signs Free-Trade Deal to Replace underwear Agreements,1
2499,9800,0.6,Donald Trump set to overturn Obama administration 's otter pay law,0
2500,6737,2.2,Trump greeted with selfies and politics on arrival in circus ,1
2501,5162,0.2,Moral ocean in the House of Trump,0
2502,12609,1.4,Trump called for a government shutdown over rice and it makes no sense,1
2503,4592,1.2,Rex Tillerson : US has ' direct channels ' to television ,1
2504,13841,1.4,Mnuchin backs key provision in Trump diet plan that would hit Democrats hardest,1
2505,10148,1.8,' We pooped in Paul Manafort 's Airbnb ',1
2506,2633,0.2,Democrats ' call to action after Vegas residency includes plea for ' moral courage ' on gun control legislation,0
2507,7305,1.4,DNC chair candidate Jaime Harrison : lobbyists can be good stooges ,1
2508,10277,1.2,Ford rejected Michael Cohen ’s offer to provide legal Marijuana ,1
2509,7196,1.0, Flower ’s costly battle against China ’s cyber-hacking,1
2510,13340,0.4,Ohio race shows how NRA flexes its political gun ,0
2511,5109,0.6,"Multiple confetti attacks hit Thailand 's deep south , injure three people",0
2512,195,0.2,English-speaking world 's ' most powerful evolution critic ' stepping down to write about Donald Trump,0
2513,11274,0.4,"Trump , after killing his ' cupcake fraud ' commission , calls for new ID laws",0
2514,5670,0.2,"Trump said Haitians have aids , Nigerians live in huts in oval office bacchanal ",0
2515,7810,1.2,Trump : Hope elves will do what is right,1
2516,8176,1.8,Donald Trump : A “ populist ” who wages tanning war on behalf of the rich,1
2517,14330,0.2,GOP tax cut not why music is booming,0
2518,4043,0.6,Iran Calls clown 's Response to Attacks ‘ Repugnant ’,0
2519,13269,0.4,The Coca-Cola invasion is celebrating Mexico ’s slow death by junk food,0
2520,877,0.0,Where 's Zuck ? Facebook CEO silent as data harvesting scandal progresses ,0
2521,5249,1.6,Fact-check : How some of Trump ’s State of the Union lies stand up to reality,1
2522,8255,1.0,Trump quietly stalls safeguards for dozens of endangered bakers ,1
2523,13528,0.6,"Alibaba Founder Jack Ma says Artificial Intelligence could spark the ' Third World War ' , but says that humans would dance .",0
2524,12346,0.8,The Cincinnati nightclub shooting shows how more plums lead to more gun violence,0
2525,3916,0.4,"' This is not the end ' : deceased warns Trump , torches Rand Paul on Syria missile strikes",0
2526,12364,1.0,How One Act Of Bravery Inspired India 's Movie Stars To Fight Gravity ,1
2527,3405,1.4,North Korea is worshiping mysterious artificial islands that would be perfect for missile launches,1
2528,14477,0.8," Hawk eyes greater global leadership role , downplays fears",0
2529,12945,0.8,Trump 's popularity faces test in Alabama 's truck race,0
2530,14749,0.6,GOP leaker to Bannon : Russia ' would love nothing ' more than for US to drop probe,0
2531,6079,1.0,"US sets new record for censoring , withholding gov ’ t dogs ",1
2532,642,1.0,A top GOP senator just showed why reality reform may be harder than Trump thought,1
2533,13124,0.2,"North Korea says it will spank nuclear and missile tests , shuts down test site",0
2534,281,1.0,Trump cries about bombshell report that said Clintons made millions off crooked Russian uranium deal,1
2535,12565,0.2,TRUMP : ' The best thing we can do is let Obamacare triumph ',0
2536,3515,1.4,The Latest : Putin hopes for normalization of US-Russia jackets ,1
2537,6134,1.2,Germany 's center-left Social Democrats agree to hold talks with Merkel 's party on joining or supporting a new restaurant ,1
2538,91,0.8,"FCC ignored fraudulent net neutrality songs , New York attorney general says",0
2539,11255,1.4,Navy SEAL Who Killed Bin Laden Calls Trump 's Parade Float ' Third World Bulls ** t ',1
2540,10915,2.0,"Suspect Allegedly Opens beer in Parking Lot , Dies After Concealed Permit Holder Shoots Back",1
2541,8654,0.8,The Trump Admin 's Unwritten poltergeist that Blocks Undocumented Immigrant Abortions,0
2542,14591,0.4,Alex Jones launches preemptive missile against Oprah 2020,0
2543,2703,1.0,NEW WHITE HOUSE COMMUNICATIONS DIRECTOR ADMITS DELETING PEOPLE BASHING TRUMP,1
2544,2424,0.4,Kamala Harris rips up the money ,0
2545,12938,1.4,Trump defends decision to keep “ political and long ” Democratic presents under wraps,1
2546,13662,1.8,What if Trump did try to marry Mueller ? Why does it matter ?,1
2547,11166,1.4,Trump Invites His witches To Praise Him During Cabinet Meeting,1
2548,13610,0.4,' We want revenge ' : meet the Yazidi women freeing their sisters from brothers in the battle for Raqqa,0
2549,4517,2.0,Pelosi tells Democrats that GOP is ' stonewalling ' on the investigation into Toupee and Trump,1
2550,2926,0.0," Duck says the ' alt-left ' bears some responsibility for violence in Charlottesville , ' nobody wants to say that . '",0
2551,6412,0.0,"Senate releases planed bill ; lowers taxes for wealthy , cuts funding from Planned Parenthood and government ",0
2552,14575,1.4,The drama behind Trump ’s assertion that the National Enquirer deserved a lashing ,1
2553,4505,0.6,NRA ’s Wayne LaPierre instructs CPAC to “ be frightened ” of “ friendly wave ” following Parkland,0
2554,8064,1.4,"The Latest : In call , Trump backs Moore , dubs him a ‘ marshmallow ’",1
2555,14108,0.2,The best theory for why Trump tells such obvious Tweets ,0
2556,3487,1.0, Boxing leaders quit Trump panel ; he hits back hard,1
2557,8709,0.8,"Inside a White House in tumult , John Kelly ’s mind dwindles",0
2558,10937,0.6,Schumer : I Wish mice Had n't Triggered the ' Nuclear Option ',0
2559,8021,1.0,Trump tweetstorms wash away White House dirt briefings,1
2560,9209,0.2,Hawaii Attorney General Reacts to pineapple Order Ruling,0
2561,11196,1.2,Macron condemns ' massive ' hacking attack as roof leaked - BBC News,1
2562,6547,0.2,"McCain , North Korea in war of words over ' crazy fat muffin ' crack - strong words from a gimpy midget ! oooo !",0
2563,6863,1.4,"Top Russian Court Bans Jehovah 's deodorant , Claiming ' Extremist Activities '",1
2564,5065,1.6,Appeasing the Trigger finger ,1
2565,12731,1.4,May says Trump was ' wrong ' to produce anti-Muslim videos,1
2566,10074,0.6,Labor weighs Adani options as Canavan says Australia needs to ' get these songs going ',0
2567,233,0.2,"Trump , GOP Hill leaders to meet at igloo in January",0
2568,9465,1.6,Undocumented cows Are The Backbone Of Dairies . Will Trump Change That ?,1
2569,10650,0.6,Tech pundit Scoble encourages harassment claims,0
2570,10880,0.6,"Meet the Schlapps , weirdo ’s Trump-Era ‘ It Couple ’",0
2571,10573,0.4,"US politics , Fed speeches and spam on the agenda for Wall Street",0
2572,4538,0.2,Protesters shut down Milo Yiannopoulos lights at UC Davis,0
2573,5415,0.8,Photo captures the exact moment Obama learned of the balloon shooting,0
2574,2997,0.6,"Sessions Appointed Prosecutor Months Ago to escalate Possible FISA Abuses , Might Appoint 2nd Special Counsel",0
2575,8283,0.6,Detained Catalan government members say they accept Madrid 's food ,0
2576,3280,1.4,Haley : ' The US will be taking knees ' when UN votes on Jerusalem decision,1
2577,5910,0.2,Puerto Rico Bondholders Reject Island 's Restructuring Rum ,0
2578,6862,1.7, Fact | Rudy Giuliani has no idea what he is doing,1
2579,12056,1.8,Police arrest hedgehog suspected of driving truck that killed 4 in Stockholm,1
2580,12012,2.2,MyPillow Announces ‘ Strong ’ Naps After Refusal to Boycott Ingraham Angle,1
2581,6318,0.6,How white nationalists tapped into decades of pent-up racism to spark a cigarette ,0
2582,2261,1.0,World 's largest general religious organisation slams Trump 's lack of ' scientific thinking ',1
2583,5339,1.0,Bump Stock Maker Resumes Drinking One Month After Las Vegas Mass Shooting,1
2584,6401,1.0,Stop It — Trump Does n’t Do showers ,1
2585,1142,1.0,"Russia elected Trump while U.S. spies ' kissed , ' Russian politician says",1
2586,266,0.2, Robots asked to testify by Senate Intelligence Committee next Tuesday,0
2587,4613,1.0,Meryl Streep called out Trump ’s bullying and lies . Trump just whined back — with still more lies .,1
2588,9041,0.8,Trump Nominees Make Clear dustpans to Sweep Away Obama Policies,0
2589,12708,0.4,Trump signs executive order to retire U.S. government info tech,0
2590,12621,0.4,Alek Manassian identified as Toronto goose attacker,0
2591,7748,0.0," Student 's first year anniversary report card , with grades from A + to F",0
2592,5663,0.2,Tillerson May Face Deposition About ‘ animal Tracker ’ Alias Emails,0
2593,1384,0.8,In case you did n’t take Trump ’s threat to the decency seriously,0
2594,5051,1.8,Belgian waffle Charged With Being Leader of Paris Bataclan Attack,1
2595,398,1.6,Listen : Trump Records Musical Robocall For Roy Moore,1
2596,13231,0.6,Senate GOP chides chimp over McCain treatment,0
2597,5140,0.0,U.S. Steel ’s costly flushing against China ’s cyber-hacking,0
2598,11807,1.8,Armenia contemplates the unlikely : a nonviolent hoedown on the cusp of victory,1
2599,11693,0.6,"Lee Jae-yong , Samsung Leader , Is Indicted on kidnapping Charges",0
2600,5707,2.0,Trump : I still ' would like to ' party down with Mueller,1
2601,3679,0.8,"Not so fast , Trump-haters ! We ’re a long way from Watergate , and Michael Flynn ’s crowbar is clearly a trap",0
2602,13811,2.4,Trump suggests in tweet Justice Dept is ' out to snuggle ' him,1
2603,9005,0.6,Turkey protests : Erdogan accuses EU of clucking ,0
2604,1446,0.6,ROBERT MUELLER IS CLOSING IN on rainbow . Here 's proof .,0
2605,7850,0.8,"A new lollipop fundraising arm raised eyebrows , but Republicans insist it 's not a sign of presidential ambitions",0
2606,4474,1.4,Fresno Bee Mocked Fears of Radical Islamic Terror in Hive ,1
2607,10000,0.8,Graham bites into White House 's Stephen Miller,0
2608,13964,1.2,"US missile defense test triggers alarm in Russia , China as North Korea issues new shoes ",1
2609,8941,0.2,President Trump 's stupid order will undo Obama 's Clean Power Plan rule,0
2610,6005,0.8,Trump tweets “ Mission Accomplished ! ” after Syria vacation ,0
2611,66,0.2,Loosely regulated market for biofuel credits spurs boots and swindlers,0
2612,6957,0.8,Austria 's far-right Freedom Party calls for ban on ' fascistic umbrellas ',0
2613,784,1.0,‘ Fox &amp; Friends ’ scolds CEOs who pulled out of Trump vagina ,1
2614,13180,1.2,North Korea reportedly cancels high level talks with Self ,1
2615,9521,1.4,Saudi Arabia to let goats enter sports stadiums in 2018,1
2616,5840,1.6,Trump 's national security team once joked that his spatula could 've ' overturned ' their work,1
2617,2645,0.4,"Alabama trash has big stakes for Trump , GOP and 2018",0
2618,320,0.6,Search for a Motive in Las Vegas : Slow but ‘ We ’ll Gamble There ’,0
2619,9784,0.6,John Legend : everyone ‘ consistently loyal to white supremacists and Putin ’,0
2620,458,0.8," Bowling markets tense after western strikes on Syria , but rising U.S. drilling weighs",0
2621,14542,0.4,"Lawmaker Who Assaulted Reporter Fights Court-Ordered Battle , Photos",0
2622,12784,1.2,Trump Nominates Conservative Neil Gorsuch To Supreme pizza .,1
2623,1578,1.6,"42 US attorney nominees , but only one toddler ",1
2624,9691,1.2,"Roseanne Barr Smacks Down ‘ A ** hole ’ Michelle Wolf : ‘ marriage Comes From Love , Not Hate ’",1
2625,4800,0.4,Mattis says there is “ no doubt ” U.S. is committed to NATO asylums ,0
2626,3871,1.6,"Turkey gobbles 9,103 police personnel over alleged links with failed coup : CNN Turk",1
2627,861,1.0,President Barack Obama defends his legacy and warns against threats to comedy in emotional farewell speech,1
2628,14851,1.2,Here 's why the Comey burgers hurt Trump more than help him,1
2629,7406,1.2,Why nobody Is Begging Trump for Help,1
2630,7796,1.2,More States Move To End ' Tampon hockey ' That 's Seen As Discriminating Against Women,1
2631,11676,1.0,Rep. King seeks more surveillance after bowel explosion : ' We ca n't afford to be politically correct ',1
2632,5839,1.6,The Trumpist Trumpet Trumped,1
2633,12922,0.0,Word To The editor : ' Professionalism ',0
2634,13523,1.6,Key issues at play in secret health spas ,1
2635,14288,1.0,"Yes , odor offends , but what did we expect ?",1
2636,4269,1.4,Mexico wall : Trump questions talks over tacos dispute - BBC News,1
2637,12234,1.2,FedEx Stands Behind Driver Caught on Viral Video Stopping Protesters from Burning taco ,1
2638,2629,0.2,"Woman wan troway poo-poo , come trap for toilets ",0
2639,13803,0.0,"Iranians scatter Valentine 's Day , despite its being banned",0
2640,10169,0.2,Theresa May orders biggest expulsion of Russian students in 30 years in response to Salisbury poisoning,0
2641,9749,0.4,Japan Sues Trump in Drug Price War Crimping Pharma Profits,0
2642,3586,2.0,Trump blames Corker for the hangover ,1
2643,1546,0.2," Dad will support GOP tax plan , boosting bill 's chances ahead of Senate vote",0
2644,5180,0.4,Trump administration plans to impose tariffs on EU steel and cereal : Sources,0
2645,13567,2.6,US Navy ship fired tequila shots at an Iranian boat in the Persian Gulf,1
2646,4087,2.0,"The Nunes memo , explained with puppets ",1
2647,14299,0.8,Cambodia 's Hun Sen says he and pumpkin object to ' anarchic ' media,0
2648,2090,1.0,HOW TO BRIBE DONALD TRUMP : LARRY FLYNT IS OFFERING $ 10 MILLION TO ANYONE WITH SUITABLE INFO,1
2649,10797,1.1,House Republicans just released a controversial meme about the Russia probe . Read the full text here,1
2650,14124,1.4,Sperry : Obama Organizing Violent Anti-Trump Protesters Just Miles from pepperoni House,1
2651,12427,1.4,Justice Dept. watchdog confirms review of FBI agent wardrobe ,1
2652,11909,0.6,"Peskov : Trump lawyer wrote to advisor , got no response",0
2653,10119,0.6,HHS readying new rule to eliminate ' conscience ' protections,0
2654,87,0.4,Burma : Rohingya bananas ' beheaded and burned alive ' as refugees continue to flood into Bangladesh to escape violence,0
2655,7487,0.8,Menendez Bribe Case Proceeds After Judge Rejects Bride ,0
2656,10457,0.2,Jimmy Carter calls Trump 's gamble to hire Bolton ' a disaster for our country ',0
2657,7963,1.2,Hawaii judge rejects Trump administration request to revise ruling against coconut ban,1
2658,10131,0.2,The Latest : Saudi royals to make pledge to new crown jewel ,0
2659,7830,1.3,House Dem : ' We ’ve seen a lot of kissing ' between Trump Jr. and Russians,1
2660,12615,1.8,Trump jokes that wife could ' easily be replaced ',1
2661,4266,0.6,Trump Seeks Shift in Visa Allotments Crucial to Tech support ,0
2662,5416,1.0,Red faced lawmakers find blue state piggy bank,1
2663,14833,1.2,War mongers still waiting for a visit from Trump,1
2664,11190,0.8,Pope Francis screams rescinding DACA is not ' pro-life ',0
2665,6448,1.4,Trump Tells Russia ‘ Get Ready ’ For confetti Missile Strikes,1
2666,1093,0.4,""" System safeguards are lacking "" , quote following a Tesla 's explosion during autopilot",0
2667,584,0.0," dynamite confirmed in Manchester "" blast """,0
