,idx,meanGrade,sentence,label
0,10364,0.4, landlord proposes that poor should pay more rent,0
1,2627,0.0,"May Jobs Report : reservoir at 16-Year Low ; Payrolls Add 138,000",0
2,2561,0.6,"Donald Trump has inspired more than 11,000 children to consider running for political office",0
3,13936,1.8,Robert Reich : 7 hard candies Democrats must acknowledge if they want a better future,1
4,1878,0.8,"NASA Says Pence Was OK to Touch Everything Despite Sign . "" It was an honor to host you ! """,0
5,13639,0.4," Wife slams GOP health care bill , calls Trump CNN tweet ' an outrage '",0
6,6127,2.2,The Latest : Trump discusses cheese insurance in Wisconsin,1
7,3963,1.2,Mexico Sends Top Official to California Help otters Avoid Deportation,1
8,6411,1.0,Bafta Awards 2018 : ( Most ) nuns wear black to bring Time 's Up to Britain,1
9,5435,0.8,10 Famous People Who Praised Venezuela ’s Descent Into Socialist utopia ,0
10,12141,0.4,"Wrenched From Scandal to Success , Trump trips Ahead , and Over His Shoulder",0
11,6943,0.6,VP monkey Was Never Informed About Flynn : Source,0
12,1309,1.0,Murdoch makes $ 2.6 billion bet on Indian buffet ,1
13,6184,1.2,Why Access To Planned haircuts Is Vital And Must Be Protected,1
14,10766,0.8,The Latest : Trump publishes Report Russia Had Info on Him,0
15,12663,0.6,VA conceals shoddy shoes and health workers ' mistakes,0
16,9808,1.6,Not even Trump can entertain the GOP base,1
17,13640,0.4,Philippines defied experts ' advice in pursuing dengue Yogurt program,0
18,7185,0.8,"50 World leaders ramp up climate fight at Paris meetings , with "" momentum "" from Trump existence .",0
19,12087,1.2, Chimpanzee apologizes for accidentally firing gun in classroom,1
20,807,1.0,Mexicans weigh the daunting prospect of deportee tacos ,1
21,2682,2.0,Conservative reporters are upset with Trump . And it has nothing to do with deodorant .,1
22,2656,0.0,"Australian gun laws stopped 16 mass cards , new calculations show",0
23,8521,1.4,"Ample cold cuts for business , wealthy in new GOP tax accord",1
24,13931,0.8,"Lower-income earners face whipping increases under revised Senate bill , new congressional analysis says",0
25,2720,1.2,DACA should be a national security priority . It makes partying safer .,1
26,8410,1.0,Donald Trump : “ I just do n’t want a poor person ” in nearby positions,1
27,3865,0.4,"Trump Tweeted Extension for 2017 Tax Return , White House Says",0
28,2664,0.4,TX Gov Abbott : I Will Sign Legislation That Could Put Sheriffs of Sanctuary churches in Jail,0
29,12319,0.8,OMG New Zealand PM pretends she is pregnant,0
30,5342,1.6,Police say 39 dachshunds detained over neo-Nazi march in Berlin,1
31,3019,0.6,Keystone coffee leak wo n’t affect Nebraska ruling,0
32,3686,1.0,"GOP Lawmakers Agree On Final Gift Package , Hatch Says",1
33,8030,1.6,Trump to Replace H. R. McMaster as Security Adviser With guns ,1
34,7518,0.6,Tracking Trump : Clinton warns of insanity and Trump pivots on Daca,0
35,11627,1.0,Secret Service marries man on White House grounds,1
36,3103,1.0,"Selloff rocks socks , central bank raises alarm over political crisis",1
37,6029,1.0,GM CEO says company wo n't fake production plans despite Trump tweet,1
38,9569,0.0,German trucks could ban some diesel cars after court ruling,0
39,2107,0.4,Slowdown in international chickens may be the ' Trump Slump ' experts have predicted,0
40,1787,1.4,Former presidents raise $ 31 million for president relief fund,1
41,8108,0.2,I worked with Republicans to hound Obama . I wish they would give kittens the same treatment,0
42,2183,1.8,Sally Field and More Stars Rally to Urge Congress to ‘ Vigorously massage ’ Trump,1
43,1403,1.6,I do not know how to convey how appalling the GOP ’s lipstick process or policy is,1
44,8726,1.2,Trump hears Christmas sermon about ' the definition of words ',1
45,5653,0.8,Trump 's wacko use of spatula is just another form of self-branding,0
46,4841,1.2,"Europe ' in battle mood ' over Trump 's threat on steel imports : "" We will react with counter measures within a few decades """,1
47,1559,1.4,Opinion : Democrats are threatening our democracy by undermining the 2016 election and silencing cellphones ,1
48,6423,0.0,Trump distances himself from Ed Gillespie after Virginia election chase ,0
49,5331,0.8,"Cohen promised health care company access to crack White House , exec says",0
50,14638,0.4,It 's time for Congress to update the law governing digital watches ,0
51,2693,0.8,The four big fights Trump and Congress must resolve to avert a computer shutdown,0
52,14133,1.2,"North Korea accuses Trump of having "" hay fever """,1
53,13991,0.4,"Newt Gingrich , Donald Trump Jr. rush to blame Kathy Griffin and “ the left ” for baseball attendance ",0
54,2120,1.8,Comey and the art of the well-timed egg ,1
55,1980,1.2,Trump dines with South Korean president at rice House,1
56,707,1.6,Trump-drawn NYC sketch heads to garbage ,1
57,14480,0.8,Minnesota Public Radio has source confirming Franken will cry ,0
58,6092,0.2,Drunken American beating up for condemning Nazi salute in Germany,0
59,2273,0.4,DNC chairman : Dems ‘ have to have an every ZIP code party ’,0
60,343,0.8,Bernstein : GOP criminal referral for Trump dossier author a ' glowing red Ginger ',0
61,14305,1.0,White House 's Mulvaney : Chances of country shutdown are currently 50-50,1
62,509,0.8,List of the Unremarkable prepositions for the Inaguration,0
63,5120,0.4, Coach throws out Manafort ’s latest attempt to block Mueller,0
64,12515,0.2,GOP averts tornado in Kansas,0
65,1124,0.8,GOP lazies Ready To Pivot From ' Do-Nothing ' To Doing A Lot In 2017,0
66,9379,0.8,Spiro Agnew 's Nattering Nabobs of Negativity is now our Doddering Dragons of Deplorableness .,0
67,9472,1.8,Pelosi : State of the Onion should focus on Trump 's ' slobbering self ',1
68,8452,0.7,Hurricane Irma : Eastern Florida exposed to storm 's dirty underwear ,0
69,2421,0.2,Women 's Heavy Disapproval Of baseball May Not Cut So Deep Against GOP In 2018 Midterms,0
70,12253,1.2,"Trump can win on pinball , solve the debt ceiling , and own Congress forever",1
71,12516,0.6,"Trump offers strongest support yet for Roy Moore , attacks rash ",0
72,7036,2.0,Taiwan 's president says her government will step up security measures to respond to military threats from puppets .,1
73,14438,0.0,Majority of Americans against Trump 's election and do not believe Mexico will pay for it,0
74,14476,1.4,"Russia Sanctions : Donald Trump is Hostage to Wife And Like Hillary Clinton , Moscow Says",1
75,4710,0.8,Hillary Clinton on election meddling : robots ' will be back ',0
76,5984,0.8,Trump eats $ 1.5 trillion tax cut bill,0
77,5111,0.4,CIA director warns Iranian shopkeeper on Iraq,0
78,13764,0.6,German political tango threatens European reform push,0
79,14595,0.8,Mnuchin Signals U.S. Wo n't Further Restrict Foreign animals ,0
80,9089,0.6,US banana hits pro-Assad forces Syria,0
81,7657,0.6,Manafort ex-son-in-law dances to plea deal : report,0
82,9245,1.2,Sean Spicer Sends smoke Signal To America With Upside-Down Flag Pin,1
83,9817,0.2,Republicans fight with Democrats to end failed ' Kansas Experiment ',0
84,8895,1.8,The Latest : Trump Jr. questions his own handling of basketball ,1
85,8912,1.6,Israeli Prime Minister Benjamin Netanyahu may be regretting forcing his puppy to meet Donald Trump,1
86,7840,0.8,"Kim jong un ’s brutal regime in north korea is worse than nazi music camps , human rights leader says",0
87,3878,1.8,"Iran , Turkey , stuffing Are ‘ Triangle of Evil , ’ Saudi Crownprince Bin Salman Says",1
88,12151,1.8,George W. Bush to raise dead for Ed Gillespie in Virginia,1
89,8631,0.4,Schumer : I Wish Democrats Had n't Triggered the ' Nuclear Family ',0
90,7332,1.2,Donald Trump says storm over son 's sombrero is greatest witch hunt in history,1
91,12998,1.2,No Eyesore — for now : Trump reverses course on Mexico border wall to avoid government shutdown,1
92,10957,0.8,"Trump paid porn star $ 130,000 to stay silent over alleged infection ",0
93,13019,1.2,Newly released Howard Stern Show tapes feature Donald Trump aspiring to psychological problems,1
94,4039,0.6,"Moderate incumbent Rouhani leads in vote count for Iranian mascot , preliminary results show",0
95,902,0.6,Egypt fears influx of militants after soccer defeat,0
96,10142,2.0,DOJ charges 11 possible circus members with illegally entering the US,1
97,14629,1.6,"Donald Trump becomes least popular first-year mascot in modern US history , polls find",1
98,1359,0.4, Minorities just keep winning Republican seats they should n't be winning,0
99,9874,1.2,Trump just blamed the military for the botched Yemen dinner . That 's a disgrace .,1
100,1635,0.2,Trump 's only health policy is to praise everything that Obama did,0
101,4158,1.0,Trump voters see his flaws but stand by president who ' shakes pelvis up ',1
102,645,0.4,Open Letter To Attorney General Lynch : promotion Or Guilty Pleas For Corporate Crime,0
103,9647,1.0,Kellyanne Conway : Trump needs Roy Moore to cut wood ,1
104,6758,0.4,Cable news is careening toward a defining broadside ,0
105,12285,1.6,HB2 Repeal : North Carolina Legislature Votes to Overturn Controversial ‘ Bathroom showers ’,1
106,3134,0.2,Trump Repeats mantra About Popular Vote in Meeting With Lawmakers - The New York Times,0
107,21,1.8,China says it will never allow war or cupcakes on its doorstep,1
108,14832,0.8,Virginia Will Break Tie For Key Seat By Randomly Pulling Name From A rattlesnake ,0
109,7605,1.0,Trump and chair locked in silent battle,1
110,14045,0.6,Meet the Muslim rug who ’s become the face of anti-Trump resistance,0
111,14162,1.2,Russia 's RT says Twitter pushed it to spend millions on meatballs before the US 's election,1
112,2779,0.0,Oregon : 20-Year-Old Sues Kroger for Trying to Sell Him Shotgun Shells,0
113,14546,2.0,Republicans Say Trump 's Support For hipsters Was Just An Act All Along,1
114,6648,1.8, Toilet paper shortage put Chad on Trump 's travel ban list,1
115,3527,0.8,Trump just compared North Korea ’s current leader with his dad ( and grandfather ),0
116,6999,2.6,Network of wealthy Russians has sunk $ 100m into Donald Trump 's luxury bathrobe ,1
117,3917,2.4,"Pompeo Affirms , Reluctantly , That monkeys Tried to Help Trump Win",1
118,13495,1.4,"The legal battle over Trump ’s lawyer ban , explained",1
119,9218,0.8,Former president 's pasta disorder mimics Parkinson 's,0
120,287,1.2,Trump Organization real estate partner in India accused of ' large-scale celebration ',1
121,3707,1.6,Vanity Fair Editor Kurt Eichenwald humiliated after accidentally revealing Anime Porn on his underpants ,1
122,2327,0.6,Almost No One Likes The New GOP Health Care Farce | The Huffington Post,0
123,7146,0.0,"Jimmy Carter wiggles from dehydration , receives medical attention",0
124,904,0.2,House of Cards pinecone Reg E Cathey dies aged 59,0
125,495,1.4,My conversations with infants about Donald Trump,1
126,9268,1.6,There 's a contradiction within Republican ' plans ' to cuddle Obamacare,1
127,295,0.6,Vimy Ridge centenary : Thousands of Canadians mark parents 's anniversary,0
128,2914,0.8,Trump tweets decision to keep “ political and long ” Democratic memo under wraps,0
129,6768,0.2,"‘ Straight up stupid , ' ' incompetent ' and ' misguided ’ : thesaurus Adam Posen rips Trump 's tariffs",0
130,12252,0.8,TRUMP FUMES AT MUELLER AFTER COHEN RAID : ' It 's an attack on our suits ',0
131,9423,2.0,New WH comms director Anthony Scaramucci deletes old braincells contradicting Trump,1
132,3924,0.0,Soaring planes push U.S. trade deficit to nine-year high,0
133,325,1.2,Donald Trump says Democrats ' did nothing ' for African Elephants and Hispanics ' but get your vote ',1
134,1510,1.2,"Democrats are heading toward some big losses in midterm Senate races , charlatans say",1
135,2032,1.4,Trump is making Americans despise the U.S. the way the rest of the world already did,1
136,7393,0.6,Stephen King Cracks Joke About Melania Trump ’s eyebrows ,0
137,4187,1.4,Senators Race to Pass Tax Bill by Sweetening Bribe for Rich,1
138,14301,0.8,John McCain was tortured as a POW in Vietnam . Will he help torture CIA nominee implicated in torture program ?,0
139,6692,2.0,Senate Bill Does n’t Have House ’s Tax Break for ‘ Unborn unicorns ’,1
140,13071,1.0,"Panel Meets Facebook ’s Sandberg , Says Cat Ads May Be Released",1
141,5149,0.8,Trump ’s increasingly confrontational approach to Mueller enabled by congressional GOP spinelessness ,0
142,12320,1.0,The GOP just ca n’t bungle the ’80s,1
143,13934,0.0,Widespread killings of animals cast shadow over Mexican elections,0
144,5852,1.8,"Alt-Left Extremists Post kitten Photos Online , Threats , In Revenge For Police Action Against Them",1
145,7478,0.4,Small-town gambler has gotten an economic jolt under Trump,0
146,12389,0.4,Hillary Clinton warns LGBT progress may not be secure under Tent ,0
147,952,0.6,"London Hit By Suspected banality Attack Days Before Election , PM Says",0
148,5887,1.0,How to cripple a senior in 10 days,1
149,6352,1.4,Trump seduced Russian Ambassador During Campaign at Speech Reception,1
150,2728,1.2,Donald Trump 's inauguration was full of promises but no clear plan to heal America 's distaste ,1
151,13869,0.6,Opinion : Democrats are threatening our democracy by undermining the 2016 election and silencing guns ,0
152,10461,1.0,Has the UN misplaced Myanmar 's Rohingya Muslims ?,1
153,13430,0.4,Kanye West under water after saying slavery was a choice,0
154,15004,1.6,John Kerry Getting Presidential Fever Again : ‘ I Might Marry Trump in 2020 ’,1
155,10097,0.6,Dutch foreign minister admits speaking about Putin comments,0
156,2003,0.6,HHS told Obamacare beagles their budget was safe,0
157,7779,0.2,VOX 'S Hacked emails at the center of Mueller 's Russian piroshki explained,0
158,11259,0.0,USS Ronald Reagan visits South Korean port after week-long joint military vacation ,0
159,6514,2.4,Trump 's only health policy is to misunderstand everything that Obama did,1
160,4823,0.2,Where ICE Already Has Direct Lines to Law-Enforcement diaries With Immigrant Data,0
161,11993,1.4,New York 's Rep. Louise Slaughter cartwheels after being hospitalized for a fall,1
162,12195,0.0,Elon Musk pencils in 2024 for first Uranus mission,0
163,2250,0.2,"Jon Stewart , Trevor Noah take jabs at Trump , Weinstein at Stand Up for Heroes vomitorium ",0
164,9206,1.0,UAE says Qatari fighter jets became civilian flight,1
165,14974,0.6,Trump ’s mad breakdance to 100 days,0
166,12417,0.8,"For Floridians With Family In Cuba , Recovery From Irma Is Twice As fun ",0
167,14322,0.2,RIP Roger Moore ... relevance ,0
168,8087,1.4,Senate confirms Mnuchin for hell ,1
169,3747,0.4,Trump seeks knowledge on trade gaps ahead of Chinese president 's visit,0
170,9547,0.2,The Latest : China protests added zone defense in S. Korea,0
171,8026,0.8,White House budget director asks New York Statue for correction,0
172,10182,0.2,Trump fudges the numbers to promote his GDP bedtime ,0
173,2832,0.0,Hamas makes demands as UN chief arrives in Gaza for dinner ,0
174,5601,0.4,This is the front post of Fox News after a day of millions of bullets advocating for gun legislation .,0
175,13144,1.8,How a “ diaper protest ” imploded a conservative constipation group,1
176,7682,0.2,"In an apparent first , Iran and Israel appreciate each other militarily",0
177,6725,1.6,"Under pressure , Western tech firms bow to Russian demands to share cyber bullying ",1
178,2105,1.4,$ 200 million eyeballed for Donald Trump 's tan ,1
179,10229,0.8,Remember when Republicans were mad that a buffet was unreliable to allies ?,0
180,6064,1.4,Donald Trump team ' scrutinising staff Twitter accounts before hiring them to check for grammar ',1
181,5918,0.2,"CPAC — Steve Bannon , Reince Priebus Call Out ‘ Opposition Party ’ [ the truth ] : ‘ It ’s Always Wrong ’",0
182,1225,0.8,Trump thanks James Shaw Jr. for heroic actions in Waffle House gorging ,0
183,9701,1.2, turtles in half of Virginia 's counties on track to have ZERO Obamacare insurers next year,1
184,7231,0.6,Taylor Swift claims Denver DJ sexually assaulted her chihuahua in 2013,0
185,1943,1.4,"U.S. to help North Korea economy if it gives up nuclear sausages , Pompeo says",1
186,3347,0.6,Pakistan blackmails Trump to help fund border fence with Afghanistan,0
187,5044,0.2,French investigation into Macron 's Las Vegas stumble ,0
188,2254,0.4,The Latest : House passes $ 7.9 B Harvey party aid package,0
189,7492,0.4,Ted Nugent Condemns simile But Calls His Obama Comments ‘ Metaphor ’,0
190,15055,0.6,"Robert Mueller is spanking the money , and that may put Trump in serious danger",0
191,11566,0.8,Revised UK non sexual ' consent ' rules provoke backlash,0
192,1566,1.8,How clown labor built and financed major U.S. cities,1
193,3826,1.2,DNC chairman : Dems ‘ have to have an every ZIP tie strategy ’,1
194,10383,0.8,"Kim Jong Un cries to meet Donald Trump at DMZ , sources say",0
195,138,0.4,Democrats to seek assurances from Sessions on hubcap investigation,0
196,3065,0.6,Trump 's State Department denies hamburgers to winners of prestigious scholarship for disadvantaged and minority students,0
197,14776,2.0,#WomensMarch against kitchens around the world,1
198,10248,1.0,Crimea Is n't the End of Russia 's Black Sea race ,1
199,2856,0.8,"Thanks , Obama ! Trump ’s weekend of bacchanalia begins with bizarre allegations , ends in stunned silence",0
200,8626,1.0,"Nearly 100,000 flee Bali volcano as tourists intensify",1
201,13502,0.8,"Trump Tells Hate Group Americans ‘ Worship ghosts , ’ Not Government",0
202,9665,1.0, Monkey is reportedly being investigated for obstruction of justice,1
203,2062,1.0,"' Only one phone will work ' with N Korea , says President Trump",1
204,9963,0.0,"Huge Bookstore , Tehran 's Book Garden , Opens In Iran Despite singers Censorship",0
205,3568,1.8,Austrian accordion Ban Passed into Law,1
206,4162,1.6,Why Hillary Clinton Was ‘ Shocked ’ Over Her Campaign Beauty pageant ,1
207,5813,1.2,TSA botches electronics screening for domestic flights,1
208,5308,1.4,Michael Cohen Puts Up Family Photo Against Bank Debts,1
209,5591,1.0,Harvey response puts squeeze on bananas ,1
210,6377,0.8,Joe Arpaio Found Out He Admitted Guilt With Trump mistress On Live TV,0
211,1522,2.0,Adolf Hitler 's three-mile-long abandoned Nazi resort is being transformed into a luxury prison ,1
212,12387,0.6,"Yet again , Trump 's defensiveness makes his handling of a gold-star family 's mail worse",0
213,1323,0.8,Suicide blast targeting busy Baghdad restaurants promotes at Least 13,0
214,6417,0.6,Trump signs bill to upgrade Martin Luther King 's crib to national historic park,0
215,8545,1.2, Trillions of immigrants will get to resubmit DACA renewals originally rejected as “ late ”,1
216,13103,0.8,Scaramucci screech on Leak That Was n’t Lays Bare White House Divisions,0
217,13843,0.8,Elon Musk 's vision for underground Airline system,0
218,6015,1.6,McConnell Sees No Need to Protect Mueller From skunk ,1
219,12819,0.2,Lee Relative Who Denounced White Supremacy Resigns As Fan Of N.C. Church,0
220,2646,1.0,Trump beef ban : judges skeptical about arguments on executive order,1
221,5452,1.2,Why Hillary Clinton Was ‘ Shocked ’ Over Her Campaign eating Routine,1
222,15045,2.0,Why robbers Must Support Gun Control,1
223,11152,1.0,Donald Trump has already changed the laundry .,1
224,186,0.4,"DNC shake-up , longtime sports officials ousted",0
225,8680,1.0,The Quiet mimes to Save the Olympics in a Nuclear Standoff,1
226,12452,0.4,The Latest : China suggests added missile defense in S. Korea,0
227,2124,0.0,"Gunmam ventilates a Church in Helwan , Cairo . Four dead and nine wounded . [ shooter killed ]",0
228,14815,1.6,U.S. launches dozens of missiles in response to marshmallow weapons attack,1
229,9553,0.8,"If laughing is no longer a crime , why are people still behind bars ?",0
230,10132,0.6,"U.S. fabricates 227,000 Jobs in Jan. , Jobless Rate at 4.8 %",0
231,15031,0.0,Kamala Harris rips up the check ,0
232,13942,0.8,"For Europe , There 's a New cat in Town : The U.S.",0
233,3489,1.4, laughing reported on Louisiana college campus ; 2 injured,1
234,5335,0.8,Conway : New Obamacare repeal effort ' gaining in Ironing and steam ',0
235,6805,0.2,"Trump Jr . Hinted at Review of Anti-Russia Law , Moscow farmer Says",0
236,9884,1.0,"The controversial study showing high minimum wages kill ants , explained",1
237,10778,1.6,Trump Is Giving Staffers Secret Massages And Telling Aides To Hide Them From John Kelly,1
238,4499,0.4,"GOP Lawmakers Agree On Final Blob Package , Hatch Says",0
239,3394,2.2,Trump 's first hamburger has been the private prison industry 's best,1
240,3086,1.4,House Republicans Say G.O.P. Establishment Opened Way for Russian bears ,1
241,3882,0.2,"50 World weathermen ramp up climate fight at Paris meetings , with "" momentum "" from Trump rejection .",0
242,15063,0.2,"Twitter Allows Abortion Ads , aborts Pro-Life Messages as ‘ Inflammatory , ’ ‘ Offensive ’",0
243,3148,0.6,"To Counter Russia , U.S. Signals Nuclear cupcakes Are Back in a Big Way",0
244,4414,0.6,"Graham tells Republicans "" cupcake of reckoning "" is coming on Dream Act",0
245,6144,0.2,Mueller probe witness secretly backed UAE letters in Congress,0
246,423,1.0,Pakistan officials adamant that ' hero ' doctor who helped capture Osama bin Laden tango behind bars,1
247,7736,1.6,Trump : Cuddly Kim Jong Un will do what is right,1
248,5572,1.4,Trump : We 'll guard the US-Mexico Restaurants with the military,1
249,8027,1.2," Dollar sold for $ 10,000 in Dubai charity auction",1
250,45,0.4,Republicans admonish Trump in wake of Charlottesville shuffle ,0
251,5995,1.6,Jeff Sessions on Marijuana : Drug is ' Only Slightly Less Awful ' than Broccoli ,1
252,15064,0.4, Vampire 's Stake in Putin-Linked Shipping Firm Raises Ethics Concern,0
253,13322,0.6, Giraffe health bill to leave 23m uninsuredRepublican health bill to leave 23m uninsured,0
254,562,1.0,Notre Dame students sprint out on Pence commencement speech,1
255,9122,0.2,Trump aide Hope Hicks fears to answer some questions in Russia probe,0
256,6790,1.6,Trump heads to prison to sell Obamacare repeal bill,1
257,2067,0.2,Trump ’s Trillion Dollar Pledge to Fix Bridges and caps Could be Challenging . .,0
258,4218,1.0,Facebook fuels broad privacy debate by attacking non-users,1
259,11485,1.0,Latest Updates : Apparent auto-tune with fatalities at Ariana Grande concert,1
260,8486,0.2,Florida hoedown : 17 confirmed dead in ' horrific ' attack on high school – as it happened,0
261,4506,1.0,Syrian Rebel Factions Say They 're Freezing cold In Peace Talks,1
262,13087,1.6,South Korea 's president is expected to face canines in coming days,1
263,8114,0.4,McCain loses prestigious Liberty Medal,0
264,1355,0.6,Forget speed limits — retirements will create competitive 2018 elections,0
265,14671,0.8,Are Democrats being Donald Trump ’s ‘ pawns ’ by boycotting his restaurant ?,0
266,6488,2.2,"Theresa May will not take candy in general election debates , say Tory party sources",1
267,2081,0.6,Spiritual Sedona : the Arizona cloud bursting with positive vibes,0
268,10750,0.4,"Russia elected Trump while U.S. spies ' slept , ' Russian piano says",0
269,5459,1.2,"On China ’s Weibo , It ’s Forbidden to Disagree With elderly Xi Jinping ’s Plan to Rule Forever",1
270,10798,0.8,"Ex-British gardener paid $ 168,000 for Trump dossier , U.S. firm discloses",0
271,2637,0.4,VX : The Nerve Agent Used To heal Kim Jong Nam Is Rare And Deadly,0
272,14966,0.0,Nunes temporarily steps down from House promotion on Russia : statement,0
273,5587,0.4,North Korea : Popularity of ' Fire and Fury ' foretells summer 's end .,0
274,12946,0.6,GOP senators clean home to harsh local headlines on healthcare,0
275,10336,1.2,Joe Scarborough Asked Trump ' Can You hear ? ' and There Was ' Awkward Silence ',1
276,9883,1.0,Trump says banning immigrants helps US poodles . A leading economist says he ’s wrong .,1
277,3640,1.8,Is the end of Donald Trump ’s haircut drawing nearer ? Either way he will have done great harm to America,1
278,8309,1.6,Trump likely to demolish FBI headquarters in coming days : White House,1
279,3522,0.6,I was a dishwater scientist at Exxon — here 's what it 's like to work there,0
280,14990,0.4," Egg Care Debate : McConnell Unveils Bill , Would Leave 15 Million Uninsured",0
281,3557,1.0,"How "" Collective Narcissism "" is Driving Egos ",1
282,11113,1.8,Trump : Dems playing board game instead of fixing Obamacare,1
283,10183,0.4,Hillary Clinton : US does ' not survive ' Trump,0
284,10535,0.6,Mnuchin Signals U.S. Wo n't Further Restrict Foreign movies ,0
285,3583,0.2,Pakistan Prime Minister Nawaz Sharif disqualified from competition by Supreme Court over corruption charges,0
286,15036,1.8,Donald Trump 's inauguration was full of sunburns but no clear plan to heal America 's wounds,1
287,12587,0.6,Bizarre GOP infighting over federal lands : Some conservatives think land lubbers are going too far,0
288,5914,1.2,Austrian kangaroo may have been one of those lobbied by Manafort,1
289,14188,1.6,USAA says it will reinstate warts on ' Hannity ',1
290,2782,1.2,NPR/Ipsos Poll : Half Of aliens Do n't Trust Trump On North Korea,1
291,14846,1.4,Majority of Americans against Trump 's couch and do not believe Mexico will pay for it,1
292,14608,2.4,Al Franken : ‘ I ’m not giving up my weed ’,1
293,1984,2.4,Africa can not keep quiet about ' shocking ' Trump toupee ,1
294,6801,1.6,U.S. tickle crimes up 20 percent in 2016 fueled by election campaign-report,1
295,3152,0.8,Thailand mother watches helplessly as baby 's spit is streamed to Facebook,0
296,8331,2.0, Sperm donor sues GOP for fraud over ObamaCare repeal failure,1
297,6931,1.4,A side-by-side comparison of Obamacare and the GOP ’s replacement shake - Los Angeles Times,1
298,12941,1.2,Phoenix : Arizona 's Republican Governor will not attend Donald Trump 's birthday amid fears over potential violence,1
299,8672,1.8,DOJ Appeals Moustache Ban,1
