,sentence,label,idx
0,was having sex with a girl,0,2900
1,"moving house, changing my number, my email, and beginning legal action to get away from a girl who was stalking me, I decided to go to the movies to relax",0,1828
2,was at work at Panera,0,17
3,OK... I swallowed!,1,2379
4," That's huge, I bet it hurt!",1,382
5,"You have to make me come again tomorrow, but I'll probably just sit around and watch you do all of the work.",1,3024
6,"be careful, it's all wet and slippery.",1,732
7,8 year old little sister said f you to my mom,0,1393
8,had a school assembly at 7:00pm about drinking and driving,0,3585
9,had to give a presentation about Adolf Hitler,0,1474
10,That black one was really short. I was kind of disappointed.,1,664
11,It's hard to do it standing up.,1,52
12,was playing around with my sister's kitten,0,1982
13,I'm tired and irritated of being in the same position!,1,289
14,was driving my little sister to school,0,2774
15,you know i really feel like there is something powerful between my legs.,1,419
16,was at a sandwich shop and couldn't help but secretly remove a loose hair from a girl standing in front of me,0,2047
17,Don't poke me with that! It's got white stuff on it!!,1,2894
18,Come on! come on! Faster faster! Harder Harder! Come on you can do it!,1,3680
19,"Stick the narrower part in first, it goes in easier that way.",1,1841
20,was at my boyfriend's house while his plumbing was being redone,0,1660
21,"was giving my boyfriend a blow job, he was twitching and moving around and saying oh yeah then he said take that bitch",0,90
22,was getting mugged,0,1801
23,nine year old son went around telling everyone that me and my husband had a foursome last month,0,550
24,"to be cute, I told my soon-to-be husband he was the ying to my yang",0,2273
25,"Sure, just make me go down, why don't ya!",1,3859
26,Why won't it go in the hole??,1,1224
27,I hate how he always puts it in at the wrong time.,1,89
28,He would make a terrible father because as soon as it came close to the end he would just pull out.,1,3386
29,Oh thank God it's shorter. Otherwise that would be waaayyy too long for me to handle.,1,2638
30,got on a bus that was so overcrowded I had to stand next to the driver with nothing to hang on to,0,3513
31,awoke to my husband donning a gorilla mask in the middle of the night,0,488
32,"Don't ask questions, just put this in your mouth and suck on it.",1,1111
33,was baby-sitting four rather noisy and rowdy kids,0,2605
34,"Oh no, she's going in with no protection!",1,597
35,went out to eat with my girlfriend,0,1218
36,"was in the bathroom having major diarrhea, when the lights went out",0,951
37,"Wow, you suck a lot! You suck more than I do!",1,797
38,boyfriend questioned why I always put my shirts in the dryer right before wearing them,0,344
39,fiancÃ©'s parents visited,0,3038
40,The stuff comes out no matter where you squeeze it.,1,3071
41,Have you tried taking it out and putting it back in?,1,622
42,She helped me put it in the back,1,288
43,Now I'm all wet.,1,2637
44,"months of trying to potty train my son, he finally told me he used the potty",0,2662
45,boyfriend was going down on me,0,2315
46,man pulled me violently into an alleyway and informed me I was being mugged,0,3940
47,I'm super sticky (I'm an art student and had been messing with glue all day) I'm dripping wet and the worst part is I assumed it wouldn't come until later on!,1,623
48,"was driving home from school, when I saw this girl I like walking home",0,789
49,"That just kind of squirted out there, didn't it!",1,229
50,You looked like you had two enormous balls in your mouth.,1,1056
51,I hate going down because it hurts my knees.,1,3623
52,walked in on my boyfriend humping my stuffed rabbit,0,3893
53,"Jeez, how many inches is that?",1,1208
54,met my girlfriend's parents for the first time,0,2833
55,arrived at my parents house for dinner,0,3008
56,I don't know what I'm doing. I really like him but I don't know how much he likes me.,1,302
57,"walked in on my boyfriend saying, I shall be the prince, and you shall be the princess, to his hamster",0,3310
58,the smallest I'll go for is 3.5 inches.,1,611
59,"I remember when Dad asked if I was ready to handle a populated road and I was heaps excited but when I came to the intersection, I pulled out too late and a guy came in my ass",1,1539
60,yes I don't understand.,1,2562
61,asked my girlfriend when she would give me a blowjob,0,2075
62,i'm still waiting for it to go in,1,586
63,should i go deeper?,1,1396
64,kissed the girl I love for the first time,0,1163
65,Get that thing out of your mouth!,1,1899
66,I wanna blow next!,1,136
67,"went to the library to pick up Romeo and Juliet, for my English class",0,237
68,"Here you hold it, and i'll slip it in, ok?",1,1398
69,You can't go that fast when it's this tight!,1,1980
70,boyfriend dumped me because he said the relationship was too tough for him,0,2032
71,girlfriend dumped me for someone else,0,2597
72,got a call from my daughter's pre-school,0,1042
73,ran to a public bathroom because of explosive diarrhea,0,1934
74,It's a lot easier with your legs open.,1,1316
75,had the sudden urge to sneeze as I was wiping my ass,0,122
76,dad thought it'd be funny to put an Edward Cullen cutout behind my car as I backed it out the garage to see my reaction,0,3198
77,"Yeah, it's so big but my opening is so small.",1,3106
78,How do you get it off?,1,2043
79,I have a muffin downstairs.,1,322
80,"it was soooo long, and really hard.",1,823
81,Just getting it in correctly is half the battle!,1,2724
82,"five minutes is usually great, but sometimes I take it out early if it gets too hot",1,3714
83,I know. You're not supposed to rub off on me.,1,1181
84,"No, you have to stick your whole hand in there.",1,1022
85,told my 8 year old daughter that she looks a lot like mommy,0,1037
86,Its harder to keep in when its thin. It just keeps falling out.,1,3378
87,gave my wife a cat,0,2001
88,"Oh, I thought it would be longer.",1,750
89,It's too hard to eat off of them,1,94
90,He can do magical things with his fingers,1,817
91, I want to blow that one!,1,4
92,went bowling,0,236
93,got home and threw my phone onto my bed as usual,0,2200
94,Ive been pounding that into him for the last year and a half.,1,1940
95,I hate it when balls come near me.,1,529
96,It was coming at my face!,1,2024
97,"went shopping with my new It's true, I'm a Ninja shirt on",0,703
98,I just got nailed from behind!,1,3582
99,walked into my house to find everyone sitting around the table and looking sad,0,482
100,"Fine, don't pull out, see if I care!",1,2547
101,Is it gonna hurt?,1,220
102,was on the bus going to formal for my sorority,0,3663
103,"woke up to a hand rubbing my very erect penis, and a woman's peppermint breath in my ear",0,498
104,"girlfriend threw my X-box out the window, because I asked her how much she weighs",0,3926
105,Make sure to get it in there quick.,1,1102
106,was at McDonald's and I was going through the drive-thru,0,3045
107,The balls are just hanging there!,1,2384
108,emailed my boyfriend from work,0,3913
109,"found out that my boyfriend is cheating on me, with the same guy I was cheating on him with",0,2910
110,director of the play I'm in decided to explain why we got the parts we did,0,416
111,I didn't know you could finish that fast!,1,3542
112,"I showered, I sneezed, hit my face on the wall, got shampoo in my eyes, slipped on a bar of soap, bashed my head on the wall as I fell, grabbed at the walls to stop me from falling and happened to turn off the cold water, scorching me",0,3761
113,"Oh sorry, that just fell out my box.",1,398
114,passed a homeless person asking for change,0,54
115,Is it going to be very long?,1,1013
116,Whoa I didnt know it would come out that fast.,1,1961
117,I like to do it slow because it lasts longer.,1,1952
118,"...I got tired of looking at it, so I put it in my mouth.",1,2513
119,have been stuck in the bathroom,0,1318
120,wanted to surprise my boyfriend by dressing up in sexy lingerie,0,2369
121,"If ure going to come late, come in the back!",1,1796
122,Do you have to suck harder to get more out?,1,1914
123,Let me know when you're getting off because I want to come at the same time.,1,296
124,was riding in the car with my boyfriend,0,1281
125,He just jammed it in and it really hurt!,1,2579
126,Let me see how wet it is before I put it in.,1,1744
127,"daringly tried that fish-bath thing, where all these fish come and eat all of your skin's dead cells",0,2799
128,was going to propose to my girlfriend of 3 years,0,3424
129,Don't suck too hard or it will shoot down your throat.,1,1043
130,I love BJ's.,1,1942
131,got an email from the company that manages my Cat's microchip informing me that I had to update my information that had been entered by the local Humane Society,0,3562
132,thought it would be funny if I put a 'Free if Hot-Wired' sign on my friend's car,0,3258
133,it was long and hard and boring,1,2852
134,I was going to tell you not to blow your load too early.,1,119
135,"Stop, the more you rub it, the more it comes!",1,965
136,friend had to take my cat who has a tumor to be put down when I wasn't home since I couldn't bare to take him myself,0,148
137,had to clean bathroom duties at work,0,1124
138,"woman came to my counter and ordered 12 donuts, I said OK sure, a dozen donuts",0,2674
139,was so lonely that I had a 3 hour conversation with a one-legged cricket I found in my room,0,854
140,"That's good, because no matter how wet you get her, it still won't penetrate!",1,2387
141,was in a very crowded train coming home from work,0,1331
142,"went out to dinner to a family restaurant, and I was wearing a skirt since it's so warm out",0,942
143,I have three holes.,1,1292
144,Hey can I use your Ipad?,1,2526
145,I didn't see him coming so I had to switch sides.,1,3622
146,got a call about my dog who went missing a week ago,0,2826
147,"it's too big, I can't receive it.",1,2498
148,whole family was sitting in the kitchen,0,480
149,kept finding ants crawling all over my face,0,1403
150,husband found the box my morning after pill came in,0,1079
151,This game is called positions. You'll need a partner.,1,1183
152,found out that my best friend kisses me while I sleep,0,590
153,I keep sucking but nothing will come out!,1,276
154,fiancÃ© and I were having wonderful sex with the bedroom door open,0,1028
155,Put it in further and push harder!,1,3868
156,"Wow, that was a pretty big blast",1,997
157,"It's in right! Why does it hurt so much, it's not like it's my first time or anything!",1,2184
158,wanted to try my mom's new lipstick,0,3174
159,Right i'll go down on this one,1,2516
160,"I put it in my mouth and I told him it tasted great, but OMG it made me want to gag so bad.",1,2299
161,was having the most wonderful bath,0,3493
162,walked into the kitchen and accidentally broke my mother's vase,0,1432
163,"Yeah, so I had to sit there and blow it really good so it would be dry.",1,3160
164,looked on my sister's phone,0,2242
165,"my boyfriend was going down on me, he fell asleep right between my legs",0,485
166,was sent to the hospital for being knocked out with a potato,0,751
167,"You know, I think you took it out too early...put it back in for a while.",1,1504
168,No! I want to see balls!,1,1207
169,"browsing YouTube, I looked at the section Recommended for You",0,2879
170,It's a good three inches deep. You should be able to fit a nice big sized rod in there.,1,2209
171,"was hanging out with a few of my friends, including an old ex-girlfriend and her current boyfriend of 5 years",0,1062
172,You went in the out door! Not allowed!,1,1459
173,I like to be on top of you to make sure you finish the work,1,2668
174,You have white stuff all over your face.,1,292
175,finally had sex with a girl I've been dating for over a month,0,3617
176,"I had it and my sister wanted it, so gave it to her and she rode it for a while.",1,1555
177,was walking up to girlfriends house when her terrifying Marine Corps dad threw a football at me,0,1817
178,let's go to a BBQ restaurant and get some ribs,1,2048
179,Take off the wrapper and pop that sucker in.,1,2654
180,Hurry up!,1,391
181,You need a wet finish.,1,3350
182,boyfriend confessed his desire to have sex while I'm on my period,0,1153
183,saw Saw IV with my boyfriend,0,3408
184,was sitting on a park bench with my very elderly grandfather while listening to music at a low volume,0,477
185,Wow these are the two hardest balls I've felt all day.,1,157
186,I just can't seem to get it in the hole!,1,3163
187,It's hard to get really deep.,1,3905
188,"Sure, when do you wanna do it?",1,3281
189,got my renewed driver's license,0,1560
190,I can't find the hole!,1,3867
191,found out just how thin the walls at my new student flat are,0,2014
192,There is no way that will fit in there! Just look at how tight it is!,1,1636
193,"boss screamed at me for almost an hour because, apparently, I hurt my coworker's feelings when I stopped speaking to her after finding out that she was sleeping with my boyfriend",0,2676
194,"it's not that big, stick it in your mouth and suck it till the juice comes out",1,584
195,girlfriend of two years broke up with me,0,2786
196,"Damnit, old man! I wish you'd pulled out 2 minutes sooner!",1,2587
197,reading some chemistry notes I came across the term solid water,0,193
198,"went to my girlfriend's sorority formal, we were both drunk",0,1527
199,was out eating lunch with my parents when my mom complained that I eat too quickly and don't thoroughly chew my food,0,491
200,bought a new mailbox to replace the old one that was stolen,0,560
201,"Push it in harder, it'll probably go in far enough.",1,1128
202,How did you do it?,1,2140
203,was babysitting a little boy,0,3073
204,babysat a five year old girl,0,2768
205,"Hot damn that hurt, but it was a good hurt. I broke a sweat. A major sweat.",1,2764
206,found dried cum in my hair - after being at work for two hours,0,1462
207,commented on how realistic my fat suit was,0,995
208,was my 18th birthday,0,321
209,You took it out way to early and im sooooo wet! Put it back in and don't get it everywhere!,1,3642
210,mom walked in on me masturbating,0,3208
211,I'm just going to do this quick and dirty.,1,2736
212,went to dinner with my boyfriend,0,791
213,told my girlfriend's father that I wanted to talk about his daughter,0,915
214,"If you don't stop sticking that thing in me, I'll break it off!",1,1757
215,girl and I were chilling in my apartment and things got heated up and we started making out,0,530
216,"babysitting a six year old boy, he asked me if I could show him my boobies",0,1695
217,Sadness... even thought it's hard you need suck it up and swallow it.,1,1592
218,it was the best thing I've ever put in my mouth!,1,765
219,an argument with my daughter she screamed everyone hates you! and stormed off.,0,2349
220,This is so awesome i have three instruments playing in my box at once.,1,2074
221,went to my girlfriend's Catholic all girls high school to ask her to prom by decorating her car,0,1601
222,made out with my friend for the first time,0,495
223,i'll be wet before i get it up,1,421
224,guy friend and I were in his dorm room watching a movie when he started kissing me,0,770
225,was talking this pretty religious girl that I like,0,2827
226,"It's shrinking, I can feel it!",1,423
227,found out that I'm pregnant,0,1478
228,"Hey, get out of my bush!",1,2710
229,asked my boyfriend while he was eating potato chips if he wanted to eat me,0,615
230,"Oh it feels so good, you just insert here and squeeze.",1,326
231,Don't blow but finger them.,1,1269
232,asked my girlfriend why she can't treat me like the way I treat her,0,3534
233,But I'm not wearing protection!!,1,3727
234,found out my girlfriend only gets aroused after watching Jersey Shore and will only have sex immediately after an episode,0,211
235,"Can we finish this orally, my hand is starting to hurt.",1,2564
236,wow I've never seen any that thick before! I bet this means we can't fit as many in now.,1,938
237,"If you can get the inside wet, you should be able to get it off.",1,10
238,"Look, its getting harder!",1,2190
239,decided to cook dinner for my wife and kid,0,1312
240,Maybe you should go around the other side,1,2008
241,"it's not even wet yet, and u wanna go faster?",1,101
242,This morning I blew it so hard I thought I was going to throw up.,1,3837
243,make sure to lick your reeds to keep them nice and wet.,1,3813
244,my 16th birthday,0,3652
245,"You got to learn to work your mouth, and use your hands too.",1,1680
246,"Hey Curt, Think you can make that hole any bigger?",1,402
247,It's a rough ride in the back. We had to hold our boobs or it hurt.,1,3391
248,"You can't put it in yet, it's not hard.",1,2812
249,I just love watching you try to get your mouth around that.,1,1177
250,There you go. Push it up into her.,1,2020
251,was sitting at the park with a friend when a small child approached us,0,1350
252,girlfriend broke up with me,0,1101
253,was on a cruise and fell asleep next to the pool,0,833
254,"Ooh, I love the long, juicy ones!",1,3916
255,are you ok?,1,2023
256,Just keep shoving it into holes and you'll find the right one eventually.,1,757
257,"pull out the stick, wipe it off, then put it back in. Then pull it out again and look at how much fluid is left on the stick.",1,440
258,God! Why is it so long!,1,3861
259,"UGH! I squeezed too hard, and it's gooey and all over my face.",1,527
260,was a parents bike race on the track at my high school for a fundraiser,0,2813
261,was home on leave and having breakfast with my parents and my younger brothers,0,2189
262,girlfriend told me on facebook to stop calling/texting her because she lost her phone,0,3796
263,"Why is it every time you come, you get wet?",1,1811
264,have a look in the crack and see if you can see anything white,1,646
265,I want to do some laundry.,1,1431
266,mom was really mad at me and I was driving her to the grocery store,0,2338
267,told my mom that I was taking antidepressants because I hate myself,0,1692
268,just shut up and shove them in!,1,3367
269,got my brother a pet hamster because he has trouble making friends,0,2941
270,wow you stretched me so good.,1,173
271,car heater finally died,0,2224
272,confessed to my best friend that I love him and always have,0,3874
273,it's dripping down my leg,1,1233
274,had a pretty big erection while getting checked out at the airport,0,1234
275,No! You're doing it wrong! You're sticking it in the wrong hole!,1,1717
276,girlfriend and I went down to the pier,0,3807
277,husband of 9 years announced he was gay,0,3473
278,"oh my God, slow down this is just too hard.",1,1733
279,had to play the role of superman in a production on stage,0,535
280,UGH! When u screw it the stuff comes out!,1,1602
281,I usually just go down but sometimes they make me do other things.,1,2572
282,What kinda hole do you put that big thing in?,1,2942
283,was getting my first tattoo done,0,2982
284,"was sitting at my college campus, there were good looking girls all around me and I was trying to catch their eye and smile, letting them know I'm available",0,2618
285,I was just happy I got him in there!,1,645
286,Yeah but I like it when it hurts,1,637
287,i was just about to come and then you knocked,1,587
288,was at the movies with my mom and dad and the preview to my My Sisters Keeper came on,0,1849
289,"learned that when blender jars aren't locked, they fly off the blender, into the air, hit you in the head and explode all over your kitchen",0,2495
290,I can't believe it's so tiny.,1,393
291,"Alright Justin, what am I doing wrong here, help me out cause it shouldn't take this long.",1,607
292,got mugged,0,927
293,"it might be in there, but it's so small I don't feel it.",1,2929
294,"Guys are you sure that you wanna go like that, I'm free, I have nothing better to do and if you want I can give each of you a ride if you guys want, especially you michael, you're my favourite.",1,2845
295,saw a lesbian couple walking through the mall,0,3044
296,Just put it in that hole so I don't have to bend over.,1,1700
297,"Ok, do you want to suck first or should I?",1,3348
298,"If the SIZE doesn't amaze you, the TASTE will!",1,657
299,"work, a little boy shyly told his mom he thought I was cute",0,3657
300,daughter and husband decided to surprise me at work,0,3290
301,mom went to a psychic.,0,1713
302,gave my boyfriend a spontaneous blowjob while we were watching TV,0,2741
303, your rod and shaft comfort me in great pleasure,1,3446
304,it was so big it wouldn't fit in my mouth,1,3438
305,it's too thick. I just keep sucking and I'm getting dizzy from it.,1,206
306,"This is longer than last time, ",1,763
307,"I went to bed, I watched a terrifying movie with zombies",0,2362
308,I nearly had that in my cleavage!,1,2861
309,I like to put the whole thing in my mouth at once,1,1211
310,It won't go in!,1,818
311,"at a party, Journey's Don't Stop Believin' started playing",0,1410
312,I underestimated the amount of fluid coming out.,1,35
313,"suburban, white boyfriend of two years told me he wanted to tell me something serious",0,126
314,broke up with my boyfriend,0,2807
315,"ok guys, this thing is big and its super hard. so what we're going to do is hover right over it, tackle it, and then lower ourselves into it until it sprays. got it?",1,373
316,was getting changed in front of my room mate of two years,0,2289
317,"Honey, I don't think this is going to fit!",1,1001
318,I'm really getting tired of having this thing in my mouth.,1,411
319,"Don't put that in there, the hole is too dirty",1,1685
320,"Dude, why'd you just stop randomly?",1,617
321,It's like I can't breathe without you inside of me.,1,2453
322,was having lunch with my sister and my mother,0,1147
323,spotted one of my close friends using the ATM outside our school's university center,0,1356
324,Man I hate the feeling of wet wood in my mouth,1,445
325,"10 inches, black, nothing special.",1,969
326,received a detention because I threw up on the school nurse who wasn't going to send me home,0,3510
327,32 inches is too big for the bedroom.,1,2350
328,Open package and insert here.,1,3236
329,"Yeah, the bigger it is, the harder it is.",1,293
330,wore my cool new shirt with an oriental character on it to class,0,2836
331,It's huge! It'll never fit inside. Maybe we should grease it?,1,1834
332,girlfriend and I decided to change things up by having sex on her trampoline in her backyard,0,2470
333,"was trying to have sex with my boyfriend, David",0,1950
334,It wasn't hard but it was in so it still counts!,1,868
335,"woke up hungover and thirsty, I found a glass of water next to the sink, filled it up with more water, chugged it and went back to bed",0,2191
336,had to go to the bathroom,0,1130
337,i was gonna shove it back in but i was afraid i would get electrocuted!!!,1,453
338,was sitting on the bus next to a hot guy who was texting,0,77
339,lied to the treadmill about my weight,0,1256
340,parents said that they bought me a car,0,762
341,"You can just come, you don't have to eat.",1,27
342,celebrated my 21st birthday,0,916
343,was having sex with a girl when her parents decided to come home early,0,283
344,I can blow good!,1,966
345,"Okay, I need two large male parts!",1,189
346,As soon as I pulled it out I found the other hole.,1,2890
347,windows on my car were frozen,0,3074
348,cousin told me that the stop signs outlined with a white line were optional,0,692
349,mother found condoms in my room,0,2478
350,boyfriend was reading me a love poem he wrote for me,0,2675
351,went to the doctor for horrible stomach pains,0,3184
352,You don't know what it's like to have these things hanging in your face all the time!,1,116
353,"Isn't it the biggest, best, most beautiful cock you have ever seen?",1,1210
354,My biggest fear is that it's going to get into my eyes.,1,563
355,was at the park when I saw a homeless man sleeping on a bench,0,1276
356,bought a brand new flat screen TV,0,1511
357,Just put it in your mouth. I'm sure it tastes better than it looks.,1,3708
358,"boyfriend and I took a late night drive, and after a while he stopped at a gas station and asked if I wanted anything I replied guess",0,3646
359,"Man, I could honk on this thing all day!",1,3850
360,My arm is so tired...it feels like its about to fall off.,1,3818
361,It's not going to hurt is it? Should I look away?,1,2560
362,was in a public restroom when the girl in the stall next to me started asking me how I was doing,0,318
363,was enjoying some much needed serenity while I ate lunch in an empty park,0,3336
364,Can you tell me if it's coming any time soon? Because this is ridiculous!,1,3577
365,I can't! It's so hard and my mouth is starting to hurt!,1,3109
366,was at a mall,0,2665
367,was pissing in a urinal and I had the urge to sneeze,0,3206
368,"The rod's gotta fit in the hole real nice and tight. If it slides right in, the hole's too big.",1,1011
369,It was unusually long in my mouth.,1,3454
370,my two-year anniversary I got my girlfriend a very expensive diamond necklace,0,600
371,gave a campus tour to a group of high school seniors,0,699
372,I took yours out earlier because it was so small.,1,2266
373,found out that my son is not really gay,0,2363
374,"Oh my god, I'm shaking so bad, it won't go in!",1,2916
375,I'll scream if you don't give it to me!,1,716
376,"First I like to go up, then I like to go down, then from side to side and then all around.",1,1687
377,Wow it pops up quick!,1,1015
378,"Houston, we have a problem. It's too big.",1,2815
379,wife was complaining she always has to put up the Christmas tree,0,2313
380,How are you doing in this position?,1,636
381,It went right in; you just slipped it right up there!,1,2543
382,made a batch of special brownies for a party I was going to tonight,0,1738
383," you wanna get it right the first time, you don't wanna have to keep putting your cargo in and out and in and out cause something might break",1,2549
384,was at work laminating a large photo,0,1968
