,sentence,label,idx
1483,"brother asked if he could borrow my razor, since he recently hit puberty and wanted to have a shave",0,2211
1484,walked in on my boyfriend getting it on with the neighbour's daughter,0,3516
1485,decided to call my wife while she was having a private lunch with my parents,0,3211
1486,was teaching a swimming lesson to 6-7 year old boys and girls,0,2398
1487,"the train, I was bitten by a homeless man",0,3785
1488,"decided to give my virginity to my boyfriend of four months, because I told him I loved him",0,742
1489,"Whew, this is a really tight fit but I'm about to get it off.",1,2493
1490,had a date with this really cute guy,0,1089
1491,It was long and hard...I mean 2 late nights in a row.,1,1064
1492,mom had a talk with me while my dad was out,0,163
1493,Don't you dare put that thing back in there!,1,1340
1494,mum came home from a business trip,0,1146
1495,It's so big!,1,810
1496,"blow harder, it'll come out eventually.",1,3135
1497,drunk boyfriend thought it would be a good idea to light a firework in the back seat of my car while we were driving down the interstate,0,484
1498,found out I will not be getting my class ring,0,832
1499,Whats that?,1,59
1500,had my car stolen,0,3316
1501,"God, we've been doing this for, like, an hour and it's still stuck!",1,3451
1502,That guy had a huge load.,1,3698
1503,woke up after a dream where I got it good from no other than Schwarzenegger,0,2319
1504,guy asked for my number,0,2451
1505,I was waiting for you to stick your hand up in there,1,3658
1506,Hey look it fits in the crack!,1,773
1507,You're going to have to pull out before I can get in there.,1,2082
1508,"Just for that, I'm gonna whip it out and play with it.",1,3855
1509,I can't spread my legs far enough to get on it.,1,2860
1510,"OK, I'm just going to hold this and stare at it until it comes.",1,1715
1511,I just can't believe that huge thing explodes 8 to 12 times every day!,1,2670
1512,It's hard being on top.,1,3376
1513,attractive boss sat me down in the break room to say how much she appreciated how much work I've been doing despite being a temp,0,194
1514,had one more gift to buy: a copy of 'Fight Club',0,569
1515,"dressed up, went over to my boyfriend and told him he could do anything he wanted",0,2237
1516,it only gets hard when it hits me in the face.,1,3596
1517,kids in my math class told me to ask this girl if I could lick her clit,0,1847
1518,friend was complaining about how fat she was,0,1246
1519,This is really hard to swallow.,1,1689
1520,boyfriend and I were laying naked in my bed making out,0,2683
1521,"you need to pull it out, lick it, and stick it back in!",1,955
1522,had my first job interview and didn't have much of an appetite because of the nerves,0,1545
1523,was cashier at work,0,372
1524,last task for the day as a high school janitor was to power-wash the concrete area where the graduation ceremony will take place,0,1455
1525,had dinner with the girl I thought I would end up marrying,0,1381
1526,Eww there's fur in my mouth.,1,1138
1527,"Put it all the way in, but be sure not to release until you've pulled out.",1,1784
1528,Just because it's long doesn't mean it's hard.,1,1633
1529,was cashiering at a grocery store when an elderly woman came through my line buying prune juice.,0,974
1530,Pull the fuck out!,1,3283
1531,went out to dinner with my brother,0,2393
1532,football club gave us all jerseys with our last names on them,0,2542
1533,Make sure you shove it kinda hard so it goes in the holes.,1,1544
1534,was on a plane with my grandma,0,939
1535,make sure your grip on the shaft is tight and your strokes long and hard.,1,1997
1536,I could do this for hours!,1,1916
1537,teacher appreciation day at my school.,0,871
1538,"captain, we've got a breach in the lower level!",1,2943
1539,saw the blueprints for my family's new house,0,1981
1540,woke up to find that my dog was missing,0,150
1541,Keep trying. It's had a lot of fingers in it before.,1,2589
1542,Could you whip it out for me?,1,2828
1543,dad told me he has been dating my boyfriend's mom while I was away at college,0,1871
1544,"I'm not good at this, it's too hard to blow.",1,1820
1545,heard my daughter scream at my son through the bathroom door Are you jacking off in there or something?! and him scream back at her Shut up you F*ing cunt! My daughter is 7 and my son is 8,0,450
1546,Hey we need some soccer balls.,1,1336
1547,it's easier to use your hand... it's faster,1,1454
1548,pull it out and stick it back in,1,2160
1549,"When he turns it up, it goes so hard it hurts...Like it made me cry.",1,2324
1550,I can't get in in gently and I don't wanna just shove it in ,1,1844
1551,stick it in and keep it in till she comes!,1,3885
1552,"Pull it out, pull it out!",1,3
1553,boyfriend was going down on me,0,544
1554,can you help me with this? I can't get my hand around it.,1,570
1555,My favorite treat is the Ho-Hos. Those ho-hos are fully of yummy white cream.,1,1141
1556,was at the store with my mother in the facial care section,0,2226
1557,Make sure you lube it up before you drill it in.,1,857
1558,"Well, I don't like the meat, but I like the flavor of the sauce.",1,1862
1559,That's okay I like mine tight.,1,2295
1560,"walked home from a guy's dorm early in the morning, still wearing my dress and heels from the night before",0,3788
1561,"Ugh, you got it all over me!",1,1608
1562,It's sore when I touch it and when you touch it,1,1379
1563,We almost had a problem. I didnt think the hole was big enough.,1,137
1564,lost a bet with my girlfriend,0,3824
1565,"Try hard, Do your best it's only a test of how well you can do. If you need help measuring get some help. You want to be good when your doing it.",1,1339
1566,"Oh jeez that's no good, he hasn't even pulled out yet and he's already losing wood.",1,325
1567,was playing hide and seek with a few friends,0,3782
1568,woke up next to my girlfriend,0,284
1569,was having sex with a guy I met and in the middle of it his mother called him,0,47
1570,"Yeah, you can only play with so many balls.",1,3775
1571,"Get out of my bush you little bastard, i just trimmed",1,18
1572,was chatting with an amazing guy online,0,639
1573,just stick them in any of the holes!,1,549
1574,It came all over me and I'm all wet.,1,2652
1575,"O.K. guys, this is as hard as I can make it.",1,1191
1576,Is it wide enough for you?,1,199
1577,I only saw the tip of it but it looks huge!,1,1845
1578,was at the dentist getting a cavity filled,0,3133
1579,That was so bad I'm gonna give you another chance.,1,1951
1580,sent a picture to my girlfriend of my erect penis with a quote saying It's waiting for you,0,1524
1581,"professor, who was born without arms, asked somebody need a hand? There are over 300 students in that class and I was the only one laughing",0,1349
1582,best night ever.,1,2952
1583,was eating at a Mexican restaurant with my sister,0,714
1584,got on an elevator with a woman and her child,0,3409
1585,"It's okay, I'll let you put it in anywhere you want the first time.",1,3774
1586,dad asked me for a word that rhymes with vagina,0,3584
1587,had to explain to my boyfriend that the reason I don't want to stay overnight at his house is because I still occasionally wet the bed,0,2309
1588,boyfriend suggested we imagine each other as someone else when we had sex,0,235
1589,was walking around town with the girl I have loved for four years and have been 100% faithfull to,0,2834
1590,boyfriend and I were trying to have intercourse for the first time,0,3627
1591,Hot N Cold,1,1995
1592,"a great night of sexual pleasure, I ran to answer the door.",0,25
1593,God! You guys are unloading on me!,1,1514
1594,"oh f*** i cant take this, it's hurting my butt.",1,1807
1595,"When it's finished, where does it come out from?",1,1947
1596,"I can feel it, but I don't know who it is.",1,2259
1597,"Well, 13 inches is way too small. I could do 15, but I'd prefer 17- It'll make everything faster.",1,825
1598,was working out out at the gym doing squats,0,1787
1599,"Come on, just get it in the hole! Its not even that hard!",1,1354
1600,Eww! What is that nasty white stuff?!,1,1848
1601,grandma gave me the 'abstinence' speech,0,2502
1602,All he does is sit there and rub his tin sword all day long.,1,1450
1603,I touched it and was all hard!,1,2884
1604,I just can't wait to get that 6 inch in my mouth!,1,638
1605,realized my new kitten is the spawn of the devil,0,1012
1606,I'm going to finish this sausage....yummy.,1,618
1607,"mother keyed my car because I wouldn't invite her into my home and get her a cup of tea, so she could continue screaming that she was going to kill me while I tried to feed my 4 month old daughter",0,1188
1608,was watching an animal behavior movie,0,222
1609,I hate it when you miss your bus by 30 seconds.,1,705
1610,was at a bar and very drunk,0,2092
1611,was walking around the park with my wife,0,830
1612,was at my bosses house for a company BBQ,0,651
1613,"Stop jerking it so hard,its gonna break!",1,2375
1614,husband and I were having sex in the shower while our 5-year old was sleeping,0,602
1615,"I got into an elevator, I spotted a little old lady hobbling desperately to get on",0,1670
1616,told my boyfriend that I didn't feel like he loved me,0,1303
1617,got up the nerve to text the girl I've had a crush on to ask her on a date,0,2468
1618,I can't take it. It's too big.,1,1328
1619,You're going to have to take it out and turn it around then then put it back in because it's too big and wet,1,2124
1620,"No matter how hard I suck on this thing, it still won't come up.",1,249
1621,my boyfriend was seated in my section at work,0,2862
1622,was watching tv on the couch,0,1380
1623,Omg it hurts so much but it feels so good.,1,1864
1624,"Some of them are harder than others, but play with them over the weekend and see how you go",1,3453
1625,"Thank you for coming, I know it was long.",1,2188
1626,"Size doesn't matter, it's how you use it",1,1451
1627,"the train on the way to my mother's house, I was playing Mariokart with my son",0,1389
1628,was at the mall with my girlfriend's family,0,1167
1629,woke up next to my best friend after lots of drinking and the best sex I've ever had in my life,0,901
1630,visited home,0,558
1631,realized my friends and I should be more careful what we say around my younger brother,0,36
1632,"If you don't take it in the mouth, you know where it's gonna go.",1,2977
1633,6 year old daughter somehow learned about sex,0,2514
1634,was about to lose my virginity,0,2647
1635,"It's too small, it keeps sliding out of place!",1,3763
1636,"It doesn't have to be long, but it has to please me and it has to be easy for me to see.",1,3345
1637,Oh my god it's too much i can barely swallow.,1,1570
1638,"You want to go in there, don't you big boy?",1,3091
1639,That was really deep Kevin.,1,2234
1640,"was following my girlfriend up the stairs, I was pretty sure I was going to get lucky",0,3724
1641,was masturbating into a sock when I felt something on my cock,0,3403
1642,"Oh, yeah, I finger myself all the time.",1,1373
1643,I can make it wetter if you want.,1,2127
1644,"went to meet the girl I'd been talking to online for a while, and fallen in love with",0,383
1645,If it went any deeper i probably would have thrown up all over it.,1,115
1646,boyfriend was going down on me,0,2009
1647,"it's not that hard, we just haven't done it in a while",1,2171
1648,"It's so juicy, it's running down my face.",1,2257
1649,Keep going,1,335
1650,husband of ten years was playing the Sims,0,793
1651,teach English in Taiwan,0,2095
1652,got a new CD player for my car and an alarm installed for added security.,0,3832
1653,I was in math class and we were starting on a new unit in math and my Ex-girlfriend says ,1,1656
1654,I'd much rather get my fingers sticky than my mouth.,1,3100
1655,"woke up, completely naked, in bed with a guy I met the night before",0,2182
1656,that's never gunna work,1,1242
1657,"Woah, yours is a long one!",1,1542
1658,girlfriend told me she was pregnant,0,1526
1659,lunch I was running to my group's table with my friend,0,1996
1660,"Aw you popped my cherry! Wow, that's disgusting...",1,3539
1661,was on my girlfriend's computer,0,2811
1662,freaked out when I couldn't get my bathroom door open,0,2963
1663,woke up with extreme stomach pains,0,3925
1664,Donations accepted in the rear,1,996
1665,Any time he'd come I would tilt my head back and swallow the whole thing.,1,3307
1666,just put it in the back of your throat and don't think about it.,1,396
1667,I'm better on bottom.,1,2983
1668,GUYS GET OFF YOUR GONNA BREAK IT!! YOU CANT GET ON IT WHEN ITS DROOPING DOWN LIKE THAT!!!,1,3746
1669,Reach down there and pull out some balls.,1,3811
1670,neighbor knocked on my door and left a note that said Please stop singing in the shower,0,2341
1671,"Use one finger, not your whole fist.",1,1662
1672,"Ow, please don't put it in that hole, it really hurts.",1,1053
1673,realized what my mom has been calling me for 20 years,0,1610
1674,i like 'em really tight.,1,3920
1675,was a TA for a history class and the class was taking a test,0,2701
1676,was at the mall with my mom,0,2251
1677,i guess i just liked sticks better than balls,1,1590
1678,adorable five and a half year old boy told me that when he grows up he's going to be my boyfriend,0,813
1679,"I probably look funny doing it, but it's a great workout.",1,3166
1680,It was horrible...probably the most disgusting thing I ever put in my mouth! It just kept gushing out.,1,2406
1681,"a hard rock concert, a bunch of guys accidentally knocked down a port-a-potty while moshing",0,73
1682,threw a party while my parents were gone,0,3083
1683,got dressed in what I thought was a really adorable outfit,0,1358
1684,"Wow, it's amazing what you can do with your two fingers.",1,3691
1685,was with my grandma waiting in a line,0,666
1686,This stick is too long to aim at my lips.,1,3520
1687,"had to bail my dad out of jail, for beating up my boyfriend, for sleeping with my mom",0,1888
1688,Are you pushing it in far enough? That might be why it's not turned on.,1,2272
1689,realized that a Ph,0,1464
1690,my wife got her second kidney stone in a month,0,1536
1691,was filling out paperwork with my new doctor,0,650
1692,performed in my school play,0,3233
1693,I don't like bananas because they're mushy.,1,856
1694,lesbian sister enthusiastically showed me her new strap on,0,1635
1695,boyfriend and I were getting a bit steamy,0,1127
1696,"If you only do easy ones, then you'll be screwed when you come across a hard one.",1,624
1697,"was cutting a bagel, only to slice the back of my hand with the knife",0,1520
1698,Easter my brother & sister both got $200 gifts from my parents,0,2629
1699,Get that thing out of there.,1,908
1700,girlfriend of 2 years told me she was pregnant,0,1752
1701,hey is that a grande? I paid for a grande but it doesn't feel like a grande.,1,159
1702,was at the lake watching a romantic sunset with my boyfriend,0,982
1703,You can suck them and suck them and suck them and they will never get any smaller!,1,3381
1704,had to explain to my son that his dad was too busy in a raid on World of Warcraft to be at his award ceremony,0,2658
1705,"finally told my parents I would be changing bedrooms because I could no longer stand hearing them having sex, which is awkward and disturbing",0,845
1706,of the 4 stalls were occupied in the rest room,0,71
1707,"What the fuck! Don't you know how to aim, you got me right in the eye!!",1,847
1708,finally worked up the courage to tell my mom that I'm gay,0,2491
1709,Put it back in!,1,2898
1710,was fingering my girlfriend,0,1531
1711,it turns me off because it's so thick but it's still pretty good.,1,3217
1712,was at walmart when my stomach began to hurt,0,1284
1713,dentist sneezed in my mouth,0,659
1714,went skinny-dipping with my best friend,0,914
1715,Let me get wet real quick.,1,656
1716,decided to cheat on my math test by writing a couple equations on my hand,0,689
1717,"yeah, just give it a tug and it'll come.",1,422
1718,"was completely wasted at my bachelor party, and my friends thought it would be funny to put sodium nitrate on my penis",0,3415
1719,who wants to be the giver this time? and who wants to be the receiver?,1,1196
1720,boyfriend broke up with me over the phone,0,1748
1721,Is there any white stuff on my face?,1,2953
1722,Now don't jerk it too much or it'll fall off.,1,794
1723,decided to be adventurous and give my boyfriend head in the downstairs tv room,0,1285
1724,It's too big we have to move it around to get it out.,1,2458
1725,...it was mostly oral.,1,85
1726,"were visiting my great-grandma, who has Alzheimerâ€™s",0,1993
1727,I caught my daughter attempting to stick pencils up our cat's butt,0,2719
1728,boyfriend and I were having sex,0,1456
1729,"Yea it's been awhile since I've done it, so I bled a lot, but now it feels great!",1,1457
1730,girlfriend thought it would be sexy to stick her finger up my ass during sex,0,2306
1731,I want to ride that big banana!,1,2486
1732,was on my way home from a friends house,0,3440
1733,"Don't push it too hard, if it doesn't go in you must not being doing it right",1,291
1734,was on the phone bragging to a friend about losing my virginity last night,0,783
1735,"aww, its all loose now!",1,1698
1736,and my girlfriend were heading back to her place.,0,2143
1737,was in lying in bed with my boyfriend while he was asleep,0,1440
1738,"Oh my goodness, that's enormous. It's almost the size and weight of the phone.",1,2258
1739,was having sex with my girlfriend,0,338
1740,dog started to hump my leg,0,3179
1741,"Oh don't worry, when they see you coming they pull it out.",1,3717
1742,went to school in my brand new shirt,0,497
1743,tried for the first time putting a condom on my boyfriend using my mouth,0,695
1744,was getting it on with my boyfriend,0,354
1745,was nude modeling for the first time for a life art class,0,1072
1746,was talking to my boyfriend on the phone,0,95
1747,told my best friend I was breaking up with my girlfriend of 3 years.,0,410
1748,It's suppose to be hard now and soft later.,1,1907
1749,was told by my mom that I'm a terrible person because I won't help my brother get a girlfriend,0,2359
1750,found out that my 43 year old wife has been having a cyber relationship with a 14 year old kid on Halo,0,1930
1751,was with my mom and my boyfriend at lunch,0,3709
1752,was rushed to the hospital because I was crying so hard I couldn't breathe,0,351
1753,"managed to not think too much about how alone I feel living in a strange city, and I went out to find a quiet place to write and eat",0,846
1754,was having amazing sex with this guy I had been seeing for a while.,0,1903
1755,friend thought it would be funny to put a pretzel on my forehead while I was sleeping on the beach,0,2885
1756,was babysitting,0,2215
1757," I'm having fun getting it off, but it keeps going back in my face",1,2940
1758,"Wow, the dang thing is really in there, how will I get it out?!",1,418
1759,developed the disposable camera pictures from my family's trip to Disney World,0,452
1760,I got married,0,2718
1761,girlfriend broke up with me by sending me a text.,0,3906
1762,was at a party and we were all playing Seven Minutes in Heaven,0,3260
1763,If you poke me with that thing one more time I'm gonna break it off.,1,2926
1764,These are so much bigger than the ones from last time!,1,2593
1765,I want you to mount it and grip it tight. I don't want you sliding off the end. Lean forward slightly and touch back down.,1,841
1766,appears that my girlfriend visited an internet web page called How to confess to having an affair,0,1203
1767,Ugh! I can't find it!,1,653
1768,Ugh! His head just won't fit! It's too big!,1,2030
1769,car broke down,0,616
1770,was spacing out in French class and randomly got an erection,0,487
1771,had sex with this guy who I like very much,0,3279
1772,How do you do this?!,1,500
1773,"Most of the time I can control, it but today it just came out",1,524
1774,You gotta pull it out and lick all the white stuff off.,1,41
1775,"dad woke me up by shaking me and saying If you're not up in two minutes, I'm lighting a firecracker in your room",0,2302
1776,Just put it in now and you'll feel a lot better.,1,730
1777,There's too much meat in my taco!,1,2644
1778,texted my dad and told him I was getting married in five months,0,1661
1779,"wow, you are done already...?",1,1624
1780,wife got the flu.,0,562
1781,daughter got engaged,0,880
1782,"asleep, I dropped my pill before I could take it",0,442
1783,was in line in the grocery store with my 3 year old son,0,2397
1784,don't get off until I tell you to.,1,3579
1785,boyfriend was making salsa and got jalepeno juice all over his mouth,0,3508
1786,my hands hurt can we take a break.,1,2286
1787,found out my girlfriend had sex with three different guys in one day,0,2267
1788,"came home to find my 25 year old boyfriend laughing hysterically at his laptop while he made Microsoft Sam say feces, penis, and diarrhea",0,2893
1789,Open wide so I can stick it good in there,1,1634
1790,"Yeah, I thought it was gonna be a little long, but it was actually kinda short. It fit perfectly.",1,2790
1791,Man you're just too fast for me.,1,3374
1792,was on the phone with a prospective blind date,0,3588
1793,got hit in the mouth with a hockey stick and lost four teeth,0,3210
1794,i cant get it out of my throat! its like stuck in there!,1,2164
1795,It's hard to get it flowing but once you do it's really nice.,1,244
1796,"I was okay, then I just started getting all wet and I didn't really like the feeling of it",1,2456
1797,found my son's iPod touch and was looking at a light-saber app,0,2744
1798,mom explained to me that looking up gay porn on the internet is bad.,0,649
1799,told my boyfriend I was pregnant,0,3794
1800,bought my girlfriend two tickets to a Broadway show that was coming through town she really wanted to see,0,1887
1801,man came up to me at the bus stop,0,317
1802,It's too big! I can't put two hands around it!,1,674
1803,sprained my wrist playing Guitar Hero,0,1309
1804,"thought it would be funny to sneak up behind my cat and scare it with a loud boo! The cat responded by jumping up, and running across my apartment, which would have been fine, except for the fact she left a trail of liquid shit everywhere she went",0,3549
1805,"That sounds painful, ",1,2352
1806,How do you eat the foot-long? After six inches I'm stuffed!,1,735
1807,got a spray tan for the first time,0,2011
1808,my wedding,0,2661
1809,I'll stretch it until you come.,1,2004
1810,I didn't realize it squirted that much,1,475
1811,It tastes better if you lick it off the top,1,2150
1812,was bored at my job at Home Depot,0,1359
1813,my shaft is longer than yours.,1,1893
1814,"That's okay, We're used to being on our knees.",1,2527
1815,yea I've been blowing all day and it just keeps on coming,1,262
1816,was on a bike ride when a bug flew into my eye,0,2065
1817,is it suppose to hurt like that?,1,1998
1818,snuck out of my house in the middle of the night,0,3787
1819,girlfriend and I walked to her couch while kissing with our eyes closed,0,2971
1820,girlfriend updated her Facebook status when I was with her,0,2434
1821,wore my kilt to the university I attend.,0,2870
1822,was sitting in Science class and to my surprise I felt my pants suddenly becoming warm and wet,0,925
1823,was rushed to the hospital to deliver my child,0,1794
1824,Wayside School,1,2079
1825, it needs to be long and fat.,1,3636
1826,"Now I can handle 3 inches or so, but 6 is just too much to handle.",1,1846
1827,This position is really rough on my back.,1,2956
1828,had some family over,0,204
1829,"Just tell me if you get too wet, okay?",1,3114
1830,Oh my God! It keeps on coming!,1,3410
1831,I love putting things in my mouth...it feels good!,1,2106
1832,Amanda just let me poke her in the face with that stack of money.,1,2556
1833,"Ahh, I got juice all over me!",1,1166
1834,went out on my first date in 2 months,0,1230
1835,and my friend decided to spy on my crush,0,3704
1836,went swimming,0,3870
1837,"I knew you were coming, but I didn't know you were going to do THAT!",1,1162
1838,I've been trying to get that f-ing nut off all day but it was too hard and tight!,1,2051
1839,stop messing around in her shrubbery down there.,1,428
1840,do you really want it going into your mouth when you are sleeping?,1,838
1841,I choked before I even put it in my mouth.,1,3901
1842,asked my boyfriend of almost ten months who his top five women to have it off with would be,0,1711
1843,"found out that I was adopted, now my gay brother thinks it's acceptable to tell me that he's always wanted to have sex with me",0,2269
1844,was going on a first date with a girl I really like,0,3580
1845,mom talked about how it's interesting how there's so many different size of penises,0,467
1846," If my whole hand covers it, then it's too small.",1,2746
1847,I need more wood.,1,1458
1848,"Give me the thingy, I know how to work it,I'll just stick it in.",1,3489
1849,"woke up to the face of Billy, the puppet from Saw, staring down at me",0,1319
1850,"I was talking my three year old daughter home from daycare, she asked where her daddy was",0,1131
1851,Wow I hope i can fit it in my mouth,1,2601
1852,was eating M&Ms on a chair when I dropped one and it fell under my crotch,0,879
1853,"it better taste good, cause it's coming fast.",1,3844
1854,Just put it in any hole that's wet enough...,1,1510
1855,I could get this in! I could get this in! I just need to squeeze it tight and push it in quickly.,1,2482
1856,woke up from a dream about finding a vending machine that gave me free food,0,2533
1857,asked a very cute fireman for his number just in case I needed him to come to my rescue,0,3803
1858,was out with my friend,0,947
1859,"work, I was accidentally knocked down a long flight of stairs",0,2510
1860,"boyfriend was in the shower, and I decided to go join him",0,3665
1861,"Okay, but you can't have my cherry.",1,415
1862,"Almost done, only two more holes left!",1,358
