,sentence,label,idx
2226,I've never seen anything so short in my life!,1,1802
2227,was in the car hooking up with my boyfriend,0,2907
2228,It's sooo cute when you nibble it softly like that!,1,959
2229,boyfriend got mugged,0,3922
2230,"I can't do it, it hurts!",1,2467
2231,"was watching this TV show where a man was describing how much he loved this woman, how he made every opportunity to see her, and how he loved her in a way nobody else could",0,3896
2232,was riding my bike and stopped at a street light,0,1599
2233,was eating ice cream and I noticed some on my jeans so I wiped it off with my finger and licked it,0,1892
2234,It's not working.,1,1057
2235,"was showing my new iPhone case to my friends, saying how it was scratchproof, shockproof, and waterproof",0,336
2236,I shouldn't yell or it might come in my mouth.,1,2484
2237,asked my boyfriend to try and man up and act a bit tougher,0,2354
2238,"found out that whilst I was asleep last night, my boyfriend was playing on his XBox",0,2437
2239,went for a jog,0,3051
2240,"Yeah, he was trying to get all deep with me, and he just kept plugging away at but it wasn't working.",1,1647
2241,I will beat you with this book!,1,935
2242,"was eating at a restaurant with my boyfriend, he is 6'2 and i am 4'11",0,3706
2243,"No! You must stick it in, and make sure it's moist!",1,1189
2244,accidentally walked in on my roommate while she was changing clothes,0,3715
2245,picked up my 17 years old daughter after a late night movie in down town and got pulled over by a cop,0,28
2246,was pushing my 4 year old on the swing,0,2994
2247,found a box of birthday candles sitting on the coffee table,0,3214
2248,doctor told me that I have Vasovagal Syncope: I pass out every time I get aroused,0,1453
2249,parents hosted a party at our house,0,245
2250,"Wow, if it was that wet, I'd just keep going back and forth, back and forth, back and forth. That would be fun.",1,1941
2251,said to my wife that I wished I had met her 20 years ago,0,3407
2252,"High five, you made it in!",1,1992
2253,was on a first date with a girl at the movies,0,3375
2254,"was my wedding day, and while I was standing next to my husband in front of all of our guests, I was rocking on my heels because I was nervous",0,1027
2255,parents were out so I invited my girlfriend over,0,1924
2256,"boyfriend of over a year looked at me and said, Sometimes I just want to hit you",0,1754
2257,I've never done one this big before!,1,1154
2258,"am currently grounded for three weeks, have no car, cell phone, or television privileges, and am not allowed to spend more than 10 minutes on the computer a day",0,2584
2259,"the shower, a dime fell on my foot",0,2057
2260,Wow! That one was hard to blow.,1,1175
2261,No.,1,438
2262,"waiting to get home to go to the bathroom, my six year old neighbor popped out and literally scared the shit out of me",0,3929
2263,my grandmother's funeral and we had to sing,0,2660
2264,very good platonic friend of mine said he had a question to ask me,0,363
2265,I like how the balls feel in my hand.,1,1673
2266,"class, I asked my teacher for a rubber",0,515
2267,reached a new low and embarrased my entire family,0,920
2268,you've got to make sure you shove that all the way in for it to engage.,1,3296
2269,"driving to the store, an idiot driver found it to be okay to drive ridiculously fast in below freezing temperatures on the ice and snow",0,1627
2270,grandmother gave me a huge speech on being abstinent until marriage,0,3340
2271,"sitting on the bus a stranger sat next to me, farted, put his hand under his butt to smell what it was like, and then sniffed it throughout the whole ride while glancing at me",0,625
2272,found out that you can get arrested for holding up a 'free hugs' sign,0,1671
2273,boss forgot her meeting with an official from the military base and called to ask me to handle it,0,776
2274,son told his teacher that she has a nice rack,0,2479
2275,What happens if I do this?,1,1437
2276,This is great. It's one quick gulp then you're ready for another.,1,829
2277,There's no way I can vault over that!,1,2360
2278,It keeps being dried up when I pop open a new one,1,3839
2279,was eating a hamburger on the street when a pigeon came down to take a bite,0,3644
2280,I HATE it! He just came out of nowhere!,1,3946
2281,friend was pulled over and told to get out of the car,0,937
2282,I still have the taste of nuts in my mouth!,1,202
2283,"He put that thing in my face, and I can still taste it in my mouth!",1,798
2284,"Wait could you do that once more, real slow so I can watch.",1,1201
2285,do you know how much it sucks to wake up to a vibrator every day?!,1,3748
2286,"in my room sleeping, my little brother deemed it necessary to come in and drop a book on my face",0,97
2287,was looking at my friend's dad's Facebook pictures because he recently posted a status update,0,2703
2288,I can't stretch it over the thingy!,1,2546
2289,boyfriend thought it would be funny to speak Parseltongue to my vagina to prepare the Chamber of Secrets for entry,0,2081
2290,"Oh damn it's too big, it won't fit. I guess I'll just have to suck on it.",1,1912
2291,"I worked the drive-through at Wendy's, the hottest girl from my math class pulled up to the window",0,3205
2292,was watching PokÃ©mon with my daughter when she told me that I reminded her of her favorite PokÃ©mon,0,1693
2293,"a supervisor at a water park, several clients came up to me and complained about a topless girl in our wave pool",0,3799
2294,"It's so slippery, I can't get a good grip on it.",1,2759
2295,I know! I've never had to swallow one this big!,1,3942
2296,"I don't know how it got so big and heavy, but it went in good!",1,210
2297,cat woke me up by sharpening his claws on my breast,0,2987
2298,"Can we slow down? Actually, can we just dismount for a minute? I need to catch my breath, I'm not used to riding this hard.",1,1034
2299,"boyfriend asked me out to dinner, which we never do",0,2427
2300,went to a chinese restaurant with my asian girlfriend,0,2962
2301,"We have to make this a quickie, in and out.",1,378
2302,Just because your done doesn't mean I am!,1,2062
2303,went to a fast-food joint and ordered off of the $1,0,14
2304,"It just slides in so smoothly, and without any noise!",1,2804
2305,was in the car with my mom and dad,0,816
2306,sent a text message to my girlfriend telling her how much I wanted to make love to her tonight,0,501
2307,phone rang while I was home alone,0,357
2308,was talking to my parents about feeling insecure with my beach body as Spring Break keeps getting closer and closer,0,449
2309,"mother told me that the carbon-monoxide alarm went off last night, but since she didn't smell any gas, she decided to just remove the batteries and go back to bed",0,631
2310,aunt came into the world,0,694
2311,Can this be over soon? My butt hurts so bad.,1,2503
2312,boyfriend confessed that he felt so insecure he submerged my $80 vibrator in water to eliminate the competition,0,2554
2313,its so small and skinny and it has no juice.,1,333
2314,"working at a Subway store right next to a big hospital, there was a big line of people all getting their subs toasted",0,1505
2315,got an Enlarge your penis email for the millionth time,0,2650
2316,We haven't done 69 in a long time so you might not remember how to do it.,1,3840
2317,"felt like spicing up our marriage, so I thought I'd surprise my husband when he got home from work",0,2745
2318,was wrapping Christmas presents for my family,0,3189
2319,I found out that the woman I'm currently dating used to be a man,0,3848
2320,heard the sound of footsteps in the basement,0,1391
2321,in a public restroom I could hear a guy having his way with his hand,0,697
2322,400 pound roommate brought home a 400 pound guy,0,3755
2323,I'm still wet from this morning!,1,3592
2324,was going to have sex with my Hispanic boyfriend,0,2958
2325,Jackson died,0,2280
2326,hooked up with the guy I've been seeing,0,3809
2327,crush was talking to me on Facebook,0,118
2328,"You need to be careful with your fingering, or else you won't make it all the way up.",1,1467
2329,was sitting in traffic for about an hour,0,910
2330,boyfriend and I had great sex and afterward decided to take a shower together,0,3088
2331,has been a year and a half since my boyfriend discovered online poker,0,1515
2332,"It's so deep, and moist!",1,3845
2333,was in the car with my cousin and we saw a family of three,0,3483
2334,was lying in bed throwing a football in the air and catching it,0,187
2335,boyfriend and I were at his house having sex,0,988
2336,"I got down on one knee, and was in the middle of saying Will you marry me?, she answered a text message",0,3847
2337,found out that my husband made a replica of our family on The Sims 3,0,644
2338,girl I have had a crush on for the last 4 months asked me on AIM how to block someone,0,1767
2339,"I've been blowing this thing for two hours, and I've got nothing!",1,3731
2340,woke up and looked in the mirror and noticed that my face was covered in glitter,0,2839
2341,went for a jog,0,1219
2342,everything about our intercourse pained me,1,3059
2343,"I'm Coming, I'm Coming. It just takes soooo long for me to get there.",1,788
2344,6 year old daughter saw a man in a wheelchair who's leg had been amputated,0,463
2345,was at a local chinese restaurant with two of my friends,0,3492
2346,This thing has been poking me all day.,1,1148
2347,mom taught my boyfriend of 2 weeks how to put on a condom,0,2915
2348,it is a little tight but your small so you could fit.,1,2908
2349,you have to squeeze it before you put it in.,1,1726
2350,saw my boyfriend for the last time for two years,0,3196
2351,"bought my cat a nice big bag of expensive anti-hairball catfood, so she'd stop puking hairballs on my things",0,3161
2352,this is a ball-handling skill.,1,3838
2353,"Make sure you beat it until it gets really hard, and then put it in.",1,899
2354,thought I heard my little sister playing on my brand new grand piano,0,1664
2355,was at a pond taking pictures with my new camera,0,164
2356,was having sex with my boyfriend,0,2634
2357,"working my job as a cashier, one of the customers that came to the register was a midget",0,390
2358,had just gotten over the flu and thought I was better,0,3286
2359,"was at the dentist's, getting my teeth cleaned",0,715
2360,teacher confiscated my cell phone for text messaging,0,2680
2361,"ok this is gonna be very hard with four people, so who would like to suck first",1,2504
2362,I went to see Paranormal Activity 2 with my boyfriend,0,513
2363,I don't wanna blow Kevin's! I have no idea where that thing's been!,1,1889
2364,mom drove me to football practice,0,151
2365,left-handed boss needed PC help,0,2104
2366,OH! Oh my God! I'm blowing all these guys!,1,3191
2367,No I know they're just going to force it down my throat.,1,680
2368,cat managed to lock my dad and me outside of our house,0,431
2369,was at a party when I got covered in the liquid from a glow stick,0,574
2370,"was in a tour group going through a cave and our guide stopped, turned off the lights, and told us to be quiet so we could feel absolute silence",0,1690
2371,learned to check inside the oven before you preheat it,0,2041
2372,Put it in and then you can come inside.,1,2298
2373,But I banged him!,1,2882
2374,I wish we would have recorded that moment when the thing blew up and exploded all over my face!,1,2621
2375,"twin sister sent a nude picture to her boyfriend, who then forwarded it on to everyone else",0,1800
2376,"boyfriend picked me up to come spend the night at his house, and on the way he started pulling over to get some condoms",0,2029
2377,went on a first date with a guy I don't know very well,0,1994
2378,boyfriend and I were cuddling on his couch when suddenly I tried to get up,0,2231
2379,"at football practice, my teammates and I were on water break",0,2822
2380,"No honey, not that hole, it's too small I don't think it will fit, try again!",1,2033
2381,girlfriend was giving me head while I was watching Star Trek and I accidentally called her Spock,0,2199
2382,Would you like the black one or the white one?,1,3762
2383,ran into a bird,0,3295
2384, Oh god! There's a hole here too!! ,1,3215
2385,was my final meeting with my psychologist who was helping me with my bipolar disorder,0,1790
2386,"Alright, I will try my hardest to come.",1,381
2387,alarm went off at 6,0,700
2388,It's too long and my throat hurts.,1,3445
2389,"bending over to get the brownies I was making out of the oven, my husband slapped my butt.",0,2800
2390,Every time you come in my room you make a mess.,1,448
2391,saw myself in a 'girls gone wild' ad with another girl,0,1446
2392,I don't think I am doing this right.,1,3944
2393,decided to visit my girlfriend who lives 20 hours away,0,3131
2394,finally exchanged pictures with the woman I've been seeing online for some time now,0,906
2395,was having sex with my boyfriend,0,1422
2396,my first day at school,0,3052
2397,family and I were at a restaurant,0,2399
2398,"came back from a hike to see my trailer rocking, as well as some strange but obvious noises coming from it",0,2370
2399,You gotta bend your legs to get the thing in the hole.,1,2973
2400,decided to let in my new German Shepherd puppy inside to show the guest how adorable he is,0,1663
2401,"took a bike ride to enjoy the weather and stopped for a break on the sidewalk of an overpass, taking in the view of the beautiful hills",0,2348
2402,"poke it and if it jiggles, put it back in for another 5 minutes.",1,1850
2403,"I love the taste, but it's just too big to fit in my mouth!",1,3209
2404,"He whipped it out, tried to squirt it in my mouth, but he missed and got it all over my face!",1,1857
2405,was performing in an orchestra concert,0,3123
2406,"Watch, I'm gonna put it in that little slit.",1,2148
2407,was rejected from the University of Washington,0,1300
2408,found out that my best friend lost her virginity to my father,0,294
2409,"Oops, sorry, I swallowed.",1,1970
2410,son stuck coins in our DVD player,0,753
2411,got very dressed up and was excited for my uncle's wedding,0,3086
2412,parents decided to visit me,0,3207
2413,boyfriend called and told me he had cheated on me with a minor,0,717
2414,was with my girlfriend in her room,0,3558
2415,"This thing just won't go in, ",1,3690
2416,brother's best friend spent the night and was changing with the door partially open,0,1466
2417,"my boyfriend was about to go down on me, he held his breath and said, I'm going in!",0,2989
2418,eww its all coming in my mouth,1,3183
2419,tried to prove to my dad that he snores by secretly putting a tape recorder under his bed,0,2401
2420,"an Aunt's wake, my five year old son walked up to the coffin, and, with the whole family around him, exclaimed, Well that's good, I was wondering where she's been",0,3096
2421,Don't you dare pull that out yet!,1,2176
2422,Wow! It goes in easier when its wet!,1,3278
2423,You really need to be in the mood for it or it just leaves you feeling unsatisfied.,1,2177
2424,Do I still have white stuff on my face?,1,1625
2425,"Ahhh! It's in me! OMG, it's so big! It hurts, get it out!",1,1108
2426,boyfriend and his parents met my family,0,432
2427,caught my little brother peeping at my friend getting dressed in the bathroom,0,2239
2428,just grab it and shove it up there,1,620
2429,"Dillan, you squirted it on me! I'm wet!",1,1973
2430,they should put rubbers on those things,1,1248
2431,got mugged by someone wearing a bear suit,0,2389
2432,"me and my boyfriend were having sex, he moaned out his own name",0,902
2433,it goes down easy but is hard to get it back up.,1,2113
2434,it would be better with more people but one-on-one could still be fun,1,2122
2435,"Careful, its real slippery in there",1,2992
2436,"I just kept shaking it, and shaking it,and I even pulled, but it just wouldn't shuffle.",1,2651
2437,I can't get it back in.,1,2625
2438,"Sorry I squealed, that was the biggest one I've seen in a long time.",1,849
2439,got a call from my son's second grade teacher,0,3880
2440,"Dude, I squeezed it and it shot up into the air and landed on my face!",1,772
2441,wow' you're going really slow.,1,2913
2442,"I don't think I can fit another one in me, im just too full!",1,2465
2443,It should only take 15 minutes to change sets. They're running late,1,3077
2444,it might pop in your hand.,1,1415
2445," LCD TV for my bedroom and my friend was over telling me how huge it looked in my room. I looked at him and said, ",1,3331
2446,crush came to my house to watch movies with me,0,3656
2447,woke up from a nap to hear my roommate having some intimate time with his hand,0,3752
2448,Wow! I got her pants so wet!,1,2858
2449,Dammit it fell out.,1,87
2450,If the legs aren't straight it's going to go in crooked.,1,1567
2451,"shopping for some bananas at my local grocery store, an old woman came up to me and started rubbing my stomach",0,2957
2452,found the source of the bad smell that has been plaguing me for the past two weeks in my apartment,0,3147
2453,parents asked me if I had a nice time with my girlfriend at the amusement park I took her to yesterday,0,1016
2454,Wait! I can't find my rubber! I use it for my strap on!,1,1640
2455,Stop playing with it and just put it in already!,1,464
2456,"boyfriend handcuffed me to the bed, naked",0,175
2457,"if any of you need a good fingering, John would be happy to help.",1,1506
2458,"Okay you just gotta swallow it fast 'cuz if you let it sit too long in your mouth, it will be too creamy to swallow!",1,188
2459,"I love you, but you have to get out from between my legs",1,958
2460,boyfriend and I had sex for the first time,0,3010
2461,"found out that my 'girlfriend', who I've been emailing with, was really my friend playing a prank on me",0,1
2462,"Yeah, they're slick when they don't have anything on them.",1,1569
2463,went to a bar with two guys I was interested in,0,3951
2464,Do you always have to be so rough?,1,2326
2465,grandfather was counting all the grandchildren he had and saying how fortunate he was to have all of us,0,3151
2466,"Well, I heard you say my name so I came as fast as I could.",1,2394
2467,Wtf? You know I like the short fat ones!,1,3300
2468,learned my 40 year old father is marrying a girl barely a year and a half older than me,0,641
2469,...there's one in the front and one in the back.,1,3722
2470,I don't care as long as it's fun to play with.,1,688
2471,shower is being renovated so I decided to wash my hair in the kitchen sink,0,1641
2472,"class was focusing on discrimination, and our teacher asked us if anyone had ever felt discriminated against",0,2440
2473,texted my college boyfriend to tell him how terrible I felt about cheating,0,970
2474,"It came, it finally came...THE BIG ONE.",1,3062
2475,Thomas you have to push it in and twist!,1,3397
2476,Its not too hard. You just have to put it in the right place.,1,3571
2477,"girl I'm secretly in love with, whom I was talking to on MSN, told me she'd brb in 10, no wait 20, oh make that 30 min depending on her boyfriend's stamina",0,458
2478,Man this stick is stiff,1,3564
2479,found out that my girlfriend had replaced our picture in her locket for a picture of Taylor Lautner shirtless,0,2895
2480,"He was big and I was nervous, I just took the picture and got out of there.",1,1066
2481,walked past a church with a bunch of people standing outside waiting for the bride and groom to walk out,0,2424
2482,You want a ride? All you have to do is sit on it.,1,43
2483,"had to take a leak, so I went into a porta-john",0,2792
2484,learned that removing your boyfriends boxers with your teeth is waaaay less sexy when you accidentally bite a chunk of his pubes and yank them out in the process,0,3852
2485,came out to my dad,0,1040
2486,Do I have to be here long?,1,264
2487,was talked into having sex with my boyfriend of 4 years,0,1521
2488,told my 3 year old daughter to behave or I'd spank her,0,1548
2489,"there used to be a bush there, but it's not there anymore.",1,200
2490,I can't imagine what it would be like to be on the receiving end of that thing.,1,758
2491,found out my angry ex girlfriend put Nair in my shampoo before moving out of my dorm,0,2421
2492,"That was awesome but, now I am all wet.",1,3383
2493,"My hands hurt, its cold and these balls are too hard.",1,3620
2494,"work, a woman came up to the counter and asked if we made sweet and sour chicken",0,158
2495,was riding my bike without the seat cover on,0,1989
2496,"No, no! Don't take it out! It wont go back in!",1,3649
2497,Why are they all so big? I just want a small pair of balls!,1,1193
2498,How far do I push this thing in? It's so hard.,1,2939
2499,friends and I decided to compare dick sizes one by one,0,2757
2500,Oh man! It squirted on my face!,1,3181
2501,found out that my girlfriend feeds her boogers to our dog,0,3791
2502,was working at the library,0,3700
2503,You have a 50% chance of getting head and a 50% chance of getting tail.,1,1962
2504,boyfriend told me he loved me for the very first time in three years,0,1781
2505,went to my new job at a pre-school,0,1755
2506,was about to go and take a shower when I saw a pair of scissors taped to the door at eye level with a note from my boyfriend saying Time to trim that hairy thang down under,0,2168
2507,put your fingers in all the holes.,1,96
2508,"Yeah, but I've blown bigger ones, just didn't take pictures.",1,1192
2509,was told I sound like a seal barking when I orgasm.,0,985
2510,learned explosive diarrhea is real,0,748
2511,went on a date with a guy for the first time,0,3778
2512,"driving home, I was so lonely I turned on my GPS, even though I knew the way, so it would feel like I had someone to talk to",0,3399
2513,I was lying on my back in bed playing with it and it exploded in my face.,1,3012
2514,"Come on, put your mouth on it! Suck it! Suck it, Kathy!",1,2531
2515,"wow, ur fast",1,3027
2516,was singing to my cat and she reached up and put her paw over my mouth,0,648
2517,"at dinner, I told my boyfriend that I wished he liked sushi",0,3291
2518,"women came into my work and one was wearing a shirt with a rainbow that said, We are everywhere",0,102
2519,found a bell that had been tied into the tassel of my ski hat by my twin sister as part of a longstanding prank war between us,0,1881
2520,met a guy at a bar and we went back to my room,0,3935
2521,"went to a bar with some buddies, and after trying to pick up a few girls, one of my friends got a number",0,2144
2522,adorable 8 year old son told me he no longer wanted me to pick him up from school,0,1516
2523,family was preparing a turkey for my grandma's birthday dinner when my aunt noticed a utensil on the counter and asked what it was for,0,1782
2524,spent two hours making a cake that I'd promised my class for weeks,0,2487
2525,I think I can squeeze you in.,1,1655
2526,Here put it in my hands and ill lick it from the bottom for you,1,3729
2527,parents told me they were going out for dinner tonight,0,1107
2528,Travis! Just go down already!,1,2163
2529,"Nope that does go in there. No, not in there either. Keep trying Charles, you can do it!",1,671
2530,I'm sorry I was riding you so hard.,1,2463
2531,Man that was so fun! I learned so much and felt so good. I was hoping that it wouldn't end even though it was so long.,1,2829
2532,We can't fill 'er up because our hose isn't long enough.,1,652
2533,"was standing in a queue when an old lady turned, looked straight at me, and asked me to hold her bag",0,2475
2534,Why are you so hard right now?,1,2355
2535,My favorite way to have these is to suck on them one at a time.,1,3201
2536,I have to wash off my hands. After sucking on that thing they're all sticky.,1,690
2537,"made the mistake of sneezing in front of a hyper religious customer, who for ten minutes blamed the incident of shifting weather patterns that signaled the return of Jesus, who was as she explained, upset about the abortion rates in America and President Obama",0,3302
2538,checked my bank account that i've been saving money in since I was a kid for college,0,1134
2539,"was with a group of friends at a bar, and we were all talking about whether we were moaners, screamers, or quiet during sex",0,3276
2540,I don't like the thick ones. I can't hold on to them if they're too thick.,1,975
2541,pissed my younger brother off,0,2284
2542,"had an elaborate plan to ask this girl to Prom, and it was going to take a few minutes to set up",0,3565
2543,He just exploded all over me!,1,2730
2544,"No thanks, the little ones don't last long. I prefer the bigger thicker ones.",1,1382
2545,opened my lunch in front of my friends at university,0,1268
2546,"It doesn't matter what color they are, they all taste the same.",1,3284
2547,"get inside, you can fit!",1,3143
2548,husband and I were talking about names for our expectant child,0,2335
2549,boyfriend and I were play wrestling,0,3725
2550,was cleaning my father's study room and wondering why I did not receive my acceptance/rejection letter from a college I really wanted,0,3423
2551,It's times like these where i wish my mouth was bigger.,1,3394
2552,"But,I play with it all the time, I just can't stop.",1,681
2553,6 year old daughter asked me if the tooth fairy was real,0,2529
2554,girlfriend was about to give me a blowjob,0,2794
2555,it went right in my mouth! ew ew ew.,1,691
2556,got my lip pierced,0,3462
2557,mom duly informed me I'm the reason people have middle fingers,0,1904
2558,was home alone while my mom went out to dinner,0,2692
2559,6 year old daughter walked in on my husband and I getting it on,0,760
2560,"Sarah get me a wet paper towel, I got it all over my leg and it's dripping",1,1918
2561,was flirting via text with a coworker,0,3482
2562,pulled up next to my boyfriend at a stoplight,0,3686
2563,"Wow, I didn't know he could get that long!",1,989
2564,This ball is too big! It won't fit in between my legs!,1,738
2565,met my boyfriend's very strict and traditional Korean parents,0,3530
2566,boyfriend humped me to the tune of the Imperial March from Star Wars,0,2119
