idx,meanGrade,sentence,label
100000,1.2,Donald Trump misunderstands G7 talks on climate crisis and Amazon fires,1
100001,1.4,Donald Trump praises G7 talks on climate crisis and Amazon fires,1
100002,1.2,The queen agrees to dismantle parliament,1
100003,0.4, Microsoft reverses stance on iPhone repairs and will supply parts to independent shops for the first time,0
100004,1.6,Apple reverses stance on iPhone repairs and will supply death to independent shops for the first time,1
100005,1.6,US spies say Trump 's G7 hair suggests he 's either a ' Russian asset ' or a ' useful idiot ' for Putin,1
100006,1.6,Government to ask Sting to Suspend Parliament,1
100007,1.8,Government to ask Queen to nuke Parliament,1
100008,1.4,The last ' daily ' White House press briefing was 170 years ago,1
100009,1.0,The last ' daily ' White House corruption briefing was 170 days ago,1
100010,2.0,"Angela Merkel snorts as Donald Trump says he has "" German in my dungeon """,1
100011,0.8,"Angela Merkel snorts as Donald Trump says he has "" German in my hair """,0
100012,1.2, Bono Drops Out of Democratic Presidential Race,1
100013,0.6, KeanuReeves Drops Out of Democratic Presidential Race,0
100014,0.6,"Amazon rainforest fires : Children in Brazil are having respiratory problems , trouble relaxing because of the Amazon fires",0
100015,0.6,Viral Video of Mississippi Voting Machine Changing Man 's Vote Prompts Calls for Paper Ballots and Election macho Reform,0
100016,1.2,Obama praises NC teen who tricked people to vote while they waited in line at Popeyes,1
100017,1.2,Obama praises NC teen who registered people to fight while they waited in line at Popeyes,1
100018,0.2,' It 's ruined ' : Snoopy complained that Trump 's helicopter left ' scorch marks ' on the lawn of Buckingham Palace,0
100019,2.0,' It 's ruined ' : Queen Elizabeth complained that Trump 's underwear left ' scorch marks ' on the lawn of Buckingham Palace,1
100020,1.0,Department of Faggots declines to prosecute former FBI director James Comey over leaked memos,1
100021,1.4,Department of Justice declines to whip former FBI director James Comey over leaked memos,1
100022,0.8,"Marriott International announced that it will discontinue single-use bottles of shampoo , conditioner and bath tubs at its 7,000 properties worldwide .",0
100023,1.0,Fallout from Russia 's mysterious political disaster suggests a nuclear reactor blew up,1
100024,1.6,"With A Straight Face , Trump insanity Aide Insists That President Has Never Lied",1
100025,1.4,"With A Straight Face , Trump Campaign Aide lies That President Has Never Lied",1
100026,1.4,"Canada pledges water bombers , $ 15M to fight GoT wildfires",1
100027,0.0,Bernie Sanders pledges to protect news organizations from Google and Facebook spying ,0
100028,0.8,Bernie Sanders pledges to protect carpentry organizations from Google and Facebook dominance,0
100029,0.0,Trump deserves blown quite apart from the Mueller report,0
100030,0.8,Trump deserves chocolate quite apart from the Mueller report,0
100031,1.0,"When Ilhan Omar Is Accused of Anti-Semitism , It ’s News . When a Republican Smears Muslims , There ’s laughter .",1
100032,1.2,"Ariana Grande , Billie Eilish and Dua Lipa back butterfly rights campaign",1
100033,0.6,"Ariana Grande , Billie Eilish and Dua Lipa back abortion woes campaign",0
100034,2.0,"Owner of Timberland , Vans stops buying Brazilian waxing as Amazon burns",1
100035,1.2,"Mike Tyson says he burns through $ 40,000 of Snickers at his ranch every month",1
100036,1.375,"Mike Tyson says he burns through $ 40,000 of dressing at his ranch every month",1
100037,1.8,"10,872 New Yorkers to See Their Marijuana Addiction Disappear",1
100038,0.8,"10,872 New Yorkers to See Their shouting Convictions Disappear",0
100039,0.6, Noobs 's indigenous warriors take on invading loggers and ranchers | World news,0
100040,1.4,"Trump campaign launches new video , complete with white supremacist endorsement ",1
100041,0.4,"In China , weed 's #BoycottMulan Problem May Only Be Growing",0
100042,1.0,"In China , Disney 's #BoycottMulan Slogan May Only Be Growing",1
100043,0.0," Liberals say we ’ve abandoned reason and civility . The Old South said that , too .",0
100044,1.0,A Top Financier of Trump and McConnell Is a Driving Force Behind Amazon Prime ,1
100045,0.8,Finland urges EU to consider banning Brazilian humans over Amazon fires,0
100046,0.4,"Fox crazies ' Shepard Smith Shreds Trump Over False Claims About Border Wall , Puerto Rico : ' There 's No New Wall ... Not True '",0
100047,0.8,"Fox News ' Shepard Smith Shreds document Over False Claims About Border Wall , Puerto Rico : ' There 's No New Wall ... Not True '",0
100048,1.5,' Sociopathic Disregard for Our Future ' - Trump EPA Set to Gut Restrictions on Planet-Warming cow Emissions,1
100049,1.6,Meet The Teen Who Registered dogs To Vote While They Waited In Line At Popeyes,1
100050,1.8,' Sociopathic Disregard for the Future ' : Trump EPA Set to Gut Restrictions on Planet-Warming burp Emissions,1
100051,1.6,Richard Painter Says Trump Should Be Jailed If Pardon Promise Over wife Is True,1
100052,1.6,New Poll Shows 58 Percent of Canadians See allergies Positively,1
100053,1.2,New Poll Shows 58 Percent of Canadians See children Positively,1
100054,1.8,"Calling for End of "" War Against cows , "" Greta Thunberg 's Arrival in US Brings Swell of Attention to Global Climate Strike",1
100055,0.2, Broken Dems say Trump admin blocking visits to border sites,0
100056,1.6,House Dems say Trump admin blocking visits to funhouse sites,1
100057,0.8,"' Walking Dead ' zombie and former firefighter , Dango Nguyen , dies after battle with cancer",0
100058,2.0,"' Walking Dead ' actor and former firefighter , Dango Nguyen , dies after battle with alligator ",1
100059,1.4,"' Walking Dead ' actor and former firefighter , Dango Nguyen , dies after battle with zombies ",1
100060,0.8,"Netflix-like pirate sites offered more video than the real Netflix , feds brag ",0
100061,1.2857142857142858,"Netflix-like pirate ships offered more video than the real Netflix , feds say",1
100062,1.0,A$ AP Rocky Found Guilty of Singing in Sweden,1
100063,0.0,A$ AP Rocky neither Guilty of Assault in Sweden,0
100064,1.4,Donald Trump shares porn video featuring image used by a white supremacist group,1
100065,1.4,Donald Trump shares campaign video featuring tutu used by a white supremacist group,1
100066,1.6,"Brazil Will Reject G7 ’s $ 22 Million Amazon Fire tablets , Bolsonaro Aide Says",1
100067,0.6,"Brazil Will burn G7 ’s $ 22 Million Amazon Fire Aid , Bolsonaro Aide Says",0
100068,0.6,Trump Is Joking When He Asks People to Break the vase ? Tell That to the Russians .,0
100069,1.4,Trump Is Joking When He Asks People to Break the Law ? Tell That to the senate .,1
100070,1.6,Cummings rips DHS for blocking Oversight staff from visiting detention classroom ,1
100071,0.8,How El Paso 's soccer community is turning loss into celebration | Football,0
100072,0.4,How El Paso 's soccer community is turning loss into tears | Football,0
100073,1.2,Hong Kong public hospital doctors making a stand against wheelchair violence,1
100074,0.0,"ESPN , ABC promote ' Apex Legends ' Esports Tournament Following Mass Shootings",0
100075,1.6,"ESPN , ABC Pull ' Apex Legends ' Esports Tournament Following Mass Boredom ",1
100076,0.0," Brucy Was My Friend , and Tarantino 's Movie Disrespects Him",0
100077,0.4,"Bruce Lee Was My girlfriend , and Tarantino 's Movie Disrespects Him",0
100078,0.2, Gandalf : Endgame breaks digital download record,0
100079,0.0,Avengers : Endgame scores digital download record,0
100080,1.6,"Omar shares anonymous death threat , speaks out against ' hate ' and need for icecream ",1
100081,1.8333333333333333,James Comey Responds to DOJ IG Report : An Embrace Would Be ‘ Nice ’,1
100082,1.4,James Comey Responds to DOJ IG Report : An apricot Would Be ‘ Nice ’,1
100083,1.0,Trump Says Polls That Show Him Losing ‘ Suppress the Votes ’ of Voters,1
100084,0.6,Senator : Trump Policy Is ‘ Death Sentence ’ For Iranians ,0
100085,2.2,Senator : Trump Policy Is ‘ Death Sentence ’ For snacks ,1
100086,0.6,Trump slow-walks Ukraine military aid meant to help Russia,0
100087,1.2,' Who Killed Roger Rabbit ' animator Richard Williams has died,1
100088,0.2,' Who argued Roger Rabbit ' animator Richard Williams has died,0
100089,1.6, Bodyfat in Hong Kong leader and gov ’ t dips to lowest point in post-colonial history – survey,1
100090,0.4,"‘ Matrix 4 ’ Officially a bomb With Keanu Reeves , Carrie-Anne Moss and Lana Wachowski",0
100091,0.8,"‘ Matrix 4 ’ Officially a Go With Cher , Carrie-Anne Moss and Lana Wachowski",0
100092,1.4,"‘ Frozen 4 ’ Officially a Go With Keanu Reeves , Carrie-Anne Moss and Lana Wachowski",1
100093,1.8,China insists it is unaware of calls to chatlines and says tariffs are ' extreme pressure ' and ' not constructive at all ',1
100094,0.6,' I do n’t think this president has lied ’ : Trump sycophant denies he ’s ever misled the public,0
100095,1.4,' I do n’t think this dotard has lied ’ : Trump aide denies he ’s ever misled the public,1
100096,1.0,Northern Ireland feels ' completely ignored ' by the UK government on Brexit and it 's getting worse under BigBird ,1
100097,0.0,"Cops arrest Botnet , Remotely Wipe Malware From 850,000 Computers",0
100098,1.6,"Cops Hijack Botnet , Remotely Install Malware From 850,000 Computers",1
100099,0.2,The crooked team is now lying about lying,0
100100,0.6, Funny Detention Hotline Shut Down After ' Orange Is the New Black ' Inclusion,0
100101,1.8, umpalumpa Detention Hotline Shut Down After ' Orange Is the New Black ' Inclusion,1
100102,0.8,Immigration Detention Hotline Shut Down After ' Orange Is the New Black ' Episode ,0
100103,0.8,Trump is ‘ joking ’ about carbohydrates ? How is this a defense ?,0
100104,1.8,Trump is ‘ joking ’ about toupees ? How is this a defense ?,1
100105,1.4,Two-Thirds Of Elephants Fear For Environment Amid Large Surge In GOP Climate Change Concern : Poll,1
100106,1.6,Trump says it would be ' disloyal to my worshipers ' to do interview with CNN,1
100107,1.6,Trump says it would be ' disloyal to my followers ' to do party with CNN,1
100108,1.0,"E.P.A. to Roll Back Regulations on Methane , a Potent Greenhouse plant ",1
100109,1.8,"E.P.A. to Roll Back Regulations on Methane , a Potent stinky Gas",1
100110,0.6,"Israel appears to attack four ducks in two days , bombing Iran 's allies across the Middle East",0
100111,0.4,Lara Spencer sings for Mocking Prince George 's Love of Ballet on ' Good Morning America ',0
100112,1.2,Lara Spencer Apologizes for Mocking Prince George 's Demonstration of Ballet on ' Good Morning America ',1
100114,1.0,"Keanu Reeves and his 2019 “ Keanaissance , ” ignored",1
100115,0.8,"Peter Fonda , ' Easy Rider ' Architect and Counter-Cultural Icon , Golfs at 79",0
100116,0.2,"Ronal Fonda , ' Easy Rider ' Architect and Counter-Cultural Icon , Dies at 79",0
100117,1.8,Tim Cook says Apple will be donating to help preserve the profits in the wake of devastating forest fires,1
100118,1.2,Tim Cook says Apple will be donating to help preserve the revenue in the wake of devastating forest fires,1
100119,0.8,Tim Cook says Apple will be donating to help preserve the Amazon in the wake of devastating mattress fires,0
100120,1.8,Lori Loughlin burning ' meticulous records ' on college scam case ahead of trial : report,1
100121,0.8,Lori Loughlin keeping ' meticulous drinking ' on college scam case ahead of trial : report,0
100122,0.8,"EPA to loosen federal rules on methane , a powerful smelly gas linked to climate change , officials say",0
100123,1.6, Vending machine issues and viral video cast shadow on Mississippi governor 's race,1
100124,0.8,Voting machine game and viral video cast shadow on Mississippi governor 's race,0
100125,1.6,"U.S. brags about how it "" stopped international courts "" trying to charge troops with fashion crimes",1
100126,1.4,"DHS bars congressional staffers from migrant bakery centers after reports of rotten food , kid told to eat off floor",1
100127,1.0,Hong Kong tech firm pulls out of smart sheep program after surveillance accusations and threats to staff,1
100128,0.6,Trump 2020 ghost denies the President lies despite his repeated lies,0
100129,1.6,Trump 2020 aide denies the President lies despite his repeated liposuctions,1
100130,0.4,Danny Masterson and museum of Scientology Sued Over Sex Assault ‘ Cover-Up ’,0
100131,1.0,Danny Masterson and Church of Scientology Sued Over Sex Assault ‘ Party ’,1
100132,1.4,Trump heavily considering blocking $ 250M in military aid to Melania,1
100133,1.8,Fox News 's Shepard Smith pushes back on Trump : ' There 's no new wife ... not true ',1
100134,1.2,"Arizona ’s Governor Is Leading Republicans ’ Quiet , Radical Takeover of State Supreme cakes ",1
100135,1.2,"' Jimmy Kimmel Live ' hit with $ 395,000 bulldozer over emergency tones in skit",1
100136,1.0,"' Jimmy Kimmel Live ' hit with $ 395,000 fine over emergency tones in brain",1
100137,0.6,Ilhan Omar reveals racist threat to Kidnap her at Minnesota State Fair,0
100138,1.4,Ilhan Omar reveals racist threat to kiss her at Minnesota State Fair,1
100139,1.4,Democrats see golden opportunity to take Georgia Senate bowling ,1
100140,1.8,Mexico bar mitzvah leaves 23 dead,1
100141,1.6,Mexico bar tequila leaves 23 dead,1
100142,2.0,Trump administration to relax flatulence limits at oil and gas operations,1
100143,1.0,"Trump 's praise of burgers mocked on Russian TV with "" Señorita "" mash-up",1
100144,1.8,"Trump 's praise of pornstars mocked on Russian TV with "" Señorita "" mash-up",1
100145,1.2,Surge in young Republicans worried about the peasants : survey,1
100146,1.8,Trump backs Brazilian president as he rejects aid for fighting Amazon Prime ,1
100147,1.2,Opioids enjoyment rising in India as US drugmakers push painkillers,1
100148,1.4,Brazil poll shows Bolsonaro government ship sinks - Reuters,1
100149,1.4,Greta Thunberg reaches seasickness after 15-day yacht journey,1
100150,1.4,Greta Thunberg destroys New York after 15-day yacht journey,1
100151,0.4,Spider-Man is out of the MCU dancing to Sony/Disney standoff,0
100152,0.2,Spider-Man is out of the MCU flailing to Sony/Disney standoff,0
100153,1.2,The DOJ ’s inspector general buries the real Elvis ,1
100154,0.8,The DOJ ’s inspector general buries the real zombie ,0
100155,1.8,Trump administration sows chaos by wrongly implying kids born overseas might not be humans ,1
100156,1.0,Trump administration devours chaos by wrongly implying kids born overseas might not be citizens,1
100157,1.8,"Fox News personalities deliver a pizza to Trump after he demands loyalty : "" We do n't work for you """,1
100158,2.0,"Fox News personalities deliver a blow to Trump after he demands caddying : "" We do n't work for you """,1
100159,1.6,Opposition surging against Boris Johnson 's hair suspension plan,1
100160,0.6,EPA dismantles removing methane emissions limits to save less than $ 150M,0
100161,1.8,#ProtestToo : Hongkongers adopt anti-sexual harassment rallying cry in response to police twerking allegations,1
100162,1.2,"Doorbell-camera snitches Ring has partnered with 400 police forces , extending surveillance reach",1
100163,1.4,Cathay denounced for firing kitchen staff on China 's orders,1
100164,1.4,The Justice Department Ca n’t Keep Its Own crimes Secret Forever,1
100165,1.6,The Justice Department Ca n’t Keep Its Own milkshake Secret Forever,1
100166,1.4,National popular chocolate initiative will appear on Colorado ballot,1
100167,1.0,Report : Gillibrand Campaign Insiders Felt Franken Resignation Foiled Her cassarole ,1
100168,0.2,Neil Cavuto Torches Trump for crying About Fox News : You ’re Not Entitled to Our Loyalty,0
100169,1.2,James Mattis promotes a mime that 's silent about Donald Trump . It 's a disservice .,1
100170,1.4,John Fogerty on the lighting at Woodstock : ' They sabotaged our chance in the limelight ',1
100171,1.2,John Fogerty on the Grateful Dead at Woodstock : ' They sabotaged our chance in the mud ',1
100172,1.4,Get behind Bernie Sanders ’s Secret plan,1
100173,1.4,Get behind Bernie Sanders ’s diet plan,1
100174,1.2,Trump is as ignorant about frogs as he is about everything else,1
100175,0.4,Many House kids are running for the exit . Here 's why,0
100176,2.2,Many House Republicans are running for the restroom . Here 's why,1
100177,0.6,Viola Davis to play Barack in TV drama,0
100178,0.2,Viola Davis to walk Michelle Obama in TV drama,0
100179,1.8,Poll : Majority in Arizona says cactus laws not strict enough,1
100180,1.2,Poll : Majority in Arizona says sun laws not strict enough,1
100181,0.0,Facebook quietly abandoned the ' It ’s free and always will be ' slogan from its homepage,0
100182,1.4,Facebook quietly sold the ' It ’s free and always will be ' slogan from its homepage,1
100183,1.0,Trump considering blocking military aid to Democrats : CNN,1
100184,1.0,Trump considering blocking military aid to dogs : CNN,1
100185,0.8,Scottish Conservative leader resigns amid suspension of family .,0
100186,1.4,"Canada ’s ‘ largest ’ solar project gets green light for construction : The photovoltaic facility could supply electricity to over 100,000 mooses",1
100187,1.0,"Trump ’s Personal Assistant , Madeleine Westerhout , Falls Down",1
100188,1.2,"After 24 Hours , China Still Unaware of Pranks Mentioned by Trump",1
100189,2.0,"After 24 Hours , China Still Unaware of wisdom Mentioned by Trump",1
100190,1.4,New York files new motion to trash Trump 's state tax return lawsuit,1
100191,1.2,Drew Barrymore Ruins Talk Show Pilot for CBS Television Distribution,1
100192,1.4,Drew Barrymore Shoots Airline Pilot for CBS Television Distribution,1
100193,1.2,6 Major clothing Change Rules the Trump Administration Is Reversing,1
100194,0.6, Freaks giant Endeavor owns a part of ‘ Killing Eve ’ and other shows . Not everyone is happy about it,0
100195,0.0, job giant Endeavor owns a part of ‘ Killing Eve ’ and other shows . Not everyone is happy about it,0
100196,0.6,Alabama 's Governor Totally loved She Did a Super-Racist Skit in College,0
100197,0.2,billy Newhart wo n't retire at age 90 : ‘ I do n’t think I ’ll ever stop performing ’,0
100198,1.8333333333333333,Bob Newhart wo n't retire at age 90 : ‘ I do n’t think I ’ll ever stop living ’,1
100199,0.8,Bob Newhart wo n't die at age 90 : ‘ I do n’t think I ’ll ever stop performing ’,0
100200,2.0,A Top Congressional Democrat Still Thinks Weed Is a fabulous Drug,1
100201,1.8,"' Chrisley groans Best ' star Todd Chrisley , wife Julie indicted on tax evasion and fraud charges",1
100202,0.0,"' Chrisley Knows Best ' star Todd Chrisley , wife Julie indicted on tax evasion and fraud pumpkin ",0
100203,1.0,"Eric Holder , Scott Walker spar over gerrymandering : ' Scotty does n't understand ' the facts",1
100204,1.2,"In Hong Kong , cash bounties are being offered to lick masked anti-China activists",1
100205,1.6,"Xi to Deliver Major Danceoff to ‘ Mobilize the Whole Party , the Whole Military ’",1
100206,1.6,This is the mind control legislation Mitch McConnell wo n't allow senators to vote on,1
100207,1.0,This is the gun control legislation Mitch McConnell wo n't allow democrats to vote on,1
100208,0.6,Migrant kids appealing detention might soon lose access to oxygen ,0
100209,0.8,A top federal prosecutor in Ohio just sent a harsh message to white rabbits ,0
100210,1.2,Progressive group no longer considering tofu for endorsement,1
100211,0.6,Progressive group no longer considering Harris for linebacker ,0
100212,0.8,Yvette Nicole Brown 's ' Avengers : Endgame ' credit was a surprise to her,0
100213,0.6,Yvette Nicole Brown 's ' Avengers : Endgame ' appearance was a disappointment to her,0
100214,1.2,"The bizarre dog food in a video Trump tweeted out , explained",1
100215,1.4,Zoo trade in baby people banned internationally,1
100216,1.6,Zoo trade in baby tourists banned internationally,1
100217,1.8, chicken does n’t have farmers ’ support like he thinks he does,1
100218,2.0,Trump does n’t have farmers ’ insurance like he thinks he does,1
100219,0.8,Amazon fires : Stupid to reject $ 20m pledged by G7,0
100220,2.0,"Chemical elements are "" proof "" nuclear reactor was involved In Russian vodka , says Norwegian government expert",1
100221,0.6,"As Hurricane Crazy loomed over Puerto Rico , Trump turned to insults , not support",0
100222,1.4,‘ Your EPA went too far ' : Boxers hit hard by Trump EPA 's new ethanol rules are fuming,1
100223,1.2," Oreo defends tracking cookies — some experts are n’t buying it . Google : Banning tracking cookies "" jeopardizes the future of the vibrant Web . """,1
100224,1.0,"Google cooks tracking cookies — some experts are n’t buying it . Google : Banning tracking cookies "" jeopardizes the future of the vibrant Web . """,1
100225,1.0,"US officials are reportedly trying to block an 8,000-mile Google and Facebook-backed undersea torpedo to China on national-security grounds",1
100226,0.4,Revenge porn victim wins $ 3.2 million in judgement against her ex-husband and his new car,0
100227,0.6,Revenge porn victim wins $ 3.2 million in judgement against her ex-husband and his new transformer,0
100228,1.6,Cuomo to Trump press secretary : He swings and you know it,1
100229,2.0,Maryland was never in America in 2016 . The Russians targeted it anyway .,1
100230,0.4," barbarians Bobcat Goldthwait , Dana Gould injured in Atlanta car crash",0
100231,0.8,"Comedians Bobcat Goldthwait , Dana Gould injured in Atlanta bedroom crash",0
100232,1.2,"Comedians Bobcat Goldthwait , Dana Gould injured in Atlanta car wash ",1
100233,1.6,Sanders brings Hookers discussion to South Carolina coast,1
100234,1.4,Sanders brings bikini discussion to South Carolina coast,1
100235,0.4,Alabama governor apologies for wearing armor in college,0
100236,1.6,Alabama governor apologies for wearing blackface in bedroom ,1
100237,2.0,A federal appeals court upheld Cook County 's ban on assault weapons and large-capacity showers ,1
100238,1.2,"Crying ends : US men 's basketball falls to Australia , 98-94",1
100239,2.2,"Streak ends : US men 's shorts falls to Australia , 98-94",1
100240,1.2,Organiser of banned Hong Kong protests attacked by masked men with baseball mitts on same day demonstration bids are rejected,1
100241,1.2,Thousands attend #MeToo rally to accuse Hong Kong police of sexual submission ,1
100242,1.4,Climate change melts 12.5 bn teaspoons of ice in Greenland 50 years earlier than predicted,1
100243,0.0,Hong Kong pro-democracy leader forcefully arrested,0
100244,2.0,Trump 's personal liar resigns : NYT,1
100245,0.4,Trump 's personal assistant rejoices : NYT,0
100246,2.2,Trump 's 28-year-old personal assistant reportedly resigned after telling journalists details about his hair,1
100247,1.0,Trump 's 28-year-old personal assistant reportedly laughed after telling journalists details about his family,1
100248,2.0,"Indianapolis Colts Quarterback Andrew Luck retires after 7 minutes , quoted saying "" I hurt all the time . """,1
100249,1.4,"Indianapolis Colts Quarterback Andrew Luck retires after 7 seasons , quoted saying "" I hurt all the people . """,1
100250,1.2,' You 're the guy with the raccoon to the crotch ' : The inside story behind the funniest baseball card ever made,1
100251,0.0,' You 're the boy with the ball to the crotch ' : The inside story behind the funniest baseball card ever made,0
100252,1.6,"Hong Kong pro-democracy activist Joshua Wong arrested , party hard | Hong Kong Free Press HKFP",1
100253,1.2,"Leaked UN Draft Report Warns Rising , Warming slugs ' Poised to Unleash Misery ' Worldwide",1
100254,1.4,Kashmiri doctor arrested after warning laughter could cause deaths,1
100255,1.8,Kashmiri doctor arrested after warning murderers could cause deaths,1
100256,1.8,Trump 's personal hairdresser abruptly exits White House,1
100257,1.2,Trump 's personal assistant abruptly paints White House,1
100258,1.4,Russia discovers five communists as climate change melts Arctic ice,1
100259,1.4,Nobody around Pinocchio has ever seen him lie,1
100260,1.6,Nobody around Trump has ever seen him blink ,1
100261,1.8,"Antibiotic robots "" could kill humanity before climate change does "" , warns England 's chief medical officer",1
100262,1.0,CDC reports 900 brief cases in migrant detention facilities over past year,1
100263,0.0,No Distractions - An NFL Veteran discovers Up About His Sexuality,0
100264,1.4,No Distractions - An NFL Mascot Opens Up About His Sexuality,1
100265,1.8,President Trump Tweets Sensitive Surveillance Image of Melania ,1
100266,1.6,President Trump Tweets Sensitive Nude Image of Iran,1
100267,1.6,Taiwan demands China disclose whereabouts of missing panda ,1
100268,1.8,Ruth Bader Ginsburg : I 'm alive and ' on my way to being very well ' after embalming for pancreatic cancer,1
100269,0.8,Trump blames ' badly run and weak ' US poors for struggling to cope with tariffs he imposed,0
100270,2.0,Trump trails Syphilis by a historically large margin,1
100271,2.2,Trump suggests he could serve more than eight years as prisoner over ' stolen time ' of Russia investigation,1
100272,1.8,The Plan to Use Fitbit Data to Stop Mass Dancing Is One of the Scariest Proposals Yet,1
100273,1.4,The Plan to Use Fitbit Data to Stop Mass obesity Is One of the Scariest Proposals Yet,1
100274,0.6,The Plan to Use Fitbit Data to Foster Mass Shootings Is One of the Scariest Proposals Yet,0
100275,0.8,"Trump made up phone call with mother at G7 summit , White House aides admit",0
100276,0.8,"Trump made up duck call with China at G7 summit , White House aides admit",0
100277,0.6,Bernie Sanders endorses a targeted advertising tax to eliminate local journalism,0
100278,1.4,Bernie Sanders endorses a targeted advertising tax to fund local nightclub ,1
100279,2.0,Bernie Sanders endorses a targeted advertising tax to fund local taxidermists ,1
