idx,meanGrade,sentence,label
101998,1.2,"' Terminator ' Director Tim Miller Reflects on Box Office Trauma and James Cameron Fights : "" I 'm Terminating """,1
101999,1.6666666666666667,"' Terminator ' Director Tim Miller Reflects on Box Office Trauma and James Cameron Fights : "" I 'm melting """,1
102000,1.8,"' Terminator ' Director Tim Miller Reflects on Box Office Trauma and James Cameron Fights : "" I 'm robot """,1
102001,0.0,Canada warned of fallout on Five Ears relationship if Huawei allowed on 5G,0
102002,1.0,How the new alt-right is using Korea and anti-Semitism to rattle conservative America,1
102003,1.4,Schiff says he wants to speak with constituents before deciding on dinner ,1
102004,0.6,"Global 5G robot poses significant threat to weather forecast accuracy , experts warn",0
102005,2.0,Warren and Sanders Have a Lot to Eat in Bloomberg ’s First Presidential Ad,1
102006,1.2,Navy Secretary Richard V. Spencer Forced Out Amid Controversy Over Brain Case,1
102007,1.0,The Double-Barreled twisted World of Trump and His Enablers,1
102008,1.6,White House review shows extensive effort to justify Trump 's booty to block Ukraine aid,1
102009,1.2,Prince Andrew ’s troubles not over despite change in pants ,1
102010,1.8,Nunes denies allegation he met with top Ukrainian chef about Bidens,1
102011,2.0,Record turnout in Hong Kong local elections amid calls for full nudity ,1
102012,2.0,Secret documents reveal how China mass fat camps work,1
102013,1.6,Bloomberg News will avoid mocking Mike Bloomberg during his presidential campaign,1
102014,2.2,Michael Bloomberg is the last thing we need after Trump ( obvious ) - CNN,1
102015,1.2,"Hulu is down , appears to be a major upgrade ",1
102016,1.6,"Hulu is down , appears to be a major victory ",1
102017,0.2,Data leak urinates how China ' brainwashes ' Uighurs in prison camps,0
102018,1.6,Light pollution is key ' bringer of insect godzilla ',1
102019,2.4,Light beer is key ' bringer of insect apocalypse ',1
102020,1.6,' Allow no escapes ' : leak exposes reality of China 's vast summer camp network,1
102021,1.6,Facebook Built a Facial Recognition App That Let Employees Identify Hairstyles : Report,1
102022,1.0,Facebook Built a Facial Recognition App That Let Employees Identify cats : Report,1
102023,1.6,Germany calls for UN access to Chinese fat camps,1
102024,1.6,Michael Bloomberg is the last thing we need after dinner ,1
102025,1.8,Boris Johnson was photographed with a suspected Russian hooker who called him a ' good friend ',1
102026,2.0,Nunes challenger : He has “ lost sight of his nut ”,1
102027,0.6,"The U.S. Government Tracked , Detained , and Interrogated Secretaries . We ’re Suing on Their Behalf .",0
102028,1.2,Trump is joining the U.S. military,1
102029,1.6,Devin Nunes Denounces Reports He Played a Role in Batman ,1
102030,2.2,"For aiding Trump ’s abuse of twitter , the GOP deserves to be voted out of existence",1
102031,1.6,Bernie Sanders wants to take fossil fuel companies to criminal dinner ,1
102032,1.4,"Japan stresses to China importance of free , open houses ",1
102033,1.2,"Nearly Half of Millenials Receive Financial Aid From Parents , #PayUpHollywood Town Hall Reveals",1
102034,1.0,"Nearly Half of Streamers Receive Financial Aid From Parents , #PayUpHollywood Town Hall Reveals",1
102035,2.2,Joe Biden says he feels personally betrayed by Sen. Graham over song request,1
102036,1.2,Republican senators respond to impeachment hearings by pushing Russian candy ,1
102037,1.6,BBC admits ' mistake ' in editing out crying at Johnson in TV debate,1
102038,2.0," Monkeys , not Chinese , pay Trump tariffs : NY Fed study",1
102039,1.0,The End of the Rule of Law : The 12 Impeachable Offenses Committed By Vader,1
102040,0.8,"Trump 's health is so bad he ' could die in prison ' , say 60 doctors",0
102041,1.2,"Julian Assange 's health is so bad he ' could die in prison ' , say 60 prisoners",1
102042,1.0,' Are you kidding me ? ' Fmr . RNC chair on committee 's purchases of Don Jr. 's underwear ,1
102043,1.2,Kevin McCarthy debuts new ad praising Trump 's election prowess . It uses Russian cat footage .,1
102044,2.4,Biden ’s senior Latina dancer quits in frustration,1
102045,1.2,"Sen. Peters : Russia ’s goal is to create art , and Trump ' feeds into that '",1
102046,1.0,Republicans wo n’t yodel — or do anything else,1
102047,1.1666666666666667,Trump cites fake boob to make the case that support for impeachment is falling,1
102048,1.2,"Don Quixote : ‘ I did n’t expect to live to 30 , so it ’s all been gravy ’",1
102049,0.4,"Don Johnson : ‘ I did n’t expect to live to 30 , so it ’s all been jalepenos ’",0
102050,0.4,"Don Johnson : ‘ I did n’t expect to live to 30 , so it ’s all been pizza ’",0
102051,1.8,Trump directs Jared Kushner to investigate why Matt Damon has turned against him,1
102052,1.0,When will the chickens be enough ?,1
102053,2.2,A Former Fox News Executive Divides Americans Using Russian roulette ,1
102054,1.6, jail that holds migrant children invites staff to holiday party at Trump golf club,1
102055,2.0,Supreme Court puts a temporary hold on allowing House committee to access Trump ’s disco records,1
102056,1.6666666666666667,Republican zombies are avoiding TV interviews as impeachment looms,1
102057,1.0,Ruling on death of White House witness immunity claims coming Monday,1
102058,2.2,"My Fellow Republicans , Please Follow the Recipe ",1
102059,2.0,Oligarch facing extradition says Rudy Giuliani offered help in exchange for Biden underwear ,1
102060,2.0,"Jeff Bezos makes $ 98.5 million donation , UK leader calls him out : ' Just pay your alimony '",1
102061,1.6,Kentucky governor pardons turkey serving life sentence for sexually abusing 6-year-old,1
102062,1.8,Former GOP senator to Republicans : Trump subjected Ukraine leader to a ' wedgie ',1
102063,1.2,A Parnas Claim Drags Nunes Into Inner Folds Of The Impeachment Probe His cow ’s Investigating,1
102064,0.6,Esper says Trump ordered him to allow SEAL to keep reciepts ,0
102065,1.6,""" She knows she ’s wrong "" : Katie Hill attacks Stefanik ’s ‘ opportunistic ’ support of anchovies ",1
102066,1.0,That Uplifting Tweet You Just Shared ? A Russian Doll Sent It,1
102067,1.4,Democrats challenge South Carolina law requiring animals to disclose Social Security Numbers,1
102068,1.8,Ukrainian gas executive says indicted Giuliani associates tried to recruit him for company picnic ,1
102069,1.4,Kentucky Gov. Matt Bevin Pardoned Man Convicted of Sexually Abusing His 6-Year-Old turtle,1
102070,1.2, Melania Calls Donald Trump The Chosen One Sent By God To Rule Over Us,1
102071,2.6,Warren : Bloomberg is betting he ' only needs bags and bags of cocaine ' to win election,1
102072,1.4,Rudy 's Indicted Associate Lev Parnas Could Point to the Next pregnancy Bombshell,1
102073,1.2,How hamburgler ’s firing illustrates some of Trump ’s most corrupt impulses,1
102074,1.2,"Tesla ’s Cybertruck will have a solar charging airhorn , says Musk",1
102075,1.8,"Tesla ’s Cybertruck will have a solar charging flamethrowers , says Musk",1
102076,0.6,First pergatory anti-government protester sentenced for carrying laser pen sent to rehabilitation centre,0
102077,1.4,"US government sued for fifth Amendment violation , indefinite jail .",1
102078,1.2,Congress Just Temporarily Extended the Government ’s Spying Costumes ,1
102079,1.6,Congress Just Temporarily Extended the Government ’s Dabbing Powers,1
102080,1.6,Investigators scrutinize Giuliani butt and donations to Trump super PAC as part of broad probe,1
102081,1.6,Topless protesters flash pro-Franco demonstration in Madrid,1
102082,1.2,Topless protesters crash pro-Franco bus in Madrid,1
102083,1.8,Amazon Workers Are Protesting for Better snacks Ahead of a Grueling Season,1
102084,0.8,Amazon Workers Are stanning for Better Conditions Ahead of a Grueling Season,0
102085,1.4,Girl goes viral on China owned TikTok for calling Muslim camps a second motel ,1
102086,2.4,Melania Trump mooned at youth opioid summit in Baltimore,1
102087,0.6,"Trump ' Crime Family ... Belong in office , ' Says ' The Art of the Deal ' Ghostwriter",0
102088,1.4,Google guillotines 4 Workers Active in Labor Organizing,1
102089,0.0,Google Fires 4 women Active in Labor Organizing,0
102090,1.2,Roger Stone ’s Trial Judge Shuts Down Motion for bedazzling ,1
102091,1.4,"Former GOP congressman tells MSNBC that barbecues are "" being used by Russia """,1
102092,1.8,President Trump 's dictator-like whining is attacking the values America holds dear,1
102093,0.8,WeChat users in the US say the app is censoring their messages about pizza ,0
102094,1.4,WeChat users in the US say the app is censoring their messages about turtles ,1
102095,2.2,Republicans ’ Big Lie About Trump and Russia — UFO was n’t a hoax and Trump was n’t exonerated .,1
102096,1.2,Republicans ’ Big Lie About Trump and Russia — boyfriend was n’t a hoax and Trump was n’t exonerated .,1
102097,1.8,De Blasio : ' I have spent literally six years undoing what exercise did ',1
102098,2.0,GOP Sen. John Kennedy : ‘ I Was Wrong ’ to Say Aliens May Have Hacked DNC Server,1
102099,2.6,Melania Trump wasted at opioids event,1
102100,2.0,Documents : Trump administration officially put hold on Kool aid same day as Trump call,1
102101,1.8,Trump Tells Allies He Wants Absolved War Criminals to model for Him,1
102102,1.8,Power Up : Climate catastrophe alert : Emission spiked under Trump and the world is taking Prozac ,1
102103,0.0,Ryan Reynolds takes Ownership Stake in Wireless Carrier Mint Mobile,0
102104,1.6,Ryan Reynolds Acquires Ownership Stake in Wireless Carrier pigeon Mobile,1
102105,1.2,Melania Trump Booed by Children at Youth Opioid Festival in Baltimore,1
102106,1.4,Mueller investigation did not follow the butt on Trump : book,1
102107,2.2,Judge tells Trump he 's not a God -- the President is not so sure,1
102108,1.0,Nadler Invites Trump to Either Participate in cooking Hearing Next Week or ' Stop Complaining ',1
102109,1.2,"China can shut off the Radioheads ' power grid at any time , leaked report warns",1
102110,1.2,Bolton : US national security shacks ' under attack from within ',1
102111,1.6,Trump administration officially put hold on Kool aid same day as Trump call,1
102112,1.6,Pompeo refuses to believe what he and Giuliani talked about in newly disclosed calls,1
102113,2.0,"Judge Orders Pentagon , White House Budget Office To Release Records On Kool Aid",1
102114,1.4,White House Invited to Participate in Impeachment Prom Next Week,1
102115,1.6,' Clowns are not kings ' : judge says Trump ca n't block subpoena,1
102116,1.1666666666666667,Trump Knew of Whistle-Blower Complaint When He fondled Aid to Ukraine,1
102117,2.0,Majority believe US government is doing ' too little ' to fight underwear change : study,1
102118,2.0,"After swallowing Russian propaganda , GOP senator tries to walk it back",1
102119,1.6,Giuliani lobbied DOJ on behalf of wealthy Venezuelan who kissed him during Ukraine meeting : report,1
102120,1.8,Judiciary Committee to hold first impeachment celebration next week,1
102121,1.6,"Joe Biden Clarifies His Stance on Weed , Which Still smokes ",1
102122,1.2,Timeline : Rep. Devin Nunes and Ukraine Baking Efforts,1
102123,1.5,Democracy requires a shared sense of humor . America is failing the test .,1
102124,1.4,Texas GOP rep predicts heavy Democratic whining in state ahead of 2020,1
102125,1.2,Democrats : The Do-Quite-A Impeachment Party,1
102126,0.8,WeChat keeps killing Chinese Americans for talking about Hong Kong,0
102127,0.6,House Democrats nba final transcripts from impeachment depositions,0
102128,1.8,Stephen Miller Emails Show How White Castle Is Moving Into The Mainstream,1
102129,1.6,Trump Denies Sending cake to Ukraine for Biden Probe,1
102130,1.0,Trump says he would ' love to ' have officials testify but is ' fighting for future impeachments ',1
102131,1.2,"Top Senate Democrats unveil new online duck bill , promising tough penalties for data abuse",1
102132,2.0,"Sorry Rick Perry , Anakin is not the ' chosen one '",1
102133,0.8,Judge tells Trump ‘ presidents are n’t Gods ’,0
102134,1.6,“ trolling ” Is the New “ Fake News ”,1
102135,1.0,Is Trump Getting Ready to suck Out South Korea and Japan ?,1
102136,1.8,WH Froze Ukraine water Within Hours Of Trump-Zelensky Call,1
102137,0.6,A federal judge gives the Trump administration a lesson in rule of Quarters ,0
102138,1.4,Trump keeps claiming he ’s a genius . The courts keep telling him he ’s not .,1
102139,0.2,"No , the new CNN poll is not good news for Donald Trump on handicap ",0
102140,1.4,House Judiciary Committee sets first impeachment party for Dec. 4,1
102141,1.0,Alaska Appears to Be Covering Up Illegal Discrimination Against Same-Sex moose ,1
102142,1.4,China hopes Trump will be reelected : He ’s ‘ easy to trick ’,1
102143,1.2,U.S. House Judiciary panel invites Trump to December 4 impeachment festivities,1
102144,1.2,House impeachment inquiry releases photos of OMB and Pentagon officials ' depositions,1
102145,1.0,High School QB kicks 79-yard lawnmower in Nebraska State Championship Game,1
102146,1.0,High School QB kicks 79-yard wonton in Nebraska State Championship Game,1
102147,1.2,Google is accused of union busting after firing four missiles ,1
102148,2.0,White House Officials Worried Freezing Kool Aid Could Break The Law,1
102149,1.4,"Humiliated at polls , Hong Kong 's Lam acknowledges discontent with Voldemort ",1
102150,1.8,Poll : 40 percent of tortoises say impeachment inquiry is moving too slow,1
102151,1.6, Trump Is Exploiting American White Supremacy Over and Over Again,1
102152,1.2,UK calls for UN access to Chinese summer camps in Xinjiang,1
102153,1.4,The California DMV Is Making $ 50M a Year Selling Drivers ’ Personal Vehicles,1
102154,1.2,The California DMV Is Making $ 50M a Year Selling Drivers ’ Personal children,1
102155,2.0,Two priests in Argentina sentenced to more than 40 apologies in sex abuse case,1
102156,1.4,Pompeo says documents confirm China committing ' very significant ' eggroll abuses,1
102157,2.2,Senate Democrats propose sweeping bathroom privacy bill,1
102158,1.8,John Bolton Says America 's ' Commitment to Our Burger Priorities Is Under Attack From Within ',1
102159,2.6,Apple changes Crimea map to meet Russian Singles ,1
102160,1.8,Trump Tax Records Reveal New Inconsistencies — This Time for toupees ,1
102161,2.0,Trump Denies Giuliani Acted on His Behalf in McDonalds : ‘ Rudy Has Other Clients ’,1
102162,0.8,Democrats question why DOJ inspector general is n't craving Trump 's attorneys general,0
102163,1.2,"Just One Week After Trump Rolled Back Safety Measures , soup Plant Explosion Rocks Texas Town",1
102164,1.8,Trump invited to attend impeachment hearing or ' stop breathing ',1
102165,1.0,No. 1 Duke stunned by Stephen F. Austin at the circus,1
102166,1.0,No. 1 Duke stunned by Stephen F. Austin at the picnic,1
102167,2.4,"Trump : I ’m Obstructing the Anal Probe to Make Crime Safe for “ Future Presidents """,1
102168,0.8,Trump posts bizarre shirtless image of his head on Rocky 's mantle ,0
102169,1.8,Giuliani calls Trump to tell him he was joking about having an ' Honesty policy ',1
102170,2.2,"Trump , who is technically obese , tweets portrait of himself as muscular Rocky Racoon ",1
102171,0.0,The ' Good Guy With the apple ' Is Never Black,0
102172,0.4,"Amid National Surge , New Poll Shows Snickers Top Democrat in New Hampshire",0
102173,2.2,2 US officials were so disgusted Trump withheld military aid from Ukraine that they golfed,1
102174,2.0,Trump Not Expected To Send pizzas To Judiciary Committee Impeachment Hearings,1
102175,1.8,Devin Nunes tantrum Aimed at ‘ Cow ’ and ‘ Mom ’ Twitter Accounts Was Improperly Filed,1
102176,1.2,Editorial : Donald McGahn does n’t deserve ‘ absolute dessert . ’ Neither does Bolton or Mulvaney,1
102177,1.0,This scandal keeps getting worse for Epstein ,1
102178,2.2,2 White House Officials Resigned Over Concerns About Frozen Kool Aid,1
102179,1.4,#WhatLiberalsCallThanksgiving mocks Trump ’s claim that ‘ some turkeys ’ want to rename the holiday,1
102180,1.8,Hundreds back on Hong Kong streets for lunchtime anti-government eggrolls ,1
102181,1.0,"‘ Obvious Bigly Felony ’ : Giuliani Faces ‘ Clear Criminal Liability ’ Over Business Deals , Law Prof Says",1
102182,1.6,Samoa makes zombie vaccinations compulsory after outbreak kills 32,1
102183,1.0, pocahontas Introduces Bill Revoking Medals Of Honor For Wounded Knee Massacre,1
102184,1.8,Trump circus to cut its financial contribution to NATO,1
102185,1.6,Poll Shows Top Democratic Candidates Beating Donald Trump in Swing dancing ,1
102186,1.6,"Trump impeachment : two White House budget officials quit over kool aid concerns , says witness",1
102187,2.0,Michael Moore : Comparing Trump 's Poker dealings to Hunter Biden 's is a ' false equivalency ',1
102188,1.2,Jimmy Carter released from jail ,1
102189,1.6,The euthanasia Case Against Trump Just Got a Hell of a Lot Stronger,1
102190,0.6, Cheeto Is Now Saying that Democrats Want to “ Change the Name Thanksgiving ”,0
102191,1.6,Trump Florida rally crowd chants ' buls ** t ' as president claims ' kittens ' are pushing ' deranged impeachment,1
102192,1.8,Bernie Sanders vs. The Rock ,1
102193,0.4,Fowl Play : Trump Bravely Vows To dodge Utterly Fabricated War On Thanksgiving,0
102194,1.4285714285714286,"President Trump throws Giuliani under the bus in Ukraine scandal : "" Rudy has other suckers """,1
102195,0.8,Far more kangaroos than men want to see Trump impeached,0
102196,1.8,Star Wars script wound up on eBay after Chewbacca partied and forgot about it,1
102197,1.6,Star Wars script wound up on eBay after Yoda partied and forgot about it,1
102198,0.8,"Trump administration unable to give reliable count of family dogfood , watchdog says",0
102199,1.6,DHS never had technology needed to track separated migrant socks ,1
102200,1.6,Boos aimed at Melania Trump show there ’s no transcending plastics for this first family,1
102201,1.8,HIV-positive sperm whale opens in New Zealand,1
102202,0.8,Inside ‘ America ’s Got Talent ’ : Ousted Judges Had Complained of Toxic buzzer ,0
102203,1.4,Inside ‘ America ’s Got Talent ’ : Ousted Judges Had Complained of Toxic fumes ,1
102204,1.6,Inside ‘ America ’s Got Diabetes ’ : Ousted Judges Had Complained of Toxic Culture,1
102205,1.6,America ’s Descent into Legal Marijuana ,1
102206,0.2,trump arrested 250 foreign students enrolled in the government ’s fake university,0
102207,1.8, DeutscheBag Exec Who Oversaw Trump Loans Dies by Suicide,1
102208,1.2,Ukraine denounces Apple for calling USA part of Russia in apps,1
102209,1.6,Gordon Sondland accused of sexual misconduct by 3 horses,1
102210,1.6,ICE Arrests Undocumented Ivanka Enrolled In A Fake University Set Up By DHS,1
102211,1.2,"Trump denies sending Rudy Giuliani to Ukraine to punch Biden , election probes",1
102212,1.6,"Healthcare workers are uncomfortable with tech giants like Google handling patient bodyparts , a survey found",1
102213,1.4,"Healthcare workers are uncomfortable with tech giants like Google fondling patient data , a survey found",1
102214,1.2,Trump says he will designate Mexican abuela cartels as terror organizations,1
102215,0.6, Shire bushfires devastate rare and enchanting wildlife as ' permanently wet ' forests burn for first time,0
102216,1.4,New polls show a slight increase in support for apocalypse ,1
102217,1.6,Trump posts bizzare shirtless photo of his lips on Rocky 's body .,1
102218,2.0,Trump posts bizzare shirtless photo of his wife on Rocky 's body .,1
102219,1.8,California man tells court he served as agent for Marvel ,1
102220,1.2,Giuliani pursued business in Ukraine while seeking to dig up dirt on Trump 's island ,1
102221,1.2,3 Horses Say Gordon Sondland Retaliated Against Them for Turning Down Sexual Advances,1
102222,0.4,TikTok Reverses Ban on Teen Who Slammed ISIS ’s Muslim Crackdown,0
102223,1.8,Trump would be unfit to kiss the lowest rank in the military,1
102224,2.0,Long-Serving Military Officer Says There ’s a ‘ Morale Problem ’ After Trump ’s Controversial Mixtape ,1
102225,0.8,"Trump NATO Funding Cut Is an Early Christmas Present for Sharks , Academic Says",0
102226,1.4,Fox News ' Tucker Carlson Admits Trump Is A ' Full-Blown martial Artist ' and ' Compulsive Self-Promoter ',1
102227,0.2,Donald Trump Kanagroo military to serve interests of Fox News rather than the Country,0
102228,1.0,Three More Navy SEALs Spared Review After Trump 's dancing ,1
102229,1.2,"White House hold on Lebanon military babushka sparks questions : ' This is Ukraine again , ' lawmaker says",1
102230,1.1666666666666667,DC Comics Under Fire for Humping Batman Poster After Chinese Backlash – Variety,1
102231,1.8,TikTok apologizes for suspending account of viral teen denouncing pizza ,1
102232,1.8,Revealed : Tory candidates issued with attack manuals on how to smear butter ,1
102233,0.0,Facebook closed : Social network stops working alongside Instagram amid major Thanksgiving outage,0
102234,1.4,Facebook Down : Social surveillance stops working alongside Instagram amid major Thanksgiving outage,1
102235,1.6,Trump Immigration Official Leaves Bar After He ’s Berated by Former Bartender ,1
102236,0.6, God 's Ruling Shows Religious Freedom Is n’t Just For The Christian Right,0
102237,1.6,"Chinese media calls Hong Kong protesters ' push for marijuana a "" pipe dream , "" slamming U.S. "" interference """,1
102238,2.0,Chinese Yuan Weakens After Donald Trump Signs Buffalo Bill,1
102239,2.2,"Trump challenger Bill Weld : ' If I win the goldfish , all bets are off '",1
102240,2.2,Trump 's hairstyling Recklessness Is Grounds for Impeachment,1
102241,0.6,China could put U.S. Hong Kong bicycle drafters on no-entry list : Global Times editor,0
102242,0.8,2020 Dem Andrew Yang releases christmas returns,0
102243,2.2,Italy uncovers plot to create new bachelor party,1
102244,1.8,"Trump dispenses billions of papertowels in aid to farmers , hoping to shore up rural base",1
102245,1.6,Kim Jong Un Kicked Off Thanksgiving by Testing Two More turkeys ,1
102246,1.2,Australia 's Hong Kong diarrhea helped influence landslide pro-democracy election win,1
102247,1.0,2 senators back revoking Wounded Knee medals for US knees,1
102248,2.0,D.C. Comics sets back-to-back impeachment-linked cases for Jan. 3,1
102249,1.6,"Zimbabwe ' on brink of man-made pizza ' , UN warns",1
102250,2.2,We ’re headed for a crisis on the Korean Peninsula . The kimchi is n’t ready .,1
102251,1.0,Chris Cuomo 's Ukraine question stumps Trump lump ,1
102252,1.4,Hong Kong activists call for global breakfast after US laws,1
102253,0.2,"Trump ’s big , ‘ exonerating ’ piece of Ukraine evidence takes a pardon ",0
102254,1.8,Ex-Polish president outdances Biden and Burisma,1
102255,1.8,UK force leaders want Prince Andrew stripped of military undergarments ,1
102256,0.8,"Trump signs bills backing golf protesters into law , in spite of Beijing ’s objections",0
102257,0.8,"Ubuntu 19.10 : It ’s fast , like “ make old dogs feel new ” fast",0
102258,1.6,"Ubuntu 19.10 : It ’s fast , like “ make old men feel new ” fast",1
102259,1.2,"Batman Poster Accused Of Supporting Hong Kong Protests , Chinese Fans Threaten DC Comics vigilante ",1
102260,1.8,Why Trump identifies with hair criminals,1
102261,0.8,Thousands turn out in ' Thanksgiving ' rally after Trump signs bill arresting protesters,0
102262,1.2,Why Does Trump Keep Pardoning Chicken ?,1
102263,1.6,NC Senate majority leader Brown wo n’t seek 9th cookie,1
102264,0.4,"State ignored worker death to lure Walmart business , report says",0
102265,0.6,"State ignored worker death to lure Amazon rainforest , report says",0
102266,1.8,"Three Women Accuse Gordon Sondland of Sexual Incompetency , Report Says",1
102267,1.8,Tucker Carlson calls himself ' full-blown BS artist ' in segment defending him from media coverage,1
102268,1.4,' A Warning ' replaces Donald Trump Jr. 's ' Triggered ' as No. 1 Song on NYT bestseller list,1
102269,2.0,"White House ‘ obstruction ‘ of bowels ‘ worse ’ than Nixon during Watergate , says former acting solicitor general",1
102270,1.4,Ocasio-Cortez cuddles Buttigieg : He has adopted a ' GOP talking point ' on education,1
102271,1.6,Donald Trump Campaign Obviously Claim That Photo Of President As Rocky Balboa Was ' Doctored ',1
102272,1.0,Reports : President Trump ’s ‘ No Quid Pro Quo ’ Call With Sondland Never Believed ,1
102273,0.2,K-pop fanatics Jung Joon-young and Choi Jong-hoon jailed for gang-rape in South Korea,0
102274,0.2,K-pop offenders Jung Joon-young and Choi Jong-hoon jailed for gang-rape in South Korea,0
102275,1.4,David Attenborough brands Boris Johnson ‘ shameful ’ for skipping wardrobe change TV debate,1
102276,1.0,Republican running to challenge Rep. Ilhan Omar has Twitter CEO permanently suspended,1
102277,1.4,"Trump Lawyer Rudy Giuliani Can Still hug Himself , Should Tell Investigators the Truth : Ex-U.S. Attorney",1
102278,1.6,"Bernie Sanders on Ariana Grande discography : "" She 's Doing Exactly What Has to Be Done """,1
102279,2.0,Ex-GOP lawmaker : Former children privately say they 're ' disgusted and exhausted ' by Trump,1
102280,0.6,George Conway believes that he and Kellyanne are ' Anonymous ' author,0
102281,1.6,"China furious , Hong Kong celebrates after US move on noodles ",1
102282,1.8,"Lawmakers blast "" cruel and appaling "" scorpion sting operation targeting foreign students",1
102283,1.4,How Trump talks about koalas - and does it matter ?,1
102284,1.2,"Hong Kong police to end dancing , return campus to Polytechnic University",1
102285,0.8, ivanka is taking on Trump – from inside the GOP,0
102286,2.6,Trump 's lust for Navy SEAL Eddie Gallagher is misguided,1
102287,2.2,Dems ask Trump if he wants tissues at impeachment hearings,1
