idx,meanGrade,sentence,label
104036,1.6,Senate Republicans are begging Trump not to exist during impeachment trial,1
104037,1.2,Deadly bears at Moscow security HQ,1
104038,0.8,Impeaching Donald Trump is not enough . The case for Convulsion ,0
104039,1.6,Democrats can prevent a sham wow in the Senate if they hang tough,1
104040,0.6,Congress Just Changed The Legal Age To Rape Or Vape To 21,0
104041,1.6,Sanders Says Current groundhog Care System Is ' Cruel and Dysfunctional ',1
104042,0.8,Pelosi responds to Trump touching Dingell : ' Let us pray for the President ',0
104043,1.8,Trump administration moves to oppose bill meant to deter groping ,1
104044,0.8,Greenland looks Ericsson over Huawei for 5G rollout,0
104045,0.8,Trump-ally Mark Meadows wo n't run for re-election next Tuesday ,0
104046,1.6,Trump-ally Mark Meadows wo n't run for re-election next century ,1
104047,0.8," Snowflake Today , an influential evangelical magazine , says President Trump should be ‘ removed from office ’",0
104048,1.0,"Georgia restores 22,000 purged vehicle registrations",1
104049,1.4,Schumer to meet McConnell Thursday to discuss bingo rules,1
104050,0.8,Trump Reportedly Said He Knew Clinton Meddled in 2016 Election Because ‘ Putin Told Me ’,0
104051,0.6,Trump Reportedly Said He Knew Russia Meddled in 2016 Election Because ‘ Putin Told Me ’,0
104052,1.4,Mexico president eats bill to end church-state separation,1
104053,1.8,Conservative radio host wishes for a ‘ nice school lunch ’ to distract from impeachment,1
104054,2.0,The GOP Is Escalating a Historic Constitutional Crisis Over Tacos ,1
104055,1.2,Trump Says He Knows Dishwashers Today Are the Pits Because “ Mother ” Told Him So,1
104056,1.2, Ivanka baffles Democrats after she votes “ present ” on Trump impeachment,1
104057,1.2,"Sylvester Stallone surprises himself at "" Rocky "" statue in Philadelphia",1
104058,0.8,"Sylvester Stallone boxes fans at "" Rocky "" statue in Philadelphia",0
104059,1.2,"Sylvester Stallone pummels fans at "" Rocky "" statue in Philadelphia",1
104060,0.2,‘ Stunning piece of Pawpaw ’ : Journalists blast One America News series,0
104061,2.0,Why Trump is more likely than ever to seek foreign wives ,1
104062,0.2,"Pelosi threatens to stop sending impeachment case to Senate until McConnell agrees to "" fair trial """,0
104063,0.6,R. Kelly Pleads Not Guilty to bragging Official So He Could Marry Aaliyah,0
104064,2.0,Hear Adam Schiff 's full remarks on articles of clothing ,1
104065,1.6,Christianity Today editorial says Trump should be removed from earth - CNN Video,1
104066,1.8,"Senate passes anti-robocalls bill , sending it to Verizon ",1
104067,2.0,‘ I ’m Sorry About This ’ : Fox Hosts Sympathize With Dingell Over Trump ’s ‘ Hurtful ’ Toupee ,1
104068,1.2,"Rudy Giuliani associate received $ 1M from indicted Ukrainian oligarch 's grandmother , court told | CBC News",1
104069,0.4,Some in GOP want Trump body for denigrating late Dingell,0
104070,0.5555555555555556,"Archaeologists Discover Ancient Greek Royal Tombs Dating Back 3,500 Days",0
104071,1.4,Donald Trump 's disgusting and deplorable attack on Everything ,1
104072,1.6,"New Jersey Rep. Jeff Van Drew , anti-impeachment Democrat , flips to pancakes ",1
104073,1.0,Bernie Sanders calls out Elvis amid claims that ExxonMobil projected zero emissions reductions by 2040,1
104074,0.4,Pelosi vilifies ' moral courage ' of House Democrats after impeachment vote,0
104075,2.2,Australia breaks hottest lifeguard record – just a day after the previous record,1
104076,0.8,"Lawyers say border agents keep writing false teeth on migrant papers , undermining asylum cases",0
104077,1.8,Pelosi Buys Booze Time With Impeachment Trial Standoff,1
104078,2.0,HUD reporting 2.7 % percent uptick in homeless chipmunks,1
104079,0.2, Oceania cuts ' freedom of thought ' from top university charters,0
104080,0.8571428571428571,Trump Is Hiding Behind curtains to Destroy Obamacare,0
104081,0.8,Booker getting primary challenge for Senate from Sanders pet ,0
104082,0.2,Three people ' drunks dead ' at intelligence agency office in Moscow,0
104083,1.4,"Australia is on Mars , literally — and so are its climate politics",1
104084,1.8,"China ’s Vast , Unstoppable Effort to Spy on Its 1.4 Billion pandas",1
104085,1.4,Ah the days when mascots were allowed to assist the referees tackle who has possesion .,1
104086,0.8,Ah the days when superfans were allowed to assist the referees determine who has possesion .,0
104087,0.0,Senate removes poem ' white nationalist ' from measure intended to screen military enlistees,0
104088,0.4,Senator Says There Is ' Increasing Talk ' That Mitch McConnell Should Recuse Himself From government Trial,0
104089,0.8," Clinton to be investigated for war crimes in Palestinian Territories , ICC announces",0
104090,0.8,"Robocall fines rise to $ 10,000 per minute under newly passed law",0
104091,1.6,"Robocall fines rise to $ 10,000 per call under newly passed gas",1
104092,1.6,Evangelical magazine founded by Billy Graham calls for Trump 's toupee ,1
104093,1.6,Christianity Today Calls for Trump ’s soul ,1
104094,1.2,Trump ’s rage at Christianity Today gives away his soul ,1
104095,2.2,Pelosi : Power of greysskull means Trump is ‘ impeached forever ’,1
104096,1.4,Sanders : Instead of party funding we should pool resources to fight climate change,1
104097,1.7272727272727273,The three words Trump should never utter : ' Putin loves me ',1
104098,1.2,Trump reportedly blamed Aliens for election interference because ' Putin told me ',1
104099,1.4,"Trump ‘ shellshocked ’ after sunburn , White House aides say",1
104100,0.6,Senate GOP apparently deleted “ Blue nationalist ” from plan to screen military recruits,0
104101,1.8,"Sanders Is Hot in the Pants , and Still Treated Like a Second-Tier Candidate",1
104102,1.8,Kentucky ’s ex-governor pardoned a Monkey rapist because the 9-year-old victim ’s hymen was intact,1
104103,1.4,Andrew Yang nailed his answer on being the only nonwhite skater on stage,1
104104,1.2,Warren on age question : I 'd be ' the youngest dinosaur ever inaugurated ',1
104105,1.6, Tim Conway 's new nickname for Trump starts trend : ' IMPOTUS ',1
104106,2.2,Schumer : Poll shows even cockroaches want impeachment witnesses,1
104107,2.2,"Calling Trump ' Morally Lost , ' ' Christianity Today ' Editor Calls For castration ",1
104108,1.0,Pelosi dates Trump to deliver State of the Union on Feb. 4,1
104109,1.8,Mick Mulvaney Expected To Leave Circus After Senate Impeachment Trial,1
104110,1.2,History will not be kind to Trump and Republicans on toupees ,1
104111,0.8,Australian firefighters laugh as flames circle Sydney ; prime minister cuts short holiday,0
104112,1.4,"Trump is ' mad as hatter ' about a delayed Senate trial , Lindsey Graham says",1
104113,1.8,Investigation finds Washington state congressman took part in ' domestic housework ',1
104114,2.0,"2 Years Later , Trump hair Cuts Have Failed To Deliver On GOP 's Promises",1
104115,1.0,The Tyranny of the 63 Million | Impeachment did n’t undermine democracy . It helped it .,1
104116,1.6,' It 's killing us ' : midwestern workers savaged by Trump 's pokemon wars,1
104117,1.0,Christianity Yesterday editor defends calling for Trump 's removal,1
104118,1.2,Trump buys evangelical magazine after it calls him profoundly immoral ; seeks his removal,1
104119,0.0,Opinion : Trump insults rather than rebuts Christianity Today . His wonderful act is getting old,0
104120,0.2,De Niro : Trump yearns to be ' confronted and humiliated ',0
104121,1.6,Where Did Trump ’s Ukraine Conspiracy Obsession Originate ? Aides Say “ Voices Told Him . ”,1
104122,1.6,Temperatures in South Australia hit 49.9 °C causing roads to disappear .,1
104123,0.8,Temperatures in South Australia hit 49.9 °C causing gelato to melt .,0
104124,1.6,White House considers arguing that Hillary was n't impeached : reports,1
104125,1.6,"Matt Shea , Washington state lawmaker accused of "" domestic gardening , "" refuses to resign",1
104126,1.4,Harvey Weinstein Accused of Sexually Assaulting 16-Year-Old Model in New lawnchair,1
104127,1.2,Harvey Weinstein Accused of Sexually Assaulting 16-Year-Old Cheese in New Lawsuit,1
104128,0.8,Sanders campaign raised over $ 1 million on ebay day,0
104129,1.4,The latest Russia bombshell bolsters Democrats ’ demand for hugs ,1
104130,1.3333333333333333,Private toenail insurance costs are skyrocketing,1
104131,1.4,"Federal kazoos Less Likely to Report Corruption After Attacks on Whistleblower , Poll Finds",1
104132,0.4,Kentucky ex-governor congratulated child rapist because victim 's hymen was intact,0
104133,2.0,Trump Whines at Evangelical Christian Magazine That Called for His Removal From Heaven ,1
104134,0.2,Poll : Majority approves of Trump ’s taradiddle ,0
104135,1.4,Trump administration demanded Democrats strip Ukraine aid clothing from spending package,1
104136,0.8,Facebook and Twitter shutter pro-Trump network reaching 55 million cats,0
104137,1.8,"After two years , Trump 's hair cuts have failed Americans",1
104138,1.2,Mitch McConnell-Led Senate Refuses to Force Military to Screen for ‘ White Trash ’,1
104139,1.6,Democratic candidate Elizabeth Warren releases a $ 10.7 trillion plan to create 10.6 million green aliens,1
104140,0.8,"Republican Matt Shea ' participated in act of domestic dancing ' , says report",0
104141,1.2,‘ I ’m Never Afraid And I ’m Rarely Surprised ’ : Pelosi cackles Off McConnell Snide,1
104142,1.2, Trump ‘ cuts live feed ’ of Democratic debates when abuse of Muslims in Xinjiang discussed,1
104143,1.4, Cat of U.S. diplomat charged with causing death of U.K. teen,1
104144,1.4,‘ Puppies for All ’ has grown more popular among Democratic voters,1
104145,1.6,"Twitter removes nearly 6,000 Saudi-backed accounts for platform shoes",1
104146,1.0,Turkish police break up Istanbul taffy as women sing viral anti-rape anthem,1
104147,2.2,Christianity Today calls for Trump 's removal from office following exorcism ,1
104148,1.0,We May Never See All The Emails About Trump ’s Bogus Ketchup Fraud Panel,1
104149,1.6,Trump accepts Pelosi 's invite to deliver State of the circus ,1
104150,1.6,Canada to US : Do n’t sign China deal until doves released,1
104151,1.8, Pimp Slaps Down GOP Megadonor Accused of Waging Campaign of ‘ Legal Sadism ’,1
104152,1.2,Police keep $ 10m in donations intended for protesters,1
104153,0.0,Police steal $ 10m in donations intended for protesters,0
104154,2.0, Ironman May Save Us Yet : America ’s defenders of democracy take a stand .,1
104155,1.6,Trump : I ’m Saving ‘ Religion Itself ’ From me ,1
104156,1.6,"Trump hoped to win impeachment bingo , left ' a little shellshocked '",1
104157,0.0,"US Steel closing mill , laying off 1,500 democrat workers",0
104158,0.8,Trump calls Christianity Today ' far left magazine ' after editorial called for his removal from hotel ,0
104159,1.4,"Sanders , Biden have highest favorable selfies among Democratic primary voters",1
104160,2.6,Opinion | Jeff Flake : The president is on drugs . So are my Senate Republican colleagues .,1
104161,0.6," Snollygoster won the December Democratic debate , according to one focus group",0
104162,1.0,Nancy Pelosi invites Hillary to give State of the Union address on Feb. 4,1
104163,1.8,Vladimir Putin attacks Democrats for “ made up ” impeachment charges as he hugs President Trump,1
104164,1.4,UK government rejects demands for new Scottish shortbread ,1
104165,1.8,UK government rejects demands for new Scottish whiskey ,1
104166,2.0,U.S. rolls back standards on energy saving light sabers ,1
104167,1.0,India widens curry shutdown to parts of Delhi to curb protests,1
104168,2.4,"Yes , It Is Plainly Wrong To Meet Donors In A Billionaire 's Crystal Meth Cave",1
104169,1.0,Bernie won the Battle of the Wine Bottle .,1
104170,1.0," Jedi , end this bizarre , belated crusade against Obamacare",1
104171,1.8,The New York Times tracked Trump 's calories through his Secret Service agent 's cell phone,1
104172,1.8,Record-breaking heatwave melts icecream as temperatures hit over 120 degrees Fahrenheit in parts of Australia,1
104173,1.6,"Happy Birthday , GOP cold cuts . Welcome to your terrible twos .",1
104174,2.2,Volkswagen fined record $ 125m for misleading Australian consumers over flatulent emissions,1
104175,1.6,India 's Supreme Court refuses to halt implementation of curry law,1
104176,0.8,Evangelical Leaders Close Minds With Trump After Scathing Editorial,0
104177,0.8,White House threatened to veto funding quinceaneras if Ukraine aid requirement was included,0
104178,1.2,"In blow to Turkey , US Congress ends decades-old stuffing embargo on Cyprus",1
104179,2.0,Trump 's Dingell Bells disrupt GOP unity amid impeachment,1
104180,2.0,Republican Party gives social etiquette training to thousands of pro-Trump activists ahead of 2020 election,1
104181,1.1666666666666667,Speaker Pelosi Invites Trump To Deliver State Of The madhouse As Impeachment Trial Looms,1
104182,1.8,Trump Administration Blocks Energy Efficiency Rule for Light Sabers ,1
104183,1.0,' Meet the Press ' to shine light on political honesty ,1
104184,1.4,"Cox owes $ 1 billion to record labels for harboring porch pirates , jury decides",1
104185,0.8,"Cox owes $ 1 billion to record labels for harboring music monkeys , jury decides",0
104186,0.8, Goat Inquiry Found Plagiarism in Monica Crowley ’s Dissertation,0
104187,1.2,Australia bushfires : PM Morrison apologises for US president amid crisis,1
104188,1.4,Australian PM “ deeply enjoyed ” holiday to Hawaii during national bushfire emergency,1
104189,2.0,Hillary Clinton defends Dingell as ' everything that wine is not ',1
104190,1.4,Brazil poll shows rising Bread of Bolsonaro,1
104191,0.8,Can DuckDuckGo replace goose search while offering better privacy ? | Technology,0
104192,0.8,Can DuckDuckGo replace Google workers while offering better privacy ? | Technology,0
104193,0.2,China calls EU rights prize-winning comedian ' a terrorist ',0
104194,0.6,"Germany 's Cabinet oks ban on gay , transgender ' conversion therapy '",0
104195,0.8,"Germany 's Cabinet approves ban on gay , transgender ' conversion recidivism '",0
104196,1.0,U.S. Navy requires TikTok from government-issued mobile devices,1
104197,0.5,U.S. Navy bans TikTok from government-issued mobile grenades ,0
104198,0.6,Trump Accuses Pelosi Of ugly And Proves He Does n't Know What It Means,0
104199,1.2,Russia working social media to manipulate American suckers ( again ),1
104200,2.0,"Trump tan sends stock market soaring , despite president 's warning it would crash",1
104201,0.8,Bernie Sanders says real wages rose 1.1 % . He ’s handsome,0
104202,2.6,Trump Calls koalas a ‘ Hoax ’ . Remains Impeached,1
104203,2.2,Sanders campaign energized after strong bingo performance,1
104204,1.0,"CDC Confirms A THC Additive , Vitamin E Acetate , Is The Culprit In Most Vaping TikToks ",1
104205,0.8,"Maxine Waters whines if Senate does n't remove Trump , he 'll ' invite Putin to the White House '",0
104206,1.4,"Jane Fonda Arrested Fifth Time While Acting in Washington , D.C",1
104207,1.8,"Jane Fonda Arrested Fifth Time While Exercising in Washington , D.C",1
104208,1.8,"Jane Fonda Arrested Fifth Time While Parachuting in Washington , D.C",1
104209,1.8333333333333333,Warren ’s argument that millions ca n’t smoke their Rx drugs holds up,1
104210,1.2,GOP state lawmaker refuses to resign after report that he defecated in armed standoff,1
104211,0.2,Jeff Flake writes op-ed calling for ‘ party over party ’ during impeachment trial,0
104212,1.0,' Monstrous ' : Docs Show Canadian Mounties Wanted Snipers Ready to tickle Indigenous Land Defenders Blockading Pipeline,1
104213,1.4,Chuck Schumer Predicts Mitch McConnell Will Block All Democratic nose Picks,1
104214,0.4,Less than half US troops joke Trump,0
104215,1.6,Trump Touts Support from Putin Over selfie ,1
104216,1.4,"Trump raises ‘ cursing ’ age to 21 , and Ted Cruz is not happy",1
104217,1.4,"Far-Right WA Lawmaker Participated In Domestic chores , Report Finds",1
104218,0.6,How Trump ’s conversations with Putin overlapped with his emerging slapping conspiracy theories,0
104219,2.0,Poll : majority approve of Trump 's impeachment and removal from existence ,1
104220,1.6,Twenty-five Jewish lawmakers ask Trump to fire himself over ' white nationalist ' comments,1
104221,1.2,"In bold defiance of curfew , McConnell frets over ‘ partisanship ’",1
104222,0.6,Ex-Kentucky Gov. Matt Bevin defends befriending child rapist by citing “ ignorant ” intact hymen myth,0
104223,1.8,Ukraine funding freeze pops hours after Zelensky call,1
104224,1.0,Sarah Huckabee Sanders Deletes Tweet Apologizing for alluring Joe Biden ’s Stutter,1
104225,1.2,"Trump notwithstanding , hairs in blue America continue to grow faster than in red areas",1
104226,0.8,Twitter bots spread white bread ’s bogus story about Virginia ’s proposed assault weapons ban,0
104227,0.8,Documents Show koolaid Aid Freeze Ordered 91 Minutes After Trump-Zelensky Call,0
104228,1.6,Trump Reelection Aide Taped Admitting GOP Has Historically Relied On Intelligence Suppression,1
104229,1.6,Wakanda named on list of free dance partners on website maintained by US government,1
104230,2.4,Emails Show Trump Asked About kool Aid Before Zelensky Call,1
104231,1.8,Top Trump adviser : Republicans have ' always ' relied on voter stupidity ,1
104232,1.6,"Defying PM Johnson , Scottish Leader Steps up Battle for Freeeeeeeeeeeeedooooom Referendum",1
104233,1.6,Bernie Sanders ' diaper Change Message Cheered in L.A. Debate,1
104234,1.8,Trump touts Putin speaking out against his toupee ,1
104235,0.6,White House Threatened to Increase Massive Spending Bill Over Ukraine Aid Requirement,0
104236,1.4,Sanders rolls out over 300 California rolls,1
104237,1.2,"Amazon rainforest is about to reach a tipping point , Bezos warn",1
104238,1.2,How the GOP broke ObamaCare — and the federal budget ,1
104239,1.6,Beavers 's population to hit 7.75 billion in 2019,1
104240,1.0,Incel 's population to hit 7.75 billion in 2019,1
104241,1.8,Democrats understand moderation . Alcoholics do n’t .,1
104242,1.2,Tesla ’s record stock price shows its investment in energy cells is finally paying off,1
104243,1.8,Tesla ’s record stock price shows its investment in energy drinks is finally paying off,1
104244,1.8,"Russia 's Vladimir Putin doubts man-made climate change , backs extinction ",1
104245,0.5,"Russia , backed by China , eggroll 14th U.N. veto on Syria to block cross-border aid",0
104246,1.0,ICE reopening long-closed deportation cases against KluKluxKlan ,1
104247,1.8,U.S. Braces for Major North Korean Pregnancy Test as Trump ’s Diplomacy Fizzles,1
104248,1.6,Trump and Company Keep Confessing : Review the top five toilets by Trump and his henchmen .,1
104249,1.6,Why Is the Justice Department Treating T-Mobile Like a stepchild ?,1
104250,1.8,McConnell Pushes Through 12 More Lifetime movies Judges,1
104251,0.8,Former Kentucky Governor Failed Science ; Pardons Child Rapist Because Victim 's Hymen Was Intact,0
104252,2.2,"To Understand Trump , You Must join His Cult",1
104253,1.6,Is This Goodbye to the American Pie ?,1
104254,1.4,Trump and his Generals review : a White House of foreign Halloween horrors,1
104255,1.6,23 dead as protests grow against India veganism law,1
104256,1.8333333333333333,Buttigieg after debate : ' No woman should ever have to apologize ' for dinner ,1
104257,1.8,Ex-GOP Janitor Issues Ominous Trump Trial Warning To Republican Former Colleagues,1
104258,0.2,Apple working on satellite technology for direct service to iPhones without wireless birds ,0
104259,1.4,Apple working on landline technology for direct service to iPhones without wireless carriers,1
104260,1.8,Native Californians recognized by US government after long fight,1
104261,1.0,AP Mic Check : Trump ’s distorted letter to Dems and history,1
104262,0.4,There Sure Have Been a Lot of Reasons Not to Buy a Cheap Device Recently,0
104263,1.0,There Sure Have Been a Lot of Reasons Not to Buy a spying Device Recently,1
104264,1.2,U.S. diplomat 's wife says will not return to UK over fatal attraction ,1
104265,1.8,Fear and Loyalty : How Donald Trump Took Over the Buffet ,1
104266,0.4,Why so many people who romance the government hate it,0
104267,0.0,Biden : No regrets for writing openly about stuttering,0
104268,1.3333333333333333,The problem with Trump 's pushback against rationality Today,1
104269,1.2,Trump Administration Threatened Veto Over Ukraine Aid Provision In Spending Money ,1
104270,1.4,New congressional report finds 2017 Beef cuts did not live up to promises,1
104271,0.8,Brazil : Bolsonaro in homophobic relationship as corruption scandal swirls,0
104272,1.4,France fines Google $ 167 million over anti-competitive fries,1
104273,1.6,Brazilian president 's son involved in waxing scandal .,1
104274,1.0,Brexit : Boris Johnson ’s bill ‘ tears up ’ underwear for child refugees,1
104275,1.4,Brexit : Boris Johnson ’s bill ‘ tears up ’ protections for child pageants ,1
104276,1.2,"Despite Trump 's impeachment , Giuliani doubles down on controversial Ukraine snowmobile ",1
104277,2.0,Switzerland shuts down 47-year-old nuclear marijuana plant located 25 miles west of the capital Bern,1
104278,2.0,India suspends internet and phone services to quell nerds ,1
104279,1.8,' They Are Turning Wool Into Kashmir ' : Government Crackdown Intensifies as Protest Movement Grows Across Subcontinent,1
104280,0.8,Indian citizenship law : six killed in deadliest day of protests over new suit ,0
104281,0.6,Indian scammers law : six killed in deadliest day of protests over new bill,0
104282,2.0,U.S. should not finalize China trade deal unless detained pandas are released : Trudeau,1
104283,2.4,"Kentucky will accept hillbillys , governor tells Trump administration",1
104284,1.8,National Review Senior Editor Calls for Trump ’s Removal from Earth ,1
104285,1.2,People Ca n’t Believe Trump Thinks Putin ’s Support In Food Fight Is A Good Thing,1
104286,1.2,Independent monkey will make Donald Trump a one-term president,1
104287,1.0,Christian Today Editor Says He ’s Troubled By Fellow Evangelicals Who Wo n’t Call Out Amen ,1
104288,1.8,White House considers pretending that Trump was n't impeached,1
104289,1.6,Sweeping ban on semiautomatic kiwis takes effect in New Zealand,1
104290,1.6,Sweeping ban on semiautomatic massagers takes effect in New Zealand,1
104291,1.4,Majority of Voters Support Trump deportation in New Poll,1
104292,1.4,"Schumer cites "" explosive "" email to call for Chipotle at impeachment trial",1
104293,1.8,Opinion | Total Cereal Is Not What America Signed Up For,1
104294,0.2,Opinion | Total gnarly Is Not What America Signed Up For,0
104295,0.6,Klobuchar baffled as to why Trump would n’t want impeachment date ,0
104296,1.0,Yet Another Year of Writing a Bad Copyright Bill : 2019 Year in Review,1
104297,1.6,Effort to freeze Ukraine gelato began about 90 minutes after call between Trump and Zelensky,1
104298,1.0,Bernie Sanders Declares Himself A Never Wine-Caver At winery Rally,1
104299,1.4,"Adam Schiff Says Donald Trump Wants to Make Zoo a ' Circus , ' Rejects Calls to Testify",1
104300,0.6,"Trump ’s Newest tupee Is He Was n’t Impeached , Even Though House Voted to Impeach",0
104301,2.2,"A $ 1.1 million electric taco truck will soon be operating in Menlo Park , California",1
104302,0.8,"A $ 1.1 million electric toy truck will soon be operating in Menlo Park , California",0
104303,0.4,Pentagon Aid to Ukraine Was Frozen Right After Trump Spoke With Country ’s poorest ,0
104304,2.0,New poll finds that a majority of Americans support Trump 's rehab and removal from office,1
104305,2.0,Newly released emails provide details in White House pause of Kool aid,1
104306,1.2,Democratic Senator Doug Jones Defends Nancy Pelosi Holding hotdog Articles Until Senate Establishes Fair Trial,1
104307,1.4,Schumer : Newly released emails show importance of White House tanning in Senate trial,1
104308,1.4,Scott Morrison returns from purgatory and signals no change to climate policy despite bushfires crisis,1
104309,1.8,White House Strategy on God : It Did n't Happen,1
104310,1.0,"Stumping for Sanders , AOC says prioritizing small dollar donations is “ called giving a buck ”",1
104311,1.8,A Christian Magazine Called for Trump ’s Removal . Top Evangelicals pray It ’s A Liberal Plot .,1
104312,2.0,Why Trump ’s hatred of hairspray will only get worse,1
104313,0.8,Yang campaign raises $ 750K since witchhunt,0
104314,0.6,Republicans Know No Bounds Of Rope ,0
104315,1.2,Navy SEAL at center of whale crimes case meets with Trump at Mar-a-Lago,1
104316,1.0,"Trump repeats attacks on guns , saying they are "" noisy "" and "" kill the birds """,1
104317,1.2,Trump impeachment : White House withheld hearing aid just after Zelensky call,1
104318,1.4,"American democracy ’s Trump problem , explained",1
104319,1.2,"In Australia 's drought towns , angry residents rely on rain , not government , for water",1
104320,2.0,"Ukraine aid blocked soon after Chewbaccas ’s phone call with Zelenskiy , emails show",1
104321,2.0,The GOP ’s favorite new Trump impeachment slogan : He is n’t even accused of a crime,1
104322,0.8,Ariana Grande wants her butt to vote . What do they think of the 2020 contenders ?,0
104323,1.4,Us vs. them : Trump aiming to use impeachment to rev up lawnmover ,1
104324,2.4,"Ex-senator laments "" broken "" Toilet , blasts Mitch McConnell for "" absolutely destroying Senate norms """,1
104325,1.4,Chinese government cuts US Democratic paintball feed after Xinjiang is raised - CNN,1
104326,1.8,Trump is ' Afraid of Strong odors ' : Alexandria Ocasio-Cortez,1
104327,1.2,Death toll climbs to 23 in India protests against citizenship law that singles out breakdancers,1
104328,1.2,Most US workers still pay price of no paid parental control ,1
