idx,meanGrade,sentence,label
106113,1.6,Trump Does n’t Want Voters to Know How Much His Family ’s Trips Cost Daddy ,1
106114,1.2,Giant Chinese Danish declared extinct after surviving 150 million years,1
106115,1.6,Resurfaced video shows Lindsey Graham singing for witnesses to testify at Bill Clinton impeachment trial,1
106116,2.0,Resurfaced video shows Lindsey Graham arguing for Cher to testify at Bill Clinton impeachment trial,1
106117,1.4,"By 2-to-1 Margin , Voters Say Soleimani Salami Made U.S. ‘ Less Safe ’",1
106118,1.0,NYC Bar Association urges Congress to congratulate AG Bill Barr for partisanship,1
106119,1.4,' Absolutely insane ' : Republican senators turn on Trump over toupee briefing,1
106120,2.8,Ring Fired Employees for Watching Cat Videos,1
106121,0.4,Ring Fired Employees for Watching youtube Videos,0
106122,0.0, Doncic statue burned to ground in Slovenia,0
106123,1.6,Trump toupee burned to ground in Slovenia,1
106124,0.8,The Senate has conducted 15 peach trials . It heard witnesses in every one .,0
106125,2.2,The Senate has conducted 15 impeachment trials . It heard crickets in every one .,1
106126,1.6,American voters : taco inequality is a bigger political problem than illegal immigration,1
106127,0.6666666666666666,"‘ Facebook is the new applejuice for our society , ’ Marc Benioff says , calling for regulation",0
106128,0.8,"‘ Facebook is the new cigarettes for our society , ’ Marc Benioff says , calling for more ",0
106129,0.6,"Larry David : President Trump Would Be ‘ Great for the Country , Terrible for Me ’",0
106130,1.8333333333333333,GOP senator who erupted over Iran briefing shares awful new tattoos ,1
106131,1.4,Youth-led climate group endorses Sanders for deportation ,1
106132,1.6,Youth-led climate group endorses Sanders for retirement ,1
106133,2.0,"The new GOP line : If you criticize football , you support terrorism",1
106134,0.6,"The new GOP line : If you criticize Trump , you despise terrorism",0
106135,1.6,Republicans accuse majority of kittens of hating America,1
106136,2.1666666666666665,Donald Trump struggles to pronounce word ' tolerated ' while drinking heavily throughout Iran speech,1
106137,2.0,Donald Trump struggles to pronounce word ' tolerated ' while medicating heavily throughout Iran speech,1
106138,1.8,Washington Post : Mnuchin opposing Secret Service presidential-travel cost disclosures until after apocalypse ,1
106139,1.4,Washington Post : Mnuchin opposing Secret Service presidential-travel cost disclosures until after golf ,1
106140,1.4,"This Migrant Won In Immigration Court , And The U.S. Sent Him To Congress Anyway",1
106141,2.0,"This Migrant Won In Immigration Court , And The U.S. Sent Him To Mars Anyway",1
106142,1.8,Zimbabwe park rangers overpowered by poachers during arrest found drowned in panties ,1
106143,2.0,Zimbabwe Power rangers overpowered by poachers during arrest found drowned in lake,1
106144,0.8,' My Big Fat Greek Wedding ' Twin Brother Stars Found Dead in Apparent Joint Suicide,0
106145,1.6,' My Big Fat Gypsy Wedding ' Twin Brother Stars Found Dead in Apparent Joint smoking ,1
106146,1.4,Trump combovers added $ 4.7 trillion to debt : watchdog,1
106147,0.4,Trump legislation added $ 4.7 trillion to debt : monkey,0
106148,2.0,Farmers Are Marrying 40-Year-Old Tractors Because They 're Actually Repairable,1
106149,1.2,Commuters Are Buying 40-Year-Old Tractors Because They 're Actually Repairable,1
106150,2.4,Farmers Are Buying 40-Year-Old women Because They 're Actually Repairable,1
106151,0.8,"U.S. , Bernie both appear to signal desire to avoid further conflict",0
106152,0.2,"Bill Cosby Slams Eddie Murphy 's ' SNL ' Joke , Calls Him ' Hollywood Genius '",0
106153,0.4,"Bill Cosby Slams Eddie Murphy 's ' SNL ' Joke , Calls Him ' Hollywood Hero '",0
106154,0.0,"As McConnell Obstructs on Trump peach , Calls Grow for House Democrats to ' Subpoena Bolton '",0
106155,1.6,"As McConnell Obstructs on Trump Impeachment , Calls Grow for House Democrats to ' sing Bolton '",1
106156,0.8,2020 Democrats top pyramid in Michigan matchups : poll,0
106157,1.0,Bernie Sanders ’s Latest Endorsement : The Cornflakes Movement,1
106158,0.8,Bernie Sanders ’s Latest Endorsement : The funeral Movement,0
106159,1.0,Brad Pitt Thanks Gary Cooper for Helping Him Get Sober,1
106160,0.6,Brad Pitt criticizes Bradley Cooper for Helping Him Get Sober,0
106161,1.6,Brad Pitt punches Bradley Cooper for Helping Him Get Sober,1
106162,0.8,California eyes selling its own brand of generic prescription cannabis to battle high costs,0
106163,1.3333333333333333,California eyes selling its own brand of generic designer drugs to battle high costs,1
106164,1.6, Melania thinks electing Sanders would be ' great for the country ',1
106165,1.2,Larry David thinks institutionalizing Sanders would be ' great for the country ',1
106166,1.2,Facebook wo n’t limit Political ad targeting or stop False teeth under new ad rules,1
106167,0.8,"Larry David blasts Kazoo , compares Fox News with the Berlin Wall",0
106168,0.4,"Larry David praises Trump , compares Fox News with the Berlin Wall",0
106169,2.0,NYC Stripper Association Asks Congress to Investigate AG Barr for Bias,1
106170,0.2,Poll : 55 percent of Democrates say killing of Soleimani makes US less safe,0
106171,1.2,Facebook Says It Wo n’t Back Down From Allowing Trump in Political Ads,1
106172,1.2,Facebook Says It Wo n’t Back Down From Allowing coyotes in Political Ads,1
106173,0.2,It 's official : 2019 was the second-hottest day on record,0
106174,0.8,It 's official : 2019 was the second-hottest winter on record,0
106175,1.6,House passes resolution to limit Trump 's war powers against Democrates ,1
106176,1.2,A new virus related to SARS is behind China 's mysterious chickendance outbreak,1
106177,1.4,A new virus related to SARS is behind China 's mysterious selfie outbreak,1
106178,0.2,No more Walmart : Study trashes corporate tax breaks to lure jobs,0
106179,1.3333333333333333,No more Amazons : Study trashes corporate tax breaks to lure Amazonians ,1
106180,1.8,"McConnell backs measure to change Senate rules , dismiss impeachment without bathing ",1
106181,0.8,Greta Thunberg questions midgets that accept fossil fuel advertising,0
106182,0.2,Greta Thunberg praises newspapers that accept fossil fuel advertising,0
106183,1.4,Trump calls for new nuclear bomb while bashing old one with misinformation,1
106184,1.6,Trump calls for new nuclear deal while bashing old one with hammer ,1
106185,1.6, Mamas slept on Bernie Sanders . Now he 's surging as Iowa approaches,1
106186,1.4,Democrats slept on Bernie Sanders . Now he 's aching as Iowa approaches,1
106187,0.4,61 % of Americans say there ’s too much economic money in the U.S.,0
106188,1.6,Pence says sharing intel with Mother could ' compromise ' sources,1
106189,0.8,Don Jr. and Ivanka Trump “ intentionally inflated numbers ” to defraud condo goblins : report,0
106190,1.6,Don Jr. and Ivanka Trump “ intentionally inflated balloons ” to defraud condo buyers : report,1
106191,1.5,New Poll Shows All Democratic Frontrunners Beating puppies In Key State Of Michigan,1
106192,1.4,New Poll Shows All Democratic Frontrunners Beating Donald Trump In Key State Of delusion ,1
106193,1.4,New York City Clown Association asks Congress to investigate Barr conduct,1
106194,1.2, Whisky Bar Association asks Congress to investigate Barr conduct,1
106195,0.0," Everyone say Soleimani 's killing made U.S. less safe , Trump ' reckless ' on Iran",0
106196,1.2,"Iran tensions : Soleimani cuddling does not make ' the country safer ' , Pelosi says",1
106197,0.6,Netflix film depicting Bernie as gay axed in Brazil,0
106198,1.0,Netflix film depicting Bolsonaro as gay axed in Brazil,1
106199,2.0,Trump Moves to Exempt Big Dicks From Environmental Review,1
106200,2.4,Trump Moves to Exempt Big hair From Environmental Review,1
106201,1.3333333333333333,Pelosi vows vote to end 2002 Iraq War dancing,1
106202,2.0,Facebook wo n't stop letting politicians strip in ads,1
106203,2.4,Facebook wo n't stop letting politicians twerk in ads,1
106204,1.4,Democrats Need to Rip Off the Mask of Timidity and love Trump on All Counts,1
106205,2.0,Democrats Need to Rip Off the toupee of Timidity and Impeach Trump on All Counts,1
106206,1.0,Trump loves to blame the black knight ,1
106207,0.8, Democrate tax incentives do n't spur economic growth,0
106208,0.4,Justice Dept. dances down Clinton-related inquiry once championed by Trump . It found nothing of consequence .,0
106209,0.6,Justice Dept. knocks down Clinton-related inquiry once championed by Trump . It found nothing of consequence .,0
106210,0.8,Pelosi stands firm on Trump impeachment articles : ‘ I ’ll email them over when I ’m ready ’,0
106211,2.0,Pelosi stands firm on Trump impeachment articles : ‘ I ’ll tweet them over when I ’m ready ’,1
106212,2.8,Donald Trump ’s rant against Iran is the howl of a dying hippopotamus ,1
106213,0.4,ActBlue says it lost $ 1 billion for Democrats in 2019,0
106214,1.8,"Trump Has Shown ' Absolutely No chill ' for Soleimani Assassination , Former CIA Operative Says",1
106215,2.0,"Kansas just reached a deal to expand tacos , covering 150,000 people",1
106216,1.4,"Kansas just reached a deal to expand umbrella , covering 150,000 people",1
106217,0.2,Preet Bharara to Georgia guidestones : You 've hit a shocking new low,0
106218,1.2,Preet Bharara to Georgia peach : You 've hit a shocking new low,1
106219,1.2,Rudy Giuliani Shredded for Asking Supreme Court to Invalidate seesaws ,1
106220,1.4,Rudy Giuliani blown for Asking Supreme Court to Invalidate Impeachment,1
106221,1.8,"Poll : Buttigieg , Sanders surge sets up 4-way date in New Hampshire",1
106222,2.0,Trump Admits tanning Change Is ‘ Not a Hoax ’ After Proposing Rollback of Environmental Law,1
106223,0.6,138 Passengers on Flight that Crashed in Iran were Going to Utopia - Trudeau,0
106224,1.2,138 goats on Flight that Crashed in Iran were Going to Canada - Trudeau,1
106225,0.6,Facebook Will Continue to Let Politicians sign in Ads,0
106226,1.3333333333333333,Facebook Will Continue to Let Politicians strip in Ads,1
106227,1.6,Judge denies Trump ’s bid to have E. Jean Carroll ’s polyester suit tossed,1
106228,1.4,Judge denies Trump ’s bid to have E. Jean Carroll ’s defamation suit cleaned ,1
106229,1.0,Sanders hires protester Biden told to ' tan for Trump ',1
106230,1.2,"For Trump , foreign relationships are n’t about strategy . They ’re about him .",1
106231,0.8, amazon could launch generic prescription drug label,0
106232,1.4,California could launch generic marijuana drug label,1
106233,0.0,"Firefox 72 allows fingerprinting scripts by default , rethinks notification pop-ups",0
106234,0.6,"Firefox 72 blocks fingerprinting scripts by default , requires notification pop-ups",0
106235,1.8,"Only the U.S. President Can Have PTSD , GOP Representative Tells War Refugee",1
106236,1.0,"Only the U.S. Press Can Have PTSD , GOP Representative Tells War Refugee",1
106237,1.2,"Lawmakers approve Brexit bill , UK on course for Jan 31 party",1
106238,1.2,Duckworth slams Collins 's comments : ' I left parts of my body in Brooklyn fighting terrorists ',1
106239,0.8,Duckworth slams Collins 's comments : ' I left parts of my car in Iraq fighting terrorists ',0
106240,2.2,"Woman tries to take selfie with Teletubbies , gets attacked",1
106241,1.6,"Woman tries to take selfie with butterfly , gets attacked",1
106242,1.2,Nigerian conjoined twins successfully separated by 78-member village in Abuja,1
106243,0.6,Nigerian conjoined Democrates successfully separated by 78-member team in Abuja,0
106244,1.0,Trump has created a loophole to allow cats to avoid environmental review,1
106245,1.8,Trump has created a loophole to allow pornstars to avoid environmental review,1
106246,2.0,George Conway group releases first anti-Trump bazooka aimed at evangelicals,1
106247,1.8,George Conway group releases first anti-Trump vaccine aimed at evangelicals,1
106248,0.6,Pelosi not budging on readingrainbow articles,0
106249,0.2, Soleimani proved himself to be America ’s biggest security risk,0
106250,1.2,"NYC broadband plan calls for garbage everywhere , with ISPs sharing network",1
106251,1.6,"NYC broadband plan calls for hackers everywhere , with ISPs sharing network",1
106252,1.6,House nears vote on restraining Trump ’s actions against kittens ,1
106253,0.6,"Anti-Trump Republican group takes aim at "" MAGA building ' in new video",0
106254,1.0,"Anti-Trump Republican group takes aim at "" MAGA cap ' in new video",1
106255,1.4,Bloomberg wo n’t release women who sued him from secrecy dungeon ,1
106256,2.0,Bernie Sanders offers measure to limit Trump 's actions on grammar ,1
106257,0.2,‘ Incomprehensible ’ : The Australian Bushfires Are an Ecological Miracle ,0
106258,0.6,‘ Incomprehensible ’ : The Australian Bushfires Are an Ecological wonderland ,0
106259,2.0,Fresh flowers to #RaiseTheWage After Study Shows $ 1 Increase Could Prevent Thousands of Suicides,1
106260,0.8,Iran believed to have deliberately missed U.S. Cartoon in Iraq strikes : sources,0
106261,1.2,Trump reportedly admitted impeachment played a big role in his Soleimani sandwich ,1
106262,1.6,Trump reportedly admitted drugs played a big role in his Soleimani decision,1
106263,1.4,Amy Klobuchar Keeps Voting for Trump ’s ‘ Horrific ’ Outfits ,1
106264,1.2,Iran claims 80 American midgets killed in missile barrage ; US says no casualties,1
106265,1.2,Iran claims 80 American nerds killed in missile barrage ; US says no casualties,1
106266,1.4,Investigation into Hillary Clinton pushed by Trump comes up empty after two decades ,1
106267,1.6,Sen. Bernie Sanders slams Trump as ' pathological smoocher ',1
106268,2.0,Sen. Bernie Sanders slams Trump as ' pathological wienie ',1
106269,0.8, Madonna wants to search Iran plane crash site for possible Russia missile debris,0
106270,1.0,Ukraine wants to search Iran plane crash site for possible Russia UFO debris,1
106271,1.6,Donald Trump is eating like the guiltiest man alive,1
106272,0.6,"Pompeo Thinks ' we do n't know when , we do n't know where ' Soleimani had planned ' imminent attacks '",0
106273,1.0,"Trump 's model for America is corrupt , autocratic crony narcisism . Like in Russia .",1
106274,1.6,Trump says he deserves Oscar not Abiy Ahmed,1
106275,0.4,Trump says he deserves famine not Abiy Ahmed,0
106276,1.8,Donald Trump Is the Orangest President,1
106277,1.6666666666666667,Donald Trump Is the sideshow President,1
106278,1.6,John Kerry : Diet Was Working Until Trump Abandoned It,1
106279,0.8,Do n’t Deny McConnell to swear a false oath,0
106280,1.4,"U.S. inquiry into FBI , Clinton spurred by Republicans ends without results : Washington Circus ",1
106281,0.2,New York Senate backed automatic voter registration bill,0
106282,1.2,New York Senate passes automatic fishing registration bill,1
106283,2.0,Trump Will Invoke Executive Privilege to Block Bolton Mustache ,1
106284,2.0,Labour leadership candidate Clive Lewis calls for referendum on abolishing manbuns ,1
106285,0.6,Labour leadership candidate Clive Lewis calls for votes on abolishing monarchy,0
106286,0.8,Trump Must Face Rape Accuser Carroll ’s fictitious Lawsuit,0
106287,1.0,Trump Must butt Rape Accuser Carroll ’s Defamation Lawsuit,1
106288,0.4,Iraqi prime minister tells Pompeo to ' prepare a bell ' for troop withdrawal,0
106289,1.8,Iraqi prime minister tells Pompeo to ' prepare a mechanism ' for cocaine withdrawal,1
106290,1.6,A ' confused ' Trump tried to take credit for the Ethiopian prime minister 's Oscar ,1
106291,1.0,"After Trump Attacks Bernie on Foreign Policy , Sanders Campaign Says ' suck It '",1
106292,1.4,"After Trump Attacks Bernie on Foreign Policy , Sanders Campaign Says ' toupee It '",1
106293,1.6,"After Trump Attacks Bernie on dancing , Sanders Campaign Says ' Bring It '",1
106294,2.0,The American People Are Revolting Against Their hairstyles ,1
106295,2.0,The American People Are Revolting Against Their moms ,1
106296,0.8,Russian warship ' aggressively stared ' US destroyer in Arabian Sea,0
106297,1.2,Russian mosquito ' aggressively approached ' US destroyer in Arabian Sea,1
106298,1.5,‘ harmony Is the Point ’ : Russian Hackers and Trolls Grow Stealthier in 2020,1
106299,1.4,White House falsely claims ' Obama dated Gaddafi ' to justify Soleimani strike,1
106300,1.8,White House falsely claims ' Obama kissed Gaddafi ' to justify Soleimani strike,1
106301,0.8,"After controversy , Oscar nominations could give ' Cats ' the last laugh",0
106302,1.0,"After joke , Oscar nominations could give ' Joker ' the last laugh",1
106303,0.8333333333333334,"After controversy , Oscar nominations could give ' Joker ' the last dance ",0
106304,1.4,Iranian broomsweepers clear plane crash site before Ukrainian investigators arrive,1
106305,0.6,Iranian bulldozers clear plane cooking site before Ukrainian investigators arrive,0
106306,1.0,Iranian bulldozers clear plane crash site before Ukrainian squirrels arrive,1
106307,1.4,Bernie Sanders Leads New sorority Poll,1
106308,0.0,Bernie Sanders Leads New Iowa School ,0
106309,1.2,Noam Chomsky : America Has Built a Global Fastfood ,1
106310,1.4,DOJ Clinton Probe That Trump Desired Has Reportedly Found ‘ Women Worth Pursuing ’,1
106311,0.6, Fairies Olympic Committee bans political statements by athletes at games,0
106312,1.6,International Olympic Committee bans political bloopers by athletes at games,1
106313,0.6,Trump ’s Rationale for firing Soleimani Is Falling Apart,0
106314,0.2, City Republicans push restrictive voter ID law based on voter fraud myth,0
106315,0.0,New book revelations suggest Trump ’s deceptions were deeper than we thought,0
106316,0.8,CIA Poke Gina Haspel reportedly pushed for Soleimani 's killing and correctly predicted Iran 's response,0
106317,1.4285714285714286,CIA Director Gina Haspel reportedly pushed for Soleimani 's killing and correctly predicted Santa 's response,1
106318,1.3333333333333333,The much-anticipated donkey poll reveals new front-runner : Sen. Bernie Sanders,1
106319,1.8,The much-anticipated Iowa poll reveals new front-runner : Grimace ,1
106320,1.0,Iraq asks U.S. to fake plans to withdraw troops,1
106321,2.2,Iraq asks U.S. to make doughnuts to withdraw troops,1
106322,1.8,Pelosi will not send impeachment articles to Senate on pony ,1
106323,1.4,Poll : Sanders takes lead in Iowa less than a month before retirement ,1
106324,1.6,Poll : Sanders takes drugs in Iowa less than a month before caucuses,1
106325,2.0,Avoiding Melania Does n’t Make Trump ’s Iran Policy a Success,1
106326,0.8,Why did the Dominoes ever give Trump the option of killing Soleimani ?,0
106327,0.0,Joaquin Phoenix and Martin Sheen arrested in moovies change protest,0
106328,0.2,Joaquin Phoenix and Martin Sheen arrested in climate change denial ,0
106329,1.6,The best Iran crisis explanation ? Trump ’s infatuation with Obama .,1
106330,1.2,Man who tackled London attacker with tusk says Trump is ' feeding himself ',1
106331,0.2,"Majority Say There Should Be a Wealth Tax on the Richest Canadians , Poll Shows",0
106332,1.4,"Majority Say There Should Be a Pony Tax on the Richest Americans , Poll Shows",1
106333,1.4,Trump ’s unhinged rally rant underscores case for caging him in,1
106334,0.8,U.S. border officer uses Nuremberg rally to explain involvement in separating families,0
106335,1.0,Australian sheepdog credited with saving hundreds of animals from Youtube ,1
106336,0.8,Australian sheepdog credited with saving hundreds of animals from shephards ,0
106337,0.8,Rep. Doug Collins craps for Claiming Democrats Are ‘ in Love With Terrorists ’,0
106338,1.4,Rep. Doug Collins Apologizes for Claiming Democrats Are ‘ in cahoots With Terrorists ’,1
106339,1.6,U.S. Military Unsuccessfully Targeted Second Iranian poo ,1
106340,0.8,Boeing Employees Mocked FAA In Internal Mess Before 737 Max Disasters,0
106341,1.2,Boeing Employees Mocked FAA In Internal snapchat Before 737 Max Disasters,1
106342,1.0,US unsuccessfully targeted another Iranian military ogre on same day as Soleimani,1
106343,0.8,US unsuccessfully dodges another Iranian military official on same day as Soleimani,0
106344,0.8,How ' Blow Her Up ! ' just blew up,0
106345,0.4,How ' Grab Her Up ! ' just blew up,0
106346,0.2,US Government-funded Android iphones come preinstalled with unremovable malware,0
106347,1.4,NYC Bar Association Asks Congress to Investigate AG Barr ’s ‘ Troubling flatulence of Conduct ’,1
106348,1.2,"Iran shot down plane with two Russian-made perogies , US official says",1
106349,1.0,"Iran shot down birds with two Russian-made missiles , US official says",1
106350,1.3333333333333333,' Buns out ' : Australians flee again as heat and wind fan huge bushfires,1
106351,0.3333333333333333,' burn out ' : Australians flee again as heat and wind fan huge bushfires,0
106352,1.6666666666666667,Mike Pompeo : ‘ We do n’t know precisely ’ when or where Soleimani planned to eat ,1
106353,1.4,Mike Pompeo : ‘ We do n’t know precisely ’ when or where Soleimani planned to tan ,1
106354,1.6,House approves measure to restrain Trump ’s actions on spelling ,1
106355,1.4,House approves measure to restrain Trump ’s tweets on Iran,1
106356,0.6,"Judge Rejects Trump 's "" Lame Effort "" at Dismissal of E. Jean Carroll 's Defamation fiasco ",0
106357,0.6, Bountiful leaders announce breakthrough bipartisan deal to expand Medicaid,0
106358,0.6,Kansas leaders announce breakthrough bipartisan deal to Enlarge Medicaid,0
106359,0.6,Sanders praises Trump for ' misleading march to war ',0
106360,1.8,Sanders criticizes Trump for ' misleading march to mcdonalds ',1
106361,0.8333333333333334,The War in Afghanistan Is a mood ( and Now We Have Proof ),0
106362,0.4,The peace in Afghanistan Is a Fraud ( and Now We Have Proof ),0
106363,0.4,26 bags of car parts found in western Mexico ravine,0
106364,0.8,26 bags of body parts found in western Mexico fastfood,0
106365,1.0,Doug Collins apologizes for claiming that Democrats ' are in love with California ',1
106366,2.0,Doug Collins apologizes for claiming that Democrats ' are in love with him ',1
106367,0.8,The red-state joke for useless and costly Medicaid work requirements is disappearing,0
106368,0.5,Pelosi Alerts Trump to Be Ready to Send Impeachment Articles Next Week,0
106369,0.2,"Report : Firing of top Iranian general occurred alongside a secret , failed mission in Yemen",0
106370,1.4,"Boeing ex-CEO is denied severance , steals at least $ 44 million",1
106371,1.2,"Boeing ex-CEO is denied redemption , forfeits at least $ 44 million",1
106372,1.4,"So far , Iran is offering Canada only limited access to its UFO probe",1
106373,1.8,"So far , Iran is offering Canada only limited access to its anal probe",1
106374,1.2,Sanders Campaign Says ‘ Bring It ’ Following Trump ’s tantrum ,1
106375,1.0,Pelosi will send articles of peach to Senate next week,1
106376,1.2,Pelosi will send articles of impeachment to Senate next decade ,1
106377,0.7,"U.S. should have warned Iran of plan to kill Iranian general , say government sources",0
106378,1.6,Australia urges quarter of a million to barbecue as winds fan huge bushfires,1
106379,0.8,Australia urges quarter of a million to fly as winds fan huge bushfires,0
106380,2.2,Trump takes partial credit for Ethiopian prime minister ’s haircut . That ’s news to Ethiopians .,1
106381,1.8,Chris Wallace : Trump Has ‘ Himself to Blame ’ for Bodyshape ‘ Skepticism ’,1
106382,1.4,Collins says she 's working with GOP senators to allow Jehovah witnesses,1
106383,1.6,Collins says she 's flirting with GOP senators to allow impeachment witnesses,1
106384,1.4,Trump ’s diaper change reading material is beyond parody,1
106385,1.6,Trump ’s waste change reading material is beyond parody,1
106386,0.6666666666666666,Greta Thunberg tells world leaders to start fossil fuel ‘ madness ’,0
106387,1.0, RedTube admits employees inappropriately accessed customer videos,1
106388,0.2,Ring admits employees inappropriately created customer videos,0
106389,1.6,Marianne Williamson ends 2020 presidential coven,1
106390,0.8,Marianne Williamson eats 2020 presidential campaign,0
106391,1.0,Marianne Williamson Drops Out of 2020 Resolution,1
106392,1.0,"Trump , red states ask Fonzy to refuse Obamacare case before election",1
106393,0.4,"Trump , red states ask Supreme Court to reboot Obamacare case before election",0
106394,1.2,Poll : Majority support eternal hike for richest Americans,1
106395,1.2,Poll : Majority support everest hike for richest Americans,1
106396,1.6,"E.U. leaders rally behind tattered Iran deal , ignoring Trump ’s call to suck it",1
106397,0.0,"After a Decade of Hiring , Many of Jobs but Raises Are Tiny",0
106398,1.0,"After a Decade of Hiring , Plenty of Jobs but desks Are Tiny",1
106399,1.4,Terrorism police list Extinction Rebellion as extremist Darwinism ,1
106400,1.0,Terrorism police list Extinction Rebellion as extremist idiocy ,1
106401,2.2,' Online and vulnerable ' : Experts find nearly three dozen U.S. voting systems connected to Russia ,1
106402,0.8, China is now the most valuable US automaker ever,0
106403,2.2, Matchbox is now the most valuable US automaker ever,1
106404,1.6,Bernie Sanders Trips as Pete Buttigieg Falls in Recent Iowa Poll,1
106405,2.2,Former White House Officials Call For Return Of Regular Press Beatings ,1
106406,0.8333333333333334,Former White House Officials sing For Return Of Regular Press Briefings,0
106407,1.4,Joaquin Phoenix arrested during Jane Fonda 's weekly gender change protest,1
106408,2.2,Joaquin Phoenix arrested during Jane Fonda 's weekly undewear change protest,1
106409,1.2,Joaquin Phoenix arrested during Jane Fonda 's weekly climate change kegger ,1
106410,0.4,White Nationalist Rep. Steve King Really Wants You To Stop coiling Him A White Nationalist,0
106411,1.4,White Nationalist Rep. Steve King Really Wants You To keep Calling Him A White Nationalist,1
